ANCHORAGE MAKERSPACE,https://www.anchoragemakerspace.com/,"The Anchorage Makerspace is a non-profit, cooperative community workshop in Anchorage, Alaska"
UAF Makerspace,https://t3.uaf.edu/,"The UAF Makerspace welcomes all UA students, staff, and faculty with an interest in Making"
Makerspaces: Home,https://lam.alaska.gov/makerspaces,"Dec 15, 2022 — Anchorage Makerspace is a non-profit, cooperative, community workshop offering social space for makers, inventors, artists and others to "
Makerspace - UAF Center for Teaching and Learning,https://ctl.uaf.edu/makerspace/,"As a cross-modality hub, it is designed to inspire interdisciplinary collaboration and explore the edges of technology-enabled teaching and learning"
About the Makerspace,https://www.anchoragemakerspace.com/about-2/,"Our mission is to create a cooperative community workshop in Anchorage, Alaska"
| Juneau Makerspace,http://juneaumakerspace.org/,"Learn about our exciting new equipment, work and volunteer opportunities, and events like our popular Monday Open Studio Nights"
UAF Makerspace - About Us,https://sites.google.com/alaska.edu/uaft3makerspace/about-us,"The Makerspace is a collaboration between the grant funded Upward Bound Program, the University of Alaska Fairbanks, and the nonprofit T3 Alliance (Teaching "
MakerSpace After School Club - HCOA,https://homerart.org/education/makerspace-after-school-club/,"Nov 4, 2024 — An art-based, indoor-outdoor after school program that serves our K-2 Fireweed and Paul Banks Elementary communities"
Anchorage Makerspace,https://www.facebook.com/AnchorageMakerSpace/,"Anchorage Makerspace, Anchorage, Alaska"
"At an Alaska maker's space, Indigenous artists connect ...",https://www.npr.org/2023/12/19/1220443870/at-an-alaska-makers-space-indigenous-artists-connect-with-millennia-of-tradition,"Dec 19, 2023 — It is the nation's northernmost maker's space, a place where Indigenous artists can create things like walrus ivory earrings, figurines made "
T3 Alaska - T3 Alliance Alaska - Educational Program in ...,https://t3.alaska.edu/,"Makerspace equipment includes 3D printers, laser cutters, drones, and more"
Alaska Learning Makerspace,https://aklearns.org/alaska-learning-makerspace/,"The Region 16 Comprehensive Center is planning the launch of Alaska Learning Makerspaces, facilitated by Alaskan educator Scott Christian, Ph"
About+Team | Juneau Makerspace,http://juneaumakerspace.org/about-and-team/,"Juneau Makerspace is supported, in part, by a grant from the Alaska State Council on the Arts and the National Endowment for the Arts"
Makerspace,https://www.agsd.us/page/makerspace,ALASKA GATEWAY SCHOOL DISTRICT
Juneau Makerspace (@juneaumakerspace),https://www.instagram.com/juneaumakerspace/?hl=en,A place for making and doing in Juneau
Makerspaces & Mini-Grants,https://t3.alaska.edu/mini-grants/,"Student who receive the funding work with community partners using design thinking model to develop and test a solution, and then present their findings "
"At an Alaska maker's space, Indigenous artists connect ...",https://www.mainepublic.org/2023-12-19/at-an-alaska-makers-space-indigenous-artists-connect-with-millennia-of-tradition,"Dec 19, 2023 — In the northernmost town in the U"
MakerSpace at LFW Registration - HCOA,https://homerart.org/product/9774/,
UAF Makerspace (@uafmakerspace),https://www.instagram.com/uafmakerspace/,Welcome to the Makerspace
A hub for 'makers' thrives in Anchorage,https://www.adn.com/alaska-life/2017/04/21/making-it-work-anchorage-makerspace-creates-a-hub-for-alaska-diyers/,"Apr 21, 2017 — Caleb Lovelace works on a design that will be uploaded to a laser cutter in a class at Anchorage MakerSpace on April 6"
Makerspace in Anchorage Alaska,https://talk.makeict.org/t/makerspace-in-anchorage-alaska/2114,"Oct 16, 2018 — Makerspace in Anchorage Alaska "
Alaska - HackerspaceWiki,https://wiki.hackerspaces.org/Alaska,"Sep 16, 2012 — Alaska is a state, district, or province that is located in USA"
Any maker-spaces or electronics labs in Fairbanks/UAF?,https://www.reddit.com/r/Fairbanks/comments/lomdim/any_makerspaces_or_electronics_labs_in/,There several scattered makerspace communities at UAF that are just starting to come together and get connected
"Alaska Makerspace. Invent, Design, Prototype and Market ...",https://m.facebook.com/GuitarRental,Alaska Makerspace
Makerspace 101,https://www.akasl.org/puffin-news-archive/makerspace-101,"Sep 9, 2019 — Thoughts on Makerspace 101: 101 Non-Tech Makerspace Ideas with Tanna Martin and Deb Tice By Raandi Miller Makerspaces, no matter how "
Anchorage Makerspace,https://makerspacedir.com/listing/anchorage-makerspace/,Anchorage Makerspace
Makerspace Alaska Presentations event Dec 6 -8,https://t3alliance.org/event/makerspace-alaska-presentations-event-dec-6-8/,"Dec 5, 2022 — Details "
What is a Makerspace? Is it a Hackerspace or ...,https://www.makerspaces.com/what-is-a-makerspace/,"A makerspace is a collaborative work space inside a school, library or public/private facility for making, learning, exploring and sharing"
Anchorage Makerspace,https://wooddemand.com/places/anchorage-makerspace/?srsltid=AfmBOopKcDxoyeRwkFx6X988hJBThQydC3nNkl3h745vnwkR57TFCqt9,
"Juneau Makerspace, 3915 N Douglas Hwy ...",https://www.mapquest.com/us/alaska/juneau-makerspace-428414697,"Get more information for Juneau Makerspace in Juneau, AK"
makerspace - Our Alaskan Schools blog,https://ouralaskanschools.edublogs.org/tag/makerspace/,"34 years ago, in the small Southeast Alaska coastal town of Yakutat, Darin Bremner, then a high school student, was involved in an accident at school"
Anchorage Makerspace,https://nextdoor.com/pages/anchorage-makerspace-anchorage-ak/,"1 Fave for Anchorage Makerspace from neighbors in Anchorage, AK"
UAF Makerspace,https://www.youtube.com/channel/UCzdJQ6EjOGoWAIIP-d3BxzQ/videos,More about this channel 
The City & Borough of Sitka Alaska - Teen Lab,https://www.cityofsitka.com/departments/SitkaPublicLibrary/teen-lab,"Teen Lab · AV Production - Record music, make videos, edit photos, and more · Arts and Crafts - Digital art, sewing, drawing, and more · Mini FabLab/Makerspace - "
STEM Standard 2 / Overview,https://www.asdk12.org/domain/6256,Lessons are aligned with Alaska state standards
Juneau Makerspace,https://makerspacedir.com/listing/juneau-makerspace/,Juneau Makerspace
Alaska Makerspace,https://groups.google.com/g/akmakerspace,Alaska Makerspace 
"Anchorage Makerspace, 1406 W 33rd Ave ...",https://www.mapquest.com/us/alaska/anchorage-makerspace-365748046,"Anchorage Makerspace is a vibrant community hub in Anchorage, AK, offering a wide range of classes, events, and activities for makers of all ages and "
UAF Makerspace,https://www.youtube.com/channel/UCzdJQ6EjOGoWAIIP-d3BxzQ,More about this channel 
"Learning, Tutoring, & Other Help Centers at MSU - ...",https://guides.lib.montana.edu/c.php?g=1421125&p=10565974,"Oct 25, 2024 — Tutoring help for ACTG 201 and 200-300 level accounting courses"
Other Makerspaces,http://wiki.makersmiths.org/display/MAK/Other+Makerspaces?src=contextnavpagetreemode,"Anchorage Makerspace, Anchorage, Alaska"
Take a peek into our vibrant beading workshop at The MILL ...,https://www.facebook.com/uafecampus/videos/take-a-peek-into-our-vibrant-beading-workshop-at-the-mill-makerspace-led-by-the-/1595011127952716/,
Downtown Stoughton Makerspace teaches students to ...,https://www.alaskasnewssource.com/video/2024/03/31/downtown-stoughton-makerspace-teaches-students-produce-canoe-paddles/,
Mini Grants Applications are Closed for the Semester,https://sites.google.com/alaska.edu/uaft3makerspace/mini-grants/mini-grants-applications-are-closed-for-the-semester,Check back next semester for the next round of Mini-Grants
Anchorage Makerspace,https://www.discovermakerspaces.com/alaska/anchorage/makerspace/anchorage-makerspace,Makerspace
UAF eCampus | Take a peek into our vibrant beading ...,https://www.instagram.com/uafecampus/reel/C6rbwuDJiVa/,
Juneau Makerspace,https://events.juneauempire.com/venues/125276,Juneau Makerspace
Anchorage MakerSpace - Crunchbase Company Profile & ...,https://www.crunchbase.com/organization/anchorage-makerspace,Anchorage's Makers are an enthusiastic group of hobbyists and professionals that identify with the “maker culture”
"Planner Makerspace Giant Table - 48"" Deep | Smith System®",https://smithsystem.com/furniture/planner-rectangle-activity-table-48-deep/,
Makers in Anchorage,https://alaskapublic.org/2014/05/09/makers-in-anchorage/,"May 9, 2014 — TechShop website"
MakerSpace | Utility Works | Generating Creativity,https://utility.works/makerspace/,"The Utility Works MakerSpace offers rental spaces for makers, but vacancies are not guaranteed"
"At an Alaska maker's space, Indigenous artists connect ...",https://www.kuow.org/stories/at-an-alaska-maker-s-space-indigenous-artists-connect-with-millennia-of-tradition,"Dec 19, 2023 — But there is a unique maker's space where Indigenous artists can come anytime to make traditional artwork"
Emerging Technologies: Home,https://lam.alaska.gov/emergingtech,- Makerspace information compiled by Julie Niederhauser 
"At an Alaska maker's space, Indigenous artists connect ...",https://laist.com/news/npr-news/at-an-alaska-makers-space-indigenous-artists-connect-with-millennia-of-tradition,"Dec 19, 2023 — It is the nation's northernmost maker's space, a place where Indigenous artists can create things like walrus ivory earrings, figurines made "
Makerspace (K-8) - Synapse Virtual Tour,https://www.youtube.com/watch?v=eKtow67shiA,
Makerspace : r/anchorage,https://www.reddit.com/r/anchorage/comments/13fyhc5/makerspace/,Makerspace
Top 10 Strategies for Networking Your Way into Anchorage's ...,https://www.nucamp.co/blog/coding-bootcamp-anchorage-ak-top-10-strategies-for-networking-your-way-into-anchorages-tech-scene,"Jun 27, 2024 — "
UAF eCampus | Another fun thing to do in the Makerspace ...,https://www.instagram.com/uafecampus/reel/CzWypJAvEj0/?locale=zh_CN&hl=bg,
Juneau Makerspace moves into community workspace,https://www.ktoo.org/2015/11/02/juneau-makerspace-moves-into-community-workspace/,"Nov 2, 2015 — Formerly he worked in the newsroom as Digital Director overseeing digital platforms"
North Pole High benefits from $1.2 million STEM grant,https://www.newsminer.com/news/education/north-pole-high-benefits-from-1-2-million-stem-grant/article_6dd46560-eaa5-11ed-9b68-2f80813b55b9.html,"May 5, 2023 — The grant, secured by the University of Alaska Fairbanks, centers "
Help us Make-Up the MakerSpace this Friday from 2 PM - 6 ...,https://m.facebook.com/juneaueconomy/videos/help-us-make-up-the-makerspace-this-friday-from-2-pm-6-pm-well-need-help-with-so/10156374328196420/?__so__=watchlist&__rv__=related_videos&locale=ne_NP&_rdr,
We Built a Maker Space in 100 Days!,https://www.youtube.com/watch?v=iCImarvmHOo,
Mankato MakerSpace gives outlet and market to local artists,https://www.alaskasnewssource.com/video/2022/11/14/mankato-makerspace-gives-outlet-market-local-artists/,
"To teach innovation, Sitka schools ramp up makerspace ...",https://www.kcaw.org/2017/05/19/teach-innovation-sitka-schools-ramp-makerspace-program/,"May 19, 2017 — Ohler speaks passionately about makerspace"
"Ask a Maker Educator – Maker Learning in Sitka, Alaska",https://makered.org/blog/ask-a-maker-educator-maker-learning-in-sitka-alaska/,"May 24, 2017 — “To Teach Innovation, Sitka Schools Ramp Up Makerspace Program” — A recent radio story about Sitka's maker space project, by Robert Woolsey "
SQUEEZING IN A MAKER-SPACE,https://www.akasl.org/puffin-news-archive/squeezing-in-a-maker-space,"Mar 10, 2018 — ALASKA ASSOCIATION OF SCHOOL LIBRARIANS · Home · About · Membership "
List of Makerspaces Around the World,https://www.nexpcb.com/blog/the-list-of-makerspaces,"Anchorage, Alaska "
Princeton University Library,https://library.princeton.edu/home,Makerspace
"North End Makerspace in Seattle, WA",https://northendmakers.org/,Join a nonprofit makerspace in the north end of the greater Seattle area
"Melanie Strange - North Pole, Alaska, United States",https://www.linkedin.com/in/melanie-strange-87787822b,"Resident Artist at CrashWorks STEAM Studio & Makerspace · In 2018, I graduated from high school in Holliday, Texas"
Any interest in a class on how to make non-traceable ice ...,https://talk.dallasmakerspace.org/t/any-interest-in-a-class-on-how-to-make-non-traceable-ice-bullets/5019?page=2,"Sep 2, 2015 — My gut reaction is “why would we want Makerspace attached to this idea? "
Juneau Makerspace,https://www.kickstarter.com/projects/1257737521/juneau-makerspace,"Dec 30, 2015 — Juneau, AK Makerspaces"
US Coast Guard is searching for 5 people after a fishing ...,https://www.ourquadcities.com/news/national-news/ap-us-coast-guard-is-searching-for-5-people-after-a-fishing-boat-reportedly-capsized-in-seas-off-alaska/,5 days ago — 
Plaksha | Reimagining Technology Education,https://plaksha.edu.in/,Plaksha University is a technology and research university in India offering undergraduate and postgraduate degrees and research opportunities in cutting 
Anchorage MakerSpace - Maketec,https://maketec.ch/allgemein/anchorage-makerspace/,"Dec 25, 2015 — "
Computational Thinking: The WAY we think in LIBRARIES,https://blog.globaleducationak.org/computational-thinking-the-way-we-think-in-libraries/,"Feb 15, 2019 — "
Jervis Public Library in Rome announces upcoming events,https://www.romesentinel.com/ce/jervis-public-library-rome-upcoming-events/article_76862922-b318-11ef-9e04-d30600e90fd5.html,4 days ago — Tuesday Dec
PEF Awards $200K to Pasadena Unified Educators,https://outlooknewspapers.com/pasadenaoutlook/news/pef-awards-200k-to-pasadena-unified-educators/article_d0be0ae9-e8b8-5e65-b1ca-b93ab08fc0d5.html,"Jan 4, 2019 — This year's grants support a diverse and vibrant array of educational projects such as an outdoor amphitheater, makerspace, science labs "
"Already buried under snow, Great Lakes region expected to ...",https://www.wiproud.com/news/national/ap-great-lakes-region-faces-more-snow-after-weekend-of-harsh-holiday-weather/,4 days ago — 
Phillips Academy,https://en.wikipedia.org/wiki/Phillips_Academy,
Two Norfolk projects get financial boost,https://norfolkdailynews.com/news/two-norfolk-projects-get-financial-boost/article_e0b23762-b18f-11ef-87d9-9b3bb8b61108.html,3 days ago — The Norfolk Public Schools is planning to build and purchase makerspace 
Cedar Valley Makers moving out of TechWorks building ...,https://www.newspressnow.com/news/regional_news/iowa/cedar-valley-makers-moving-out-of-techworks-building-next-year/article_f97bd5eb-a771-5f24-962c-dab86f8f83b1.html,"20 hours ago — The makerspace provides resources for industrialists, crafters "
Bambu Lab X1-Carbon Combo The Basics Bundle,https://www.matterhackers.com/store/l/bambu-lab-x1-carbon-combo-3d-printer/sk/MKYEA6H9?srsltid=AfmBOoq3SXFZfhXRDbjjGb22imSwVZ9sAsO2I2kbGp5K3ARU1Szv0Y21,Ships Tomorrow Free U
Jervis Public Library in Rome announces upcoming events,https://www.romesentinel.com/entertainment-life/jervis-public-library-in-rome-announces-upcoming-events/article_24c32cdc-acc1-11ef-9680-375fa33d743e.html,"9 hours ago — Wednesday, Dec"
St. Mary's briefs,https://www.somdnews.com/enterprise/news/briefs/st-marys-briefs/article_58e13060-ec3f-11ee-b383-a763deed3516.html,"Apr 1, 2024 — For more, go to www"
Auckland Council Libraries: Kia ora,https://www.aucklandlibraries.govt.nz/,Services
Starlink satellites may be visible in Central Mass.,https://www.communityadvocate.com/2024/12/02/starlink-satellites-may-be-visible-in-central-mass/,4 days ago — Shrewsbury Public Library unveils Makerspace · Featured News 
Bookmans Entertainment Exchange: Home,https://bookmans.com/,CATALYST Collaborative Arts & Maker Space at Tucson Mall
Weihnachtsmarkt / Tag der offenen Tür im MAGIE,https://www.thm.de/site/hochschule/campus/veranstaltungen/fuer-alle-interessierten/makerspaces-startups/3892-tag-der-offenen-tuer-2024-12.html,12 hours ago — AK Industrie 4
5 approaches that engage middle school students in STEM ...,https://www.eschoolnews.com/steam/2024/12/02/engage-middle-school-students-stem-learning/,"5 days ago — If available in a school makerspace, 3D printers are great for "
American River Makers welcomes like-minded tinkerers,https://www.gtgazette.com/events/american-river-makers-welcomes-like-minded-tinkerers/article_697cfd38-e21b-11ee-915d-5370d85f9d2f.html,"Mar 21, 2024 — He has also facilitated the pilot STEM/Maker Space Program at "
UW planetarium highlights December with Christmas ...,https://www.wyomingnews.com/laramieboomerang/news/uw-planetarium-highlights-december-with-christmas-themed-program/article_ce0e8e88-ae85-11ef-a473-13e182e15b81.html,6 days ago — The event takes place at the SciDIY Makerspace in the basement of the Physical Sciences Building
Best Study Spots Around Campus,https://www.hercampus.com/school/ucd/best-study-spots-around-campus-2/,4 days ago — University of Alaska - Fairbanks · University at Albany (SUNY) · Carlos 
Fort Henry Mall owners share project updates,https://www.timesnews.net/news/local-news/fort-henry-mall-owners-share-project-developments-look-ahead-to-2025/article_47371c34-b193-11ef-8eae-0f24926e8c59.html,3 days ago — 
Ústřední knihovna FF MU,https://knihovna.phil.muni.cz/,Jak na plackovač
AK Makerspace LAN 4/26/14 - Alaskan Gamers Unite - www ...,https://www.youtube.com/watch?v=K976g_zb6XM,
Christian McCaffrey's season 'potentially' over after knee injury ...,https://www.wiproud.com/sports/ap-49ers-christian-mccaffrey-exits-game-against-bills-with-knee-injury/,5 days ago — 
"Events & Activities for Kids and Families, Casa Grande ...",https://casagrande.macaronikid.com/,8:00 PMCosmic Bowling @ Ten Pins DownAk-Chin Circle Entertainment Center
Prosecutor says officers acted 'recklessly' in Black man's ...,https://www.ourquadcities.com/news/national-news/ap-2-indianapolis-police-officers-face-trial-in-black-mans-death-during-mental-health-crisis/,4 days ago — 
