Phoenix Forge – A community makerspace for everyone.,https://phxforge.com/,Phoenix Forge
CREATE Makerspace - Arizona Science ...,https://www.azscience.org/experience/create/,"At CREATE, people of all ages can share ideas, collaborate on projects and learn about science, technology, engineering, art and math (STEAM) through making"
Makerspace - ASU Library - Arizona State University,https://lib.asu.edu/makerspace,"Welcome to the ASU Library Makerspace, located on the third floor of Hayden Library, a safe space to learn and explore"
"Makerspaces in Phoenix, Arizona, AZ",https://makerspacedir.com/location/phoenix-az/,"Makerspace, Hackerspaces, Fablabs, Coworking spaces, and other creatives in Phoenix, AZ"
Xerocraft,https://xerocraft.org/,"Tucson, Arizona's local makerspace, hackerspace, and public workshop"
CATalyst Studios,https://lib.arizona.edu/catalyst,Visit our makerspace to explore new technology and collaborate with others in a welcoming space
Coco-op Makerspace Flagstaff,https://www.cocoop.org/,"The Coco-op is Flagstaff's Makerspace, a community workspace offering membership based access to our facility full of tools, plus public classes across many "
"THE BEST 10 Makerspaces in PHOENIX, AZ",https://www.yelp.com/search?cflt=makerspaces&find_loc=Phoenix%2C+AZ,"Best Makerspaces in Phoenix, AZ - Phoenix Forge, Heatsync Labs, AZ CoWork, Stencil - A DIY Craft Studio, Magus Effects, Urban Metal Studio, Gangplank Queen "
Digital Makerspaces - UCATT - The University of Arizona,https://ucatt.arizona.edu/multimedia/digital-makerspaces,"The mission of the Digital Makerspaces is to promote digital literacy and provide resources across campus for UA students, faculty, and staff to facilitate the "
Phoenix Forge,https://www.maricopa.edu/community/phoenix-forge,"Open to the public, Phoenix Forge is the largest community makerspace in the Southwest providing access to hands-on programs for project-based learning, "
About,https://phxforge.com/about/,Phoenix Forge is a makerspace powered by GateWay 
About the GCC Library Reimagine MakerSpace,https://guides.gccaz.edu/reimaginespace,"Apr 5, 2024 — The GCC Library Reimagine Space is a cross-disciplinary makerspace facility that encourages hands-on learning, collaboration, creativity, "
Services - ASU Library - Arizona State University,https://lib.asu.edu/makerspace/services,"3D printing The Makerspace provides students, faculty and staff access to 3D printing"
Makerspace - LibCal - Arizona State University Library,https://asu.libcal.com/reserve/makerspace,Powered by Springshare
Arizona Science Center Makerspace Furniture,https://formaspace.com/workbench-gallery/makerspace/arizona-science-center-makerspace-furniture/?srsltid=AfmBOoopxZjSubW7uHr9KXf81nc82EIWncjfPzBhcCD0vBY0M9a6qhqS,"Arizona Science Center came to Formaspace to furnish their makerspace where visitors go to design, make, create, and connect"
CATalyst Studios Makerspace at the University of Arizona ...,https://www.youtube.com/watch?v=WNWdPLNEg20,
How Phoenix Forge makerspace is helping local ...,https://www.kjzz.org/news/2024-06-14/how-phoenix-forge-makerspace-is-helping-local-entrepreneurs,"Jun 14, 2024 — Phoenix Forge is a makerspace run by GateWay Community College and it's open to students and the public"
Why and how the Arizona Science Center created its own ...,https://www.aam-us.org/wp-content/uploads/2018/03/Museum-magazine.MarchApril-2018.Everybody-DIY.pdf,relevance and value of makerspaces
Create Makerspace Arizona Science Center,https://www.neilsquire.ca/venue/create-makerspace-arizona-science-center/,Create Makerspace Arizona Science Center
MACH,https://www.phoenixpubliclibrary.org/mach,"MACH1, MACH1, <div class=""ExternalClass5D1EFB3FAD00459DAC40BFAB148BBA50""><h3>​Welcome to MACH1"
MakerSpace,https://www.estrellamountain.edu/makerspace,The EMCC MakerSpace is the premier project-based learning center in the west valley
Arts and Crafts in Phoenix,https://steampunk-explorer.com/city-guides/phoenix/arts-and-crafts,HeatSync Labs
The Art and Science of Making,https://www.paradisevalley.edu/makerspace,Degrees and Certificates A-Z 
Phoenix Community Makerspace (Phoenix Forge),https://www.meetup.com/phoenix-makerspace-meetup-group/,
THINKspot,https://www.mesalibrary.org/how-do-i/visit-thinkspot,A-Z List of eResources · Workforce Development Agencies · Adult Education 
The Makery,https://chandlerlibrary.org/the-makery/,"Nov 6, 2024 — "
Arizona Science Center: Creating and Maintaining a ...,https://scitechinstitute.org/events/arizona-science-center-creating-and-maintaining-a-makerspace/,Arizona Science Center: Creating and Maintaining a Makerspace
Tucson (@xerocraft) • Instagram photos and videos,https://www.instagram.com/xerocraft/,Xerocraft Makerspace - Tucson
"Makerspaces in Scottsdale, AZ",https://makerspacedir.com/location/scottsdale/,"Makerspace, Hackerspaces, Fablabs, Coworking spaces, and other creatives in Scottsdale, AZ"
Phoenix Forge: A community makerspace for everyone.,https://www.facebook.com/PHXForge/,Phoenix Forge: A community makerspace for everyone
News - AWC Library Launches Mobile Mini-Makerspace,https://www.azwestern.edu/news/awc-library-launches-mobile-mini-makerspace,"Apr 26, 2018 — Yuma, AZ (April 26, 2018) – The AWC Academic Library is looking to the future with the opening of its Mobile Mini-Makerspace, a "
Creator Courses - Arizona Science ...,https://www.azscience.org/experience/create-makerspace/creator-courses/,"Join Creator Courses at the Arizona Science Center's CREATE Makerspace for hands-on learning in technology, engineering, and design"
Makerspace,https://www.ajpl.org/creationzone/,Makerspace
Makerspace at Pardes,https://www.pardesschool.org/academics/makerspace-at-pardes/,Contact us at 480-991-9141 or email admissions@pardesschool
"Resources tagged with ""maker space""",https://getinvolvedclearinghouse.org/resources/tags/maker-space,"This job description describes duties for a volunteer in the ShowLow Arizona Library's maker space, called ""Creation Station"
How to Get Started with a Makerspace,https://www.furnishaz.com/blog-posts/how-to-get-started-with-a-makerspace/,"Looking to inspire the next generation of tinkerers and innovators, a growing number of schools are creating maker spaces equipped with everything from "
East Campus Library Makerspace: Get Creative,https://libguides.pima.edu/ECMakerspace/websitesandsoftware,"Oct 10, 2024 — Artists & Makers Studios – Oro Valley, Arizona is a brand new studio complex which opened as of September 2020 overseen by Megan Ace"
Makerspaces - Greater Arizona eLearning Association,http://gazelaz.weebly.com/makerspaces.html,"The Arizona Innovative Learning Collaborative will develop a Makerspaces Network to promote the adoption of Makerspaces in Arizona, and to connect Makerspace "
HeatSync Labs,https://www.heatsynclabs.org/,HeatSync Labs
Events - Pinal County Library District - Communico,https://pcld.libnet.info/events?term=Makerspace,
Phoenix Forge: Makerspace Open in Downtown Phoenix,https://geeknewsnetwork.net/phoenix-forge-makerspace-open-in-downtown-phoenix/,"Sep 14, 2022 — The Phoenix Forge, a community makerspace, in Downtown Phoenix, Arizona, had their grand opening on September 13th, 2022"
Makerspace Furniture - Tinker Table - Flip Top Table,https://formaspace.com/workplace-furniture/makerspace-furniture/?srsltid=AfmBOoqvc5YRj1uD2uDyU8ucH2ZLUGDm0kdYDo6UiXb_vkQwYPCD5mOU,Read more about Makerspaces
Other Makerspaces,http://wiki.makersmiths.org/display/MAK/Other+Makerspaces?src=contextnavpagetreemode,Arizona
Phoenix Makerspace Collective,https://www.facebook.com/groups/PhoenixMakerspaceCollective/,"Simply hoarding a 35,000 sq facility that City Government of Chandler, Arizona taxpayers primarily paid for IS NOT AN OPTION"
Traveling Makerspace,https://azafterschool.org/pledge/traveling-makerspace-4/,
Xerocraft Makerspace - All You Need to Know BEFORE ...,https://www.tripadvisor.com/Attraction_Review-g60950-d9841547-Reviews-Xerocraft_Makerspace-Tucson_Arizona.html,"Dec 30, 2019 — Xerocraft Makerspace - All You Need to Know BEFORE You Go (2024)"
Arizona State University | Have you heard of Makerspace ...,https://www.instagram.com/arizonastateuniversity/reel/C_57mjPh8pY/,
Phoenix Forge MakerSpace (@PhxForge) / X,https://twitter.com/phxforge?lang=en,"The Phoenix Forge, a community makerspace, in Downtown Phoenix, Arizona, had their grand opening on September 13th, 2022"
burton-barr-library-mini-maker-space,https://www.raisingarizonakids.com/burton-barr-library-mini-maker-space/,Home · Holiday Events for Arizona families · Events Calendar · Free Entrance to National Parks · This Week · This Weekend · On Exhibit · Local Resources · Party 
MakerSpace / Passion Projects,https://www.dvusd.org/Page/84049,Arizona's Academic Standards Assessment (AASA) · Gifted Services · Resources
"Located on the third floor of Hayden Library, Makerspace ...",https://www.facebook.com/arizonastateuniversity/videos/located-on-the-third-floor-of-hayden-library-makerspace-offers-services-and-equi/908446381104461/,
ASU Library Makerspace brings creative technology to the ...,https://www.statepress.com/article/2023/11/guide-to-haydens-makerspace,"Nov 29, 2023 — Paul_Pascual_20231129_Hayden-Makerspace-06"
Makerspace: Special Edition – Scrapbooking & Collage,https://heard.org/event/makerspace-special-edition-scrapbooking/,"Originally from Shonto, Arizona, and raised in Flagstaff, Arizona"
Makerspace.az,https://makerspace.az/,Masterstudy is Education WordPress theme featured by Learning Management System (LMS) for online education business and course management
Welcome - East Campus Library Makerspace - Research Guides,https://libguides.pima.edu/ECMakerspace,"Oct 10, 2024 — 8181 E Irvington Rd, Room L-116, Tucson, AZ 85709"
The MakerSpace : Welcome! - Walker Library - MTSU,https://library.mtsu.edu/technology/makerspace,"Aug 22, 2024 — A-Z · Directory · Give · MTSU Email"
"Makerspace Jobs, Employment in Phoenix, AZ","https://www.indeed.com/q-makerspace-l-phoenix,-az-jobs.html","5 Makerspace jobs available in Phoenix, AZ on Indeed"
Eagle Makerspace,https://prescott.erau.edu/about/labs/makerspace,
Arizona State University ISSC | Unlock your creativity at ...,https://www.instagram.com/asuissc/reel/C3s4wt5vn9U/,
The MakerSpace Vision — T8 MakerSpace at RUHS,https://t8makerspace.com/vision,"Mike Schmidt · RUHS Engineering Teacher · T8 MakerSpace Founder · University High School Attn: Mike Schmidt, T8 MakerSpace 421 N"
College Opens First All-Student Makerspace,https://issuu.com/azengineering/docs/2023magazine_summer/s/28015294,
Podcasting at the Digital Maker Space,https://www.youtube.com/watch?v=hBMVVG6-obA,
Reimagine MakerSpace - GCC Libraries,https://lib.gccaz.edu/faculty/reimagine/,
Makerspace,https://library.princeton.edu/services/makerspace,Services A-Z
Makerspace: Home - Subject & Course Guides,https://libguides.lib.miamioh.edu/create/makerspace/,Databases A-Z · OneSearch · Articles and More · Books 
Makerspaces Workshop 2022,https://www.ecedha.org/Meetings/2022-ECEDHA-Annual-Conference/Makerspaces-Workshop-2022,"Mar 25, 2022 — SHAWN JORDAN, Ph"
Boys & Girls Clubs of Greater Scottsdale Names Director ...,https://azparenting.com/boys-girls-clubs-of-greater-scottsdale-names-director-for-new-steam-makerspace-initiative/,"Sep 17, 2020 — "
Space Availability - Workstation (room 310) - LibCal,https://asu.libcal.com/space/152910,Arizona State University Library 
APS Workshop Series Brings Makerspace Training to ...,https://arizonagifted.org/aps-workshop-series-brings-makerspace-training-to-arizona-teachers/,"Jan 6, 2020 — These 300 teachers will then who will then impact a total of 9,000 Arizona students with their classroom makerspaces"
Five Key Considerations When Designing a Makerspace,https://www.furnishaz.com/blog-posts/five-key-considerations-when-designing-a-makerspace/,Make sure students clean up after every use to keep the space free from clutter
Assessing the Impact of Digital Badging in Makerspaces on ...,https://www.nsf.gov/awardsearch/showAward?AWD_ID=2204738&HistoricalAwards=false,
An Inside Look at the Makerspace at Pardes,https://www.pardesschool.org/an-inside-look-at-the-makerspace-at-pardes/,An Inside Look at the Makerspace at Pardes · Environmental Engineering: Lower school students built self-watering planters using recycled materials
Traveling Makerspace,https://azafterschool.org/pledge/traveling-makerspace-2/,Traveling Makerspace
MakerSpaces in Libraries,https://www.urbanlibraries.org/resources/makerspaces-in-libraries,"Carnegie Library of Pittsburgh, Pa"
SPEC Kit 348: Rapid Fabrication/Makerspace Services ...,https://publications.arl.org/Rapid-Fabrication-Makerspace-Services-SPEC-Kit-348/89,SPEC Kit 348: Rapid Fabrication/Makerspace Services · 89
"It's Time to Remake the Makerspace, But Schools Shouldn't ...",https://www.edsurge.com/news/2019-06-13-it-s-time-to-remake-the-makerspace-but-schools-shouldn-t-go-it-alone,"Jun 13, 2019 — We have seen this transformation first-hand here at Arizona Science Center's CREATE makerspace, where I work"
There's a makerspace for kids at the UA Museum of Art this ...,https://tucson.com/thisistucson/summerguide/theres-a-makerspace-for-kids-at-the-ua-museum-of-art-this-summer/article_7dc160e6-732b-11e8-86d0-67d01b5dd200.html,"The University of Arizona Museum of Art is giving kids the chance to create, invent and experiment in a makerspace environment this summer"
Librarian - Maker Space,https://azlibrary.gov/jobline/job/7097,"May 25, 2023 — Librarian - Maker Space · Job ID/Number: · Post Date: · Closing Date: · Institution Name: · Job Location: · Job URL: · Please refer to their website "
DeArmond MakerSpace - UO Libraries - University of Oregon,https://library.uoregon.edu/price-science/dearmond-makerspace,Databases A-Z · Digital Collections · Scholars' Bank 
"Xerocraft Makerspace, 101 W 6th St, Ste 111, Tucson, AZ ...",https://www.mapquest.com/us/arizona/xerocraft-makerspace-304058466,"Get more information for Xerocraft Makerspace in Tucson, AZ"
BUILD-IT constructs Makerspace to drive innovation ...,https://heeap.org/news/build-it-constructs-makerspace-drive-innovation-creativity-vietnam,Arizona State University continues to foster Vietnamese STEM innovation and skill-building with the opening of the Maker Innovation Space in Ho Chi Minh 
SFA Makerspace,https://www.sfasu.edu/makerspace,SFA The SFA Makerspace SFA Makerspace
Pinal County Library District: Kid's Makerspace Class,https://scitechinstitute.org/events/pinal-county-library-district-kids-makerspace-class-54/,We are a nonprofit organization dedicated to enhancing and promoting STEM education and awareness in Arizona and beyond
Makerspace,http://www.library.unlv.edu/spaces/makerspace,A-Z List Of Journals · Databases · Research Guides · Connect from off-campus · New Books List · All Collections
Astrophysicist David Lesser Takes on UC San Diego's ...,https://today.ucsd.edu/story/astrophysicist-david-lesser-takes-on-uc-san-diegos-makerspace,"Jan 19, 2023 — At the time, Lesser was a member and leader of the local Xerocraft makerspace in Tucson, Arizona"
MakerSpace,https://www.jocolibrary.org/makerspace,Databases A-Z · Using the Library
Stego Studio - Steely Library's Makerspace - Inside NKU,https://inside.nku.edu/library/spaces/makerspace.html,A-Z Listing
Home - Makerspace,https://libraries.coastal.edu/makerspace,5 days ago — Databases A-Z · Journals A-Z · Course Reserves 
Donate — T8 MakerSpace at RUHS,https://t8makerspace.com/donate,"Can I use my AZ Tax Credit to support the MakerSpace? Unfortunately, no"
Lawrence Lin MakerSpace,https://www.uml.edu/engineering/makerspace/,A-Z Directory · Alumni · MyUML · Request Info · Make A 
Explore the Coolest 3D Printing Resources in Arizona - TechAZ,https://www.techaz.org/blog/coolest-3d-printing-resources-az,"Discover the top 3D printing resources in Arizona, from innovative makerspaces to cutting-edge tech hubs"
Makerspace at Hayden : r/ASU,https://www.reddit.com/r/ASU/comments/1gokxlk/makerspace_at_hayden/,Has anyone ever used the Makerspace at Hayden Library 
Harold Edward Cable Makerspace,https://engineering.dartmouth.edu/makerspace,A-Z Index • Privacy Statement • Feedback
Thunderworks Makerspace | SUU,https://www.suu.edu/thunderworks/,A-Z Index · Calendar · Tech Help
"Makerspace Librarian Jobs, Employment in Arizona",https://www.indeed.com/q-makerspace-librarian-l-arizona-jobs.html?start=20,makerspace librarian jobs in arizona · Library Assistant I - Main (Part-Time - 20 Hours) · $19
Q. What are the hours of the MakerSpace? - Ask Us!,https://libanswers.mtsu.edu/faq/148770,"Jun 20, 2024 — A-Z · Directory · Give · MTSU Email"
The new maker space in the Tucson Mall opens this week ...,https://tucson.com/article_4b4f2cb4-0d72-11ea-b80b-0bcad41e7604.html,"Kate Marquez, the executive director of the Southern Arizona Arts and Cultural Alliance (SAACA), speaks during the VIP night at Catalyst"
Makerspaces,https://www.bucknell.edu/academics/beyond-classroom/makerspaces,
Maricopa Community Colleges' Post,https://www.linkedin.com/posts/maricopa-community-colleges_on-tuesday-phoenix-forge-the-largest-makerspace-activity-7158975489531883520-UGtd,"On Tuesday, Phoenix Forge, the largest makerspace in the Southwest, hosted members of the Arizona Legislature, along with System leaders "
Computer Labs - Makerspace | Pierce College District - ctc.edu,https://www.pierce.ctc.edu/computer-labs-makerspace,Makerspace Hours and Location Hours Monday through Thursday: 9 am 
