Arkansas Regional Innovation Hub | Central Arkansas ...,https://arhub.org/,"As the first and largest Makerspace in Arkansas, we are delighted to provide Hub members with access to a wide range of creative spaces, including a Wood Shop, "
Mobile Makerspace | Arkansas Regional Innovation ...,https://arhub.org/mobile/,"We bring hands-on, interactive STEAM experiences directly to your community"
UCA Makerspace — Art and Design,https://uca.edu/art/uca-makerspace/,"UCA's Makerspace is a collaborative, interdisciplinary workspace with tools to prototype concepts, make new things, and take ideas to the next level"
AR Innovation Hub - Arkansas's First Makerspace | 🎉 ...,https://www.instagram.com/armakehub/p/DDIkWKnqjhg/,Celebrating Our Fall 2024 After-School Students
AR Innovation Hub - Arkansas's First Makerspace ...,https://www.instagram.com/armakehub/p/DDAR4AWNhbo/,"Photo by AR Innovation Hub - Arkansas's First Makerspace on November 30, 2024"
Makerspace: Heart of the Community - UARK Housing,https://housing.uark.edu/programs/adohi-creative-community/makerspace.php,"The Makerspace is broken up into three distinct parts: Painting, drawing and electronics"
Spaces - Rock It! Lab,https://cals.org/rock-it-lab/spaces/,Makerspace/501 Makers
Makerspace,https://www.salinecountylibrary.org/services/at-the-library/makerspace/,"A makerspace is a communal space that contains tools, equipment, and materials that allow people to come in with an idea and leave with a completed project"
Makerspace,https://np.edu/community-friends/makerspace,"The NPC Makerspace is a publicly accessible workshop, equipped with tools, equipment, and resources for a wide variety of projects"
McMillon Innovation Studio | Home - University of Arkansas,https://mcmillonstudio.uark.edu/,The McMillon Innovation Studio serves as an innovation hub to students across the University of Arkansas campus
Innovative Arkansas Non-Profit Supports Inventive Minds,https://www.up.com/aboutup/community/inside_track/arkansas-makerspace-07-11-2018.htm,"Arkansas Regional Innovation Hub, and "
UCA Makerspace – UCA Alliance for Economic Impact,https://uca.edu/economicimpact/uca-makerspace/,UCA Makerspace
UCA Makerspace,https://www.facebook.com/ucamakerspace/,"UCA Makerspace, Conway, Arkansas"
AR Innovation Hub - Arkansas's First Makerspace | You are ...,https://www.instagram.com/armakehub/reel/DB1vub7pCZR/,We are pleased to announce that the North Little Rock Public Library System (NLRPLS) is preparing to take on the management of the Arkansas 
Reel by AR Innovation Hub - Arkansas's First Makerspace ...,https://www.instagram.com/armakehub/reel/DBzz0ASsa3b/,"Photo by AR Innovation Hub - Arkansas's First Makerspace on November 13, 2024"
Arkansas Regional Innovation Hub,https://www.facebook.com/ARInnovationHub/,
Arkansas Regional Innovation Hub,https://winrock.org/projects/arkansas-regional-innovation-hub/,"The Innovation Hub, the first and largest makerspace in Arkansas, is a collaborative makerspace that welcomes a diverse community of all ages, interests, and "
AR Innovation Hub - Arkansas's First Makerspace | 🎨 𝐀 ...,https://www.instagram.com/armakehub/reel/DC0Si9Ap7GT/,We are pleased to announce that the North Little Rock Public Library System (NLRPLS) is preparing to take on the management of the Arkansas Regional 
"About G.I.N. | Paragould, AR",https://discoverparagould.org/489/About-GIN,
AR Innovation Hub - Arkansas's First Makerspace | ...,https://www.instagram.com/armakehub/reel/DCaRktAScSq/,"Photo by AR Innovation Hub - Arkansas's First Makerspace on November 30, 2024"
Makers,https://www.amazeum.org/makers/,"Recognized for leadership in the Maker Movement in Arkansas and the nation, the Amazeum hosts events like an annual Tinkerfest, monthly Maker Meetups, and "
makerspace tour,https://app.lapentor.com/sphere/makerspace-tour,FrontDoorView
June Classes at Arkansas's Largest Makerspace,https://www.youtube.com/watch?v=zZoaUdzBqx0,
"Pop-up Makerspace Available in Springdale, Arkansas",https://blog.teslarsoftware.com/blog/pop-up-makerspace-available-in-springdale-arkansas,"Nov 18, 2019 — The hub is a pop-up makerspace that offers opportunities for adults and children of the community to attend free classes and workshops that "
Arkansas - HackerspaceWiki,https://wiki.hackerspaces.org/Arkansas,"Nov 14, 2009 — Hackerspaces/Makerspace in Arkansas are[edit] "
NWA Fab Lab,https://www.nwafablab.com/,EXPERIMENT
How a Makerspace can impact your community,https://ar-ar.facebook.com/DarAmericaCasablanca/videos/822494265027094/,Thank you for having me
Local Resources & Maker Spaces - NWA Maker Faire,https://nwa.makerfaire.com/local-resources/,Need to connect with a community of makers right here in Northwest Arkansas 
Other Makerspaces,http://wiki.makersmiths.org/display/MAK/Other+Makerspaces?src=contextnavpagetreemode,"Anchorage Makerspace, Anchorage, Alaska"
The Arkansas Regional Innovation Hub Field Trip/MMS ...,https://www.cognitoforms.com/ArkansasRegionalInnovationHub1/TheArkansasRegionalInnovationHubFieldTripMMSScholarshipApplication,The Innovation Hub has funding to assist school groups with Field Trip fees and/or Mobile Makerspace trip fees
Arkansas Regional Innovation Hub - 3D Print Life Support,https://3dprintlifesupport.com/search-techs/#!biz/id/5e8756b8216e9445a327f2b8,"Makerspace in North Little Rock, Arkansas"
Makerspace,https://www.kuaf.com/tags/makerspace,The Northwest Arkansas FabLab is a space where makers can use equipment like 3D printers to create
Joel Gordon - STEAM ROCKET ENGINE,https://www.steamrocketengine.com/about,"An Arkansas native, he was the Co-founder and Executive Director of Arkansas' first Makerspace, The Arkansas Regional Innovation Hub, and is the founder of "
Jonathan Berg of Paradygm Shyft,https://dallasmakerspace.org/2011/08/jonathan-berg-of-paradygm-shyft/,"Members of other hackerspaces, makerspaces, and hacklabs have a standing invitation to come by and visit us when in the Dallas / Fort Worth area"
University of Central Arkansas,https://makerspacedir.com/listing/university-of-central-arkansas/,University of Central Arkansas
Makerspace Program Enables Workforce Innovation,https://www.cbc.devcom.army.mil/newspost/makerspace-program-enables-workforce-innovation/,"Mar 27, 2023 — "
Arkansas Regional Innovation Hub,https://northlittlerock.macaronikid.com/directory/6693f5c4f014f9075c15380f/arkansas-regional-innovation-hub,"Our mobile makerspace, the Innovation Hub on Wheels, takes that learning on the road, tapping the potential of Arkansas' underserved communities"
Klein Makerspace,https://seconews.org/KleinMakerspace,Join their Facebook Group: Arkansas Valley Paint & Sips a Group by Klein Makerspace
Makerspace Masters: How Faculty Are Spurring Innovation ...,https://venturewell.org/makerspace-masters/,"Sep 12, 2017 — FLIPspace: Advanced Mobility Northwest Arkansas · American-Made Solar "
Using Our Makerspace – FFL,https://fflib.org/using-our-makerspace,"Machines in the Space: 3D printers, laser engraver, vinyl cutter, CNC mill, Cricut, and sewing machines"
A-State Innovation System - The Garage,https://secure.touchnet.net/C20019_ustores/web/store_cat.jsp?STOREID=7&CATID=13,Arkansas State University
Mobile Makerspace - Critterbots,https://www.cognitoforms.com/arkansasregionalinnovationhub1/mobilemakerspacecritterbots,Mobile Makerspace - Critterbots
Maker Space,https://www.astate.edu/college/education/services/arkansas-science-festival/calendar/asf-tinkerfest.dot,"Come out for an assortment of scientifically creative activities for kids of all ages: stop motion, green screen, print making, noise makers, and legos"
Integrated Design Lab,https://www.nwacc.edu/workforce/integrateddesign/integrateddesignlab.aspx,NWACC's Evelyn E
"Maker Space: Just name it, and Gina Gallina can crochet it",https://www.arkansasonline.com/news/2022/jan/27/maker-space-just-name-it-and-gina-gallina-can/,"Jan 27, 2022 — "
Makerspace 101,https://myevents.bentonvillelibrary.org/event/12212517,"Bentonville Public Library is located just 3 blocks south of the Downtown Square, at 405 S"
Arkansas Regional Innovation Hub to build 'mobile ...,https://talkbusiness.net/2016/11/arkansas-regional-innovation-hub-to-build-mobile-makerspace-for-students/,"Nov 9, 2016 — Arkansas Regional Innovation Hub, a Little Rock-based nonprofit aimed at helping startup companies, will soon open a “mobile makerspace” to "
Makerspace 101 - Bentonville Public Library,https://bentonvillelibrary.libnet.info/event/11889582,"Main Street in Bentonville, Arkansas"
A Librarian's Guide to Makerspaces: 16 Resources,https://www.oedb.org/ilibrarian/a-librarians-guide-to-makerspaces/,Arkansas · California · Colorado · Connecticut · Delaware · Florida · Georgia · Hawaii 
STEM-C,https://www.lisaacademy.org/apps/pages/index.jsp?uREC_ID=2617870&type=d&pREC_ID=2267108&tota11y=true,STEM-C
Makerspace,https://nlrlibrary.org/communityresources/studio,Arkansas Traveler's Database · Culture Grams · Health and Medical · Learning 
Gordon named executive director of Innovation Hub,https://healthcarejournalar.com/news/gordon-named-executive-director-of-innovation-hub,The Arkansas Regional 
Arkansas City Public Library,https://arkcity.scklslibrary.info/,Makerspace · Early Literacy Resources – USD 470 · Follow us on Facebook
AR Innovation Hub - Arkansas's First Makerspace,https://www.facebook.com/17841406362385112/videos/827440642134922/,AR Innovation Hub - Arkansas's First Makerspace
"Ozark Folkways Heritage Center | Winslow, AR",https://www.arkansas.com/winslow/shopping-wellness/ozark-folkways-heritage-center,Ceramics MakerSpace
Meet The Maker | Adam Kittrell,https://www.make48.com/post/meet-the-maker-adam-kittrell,"Oct 6, 2022 — Arkansas Regional Innovation Hub technician Adam Kittrell will be "
Makerspace pop-up offers opportunities,https://www.nwaonline.com/news/2019/nov/02/makerspace-pop-offers-opportunities/,"Nov 2, 2019 — 23, said Shannon Anderson, mobile makerspace director with the Arkansas Regional Innovation Hub"
Dee Brown Library Maker's Space,https://fennellpurifoy.com/portfolio/dee-brown-library-makers-space/,Dee Brown Library Maker's Space
Maker Space,https://freeweekly.com/category/features/maker-space/,Head And Heart
NWA Creative Hub | Ideas becoming real things!,https://nwacreativehub.com/,NWA3D can think of no two better people to lead a maker's space initiative in Northwest Arkansas than Tiffany and Eugene
Conductor | Empowering entrepreneurs across Central ...,https://arconductor.org/,Big impact in Central Arkansas
The Conductor (@AR_Conductor) / X,https://twitter.com/ar_conductor,Join Hali Boyce of Delta Dental of Arkansas as she shares how to lead authentically in human resources
Arkansas Research & Technology Park (ARTP),https://makerspacedir.com/listing/arkansas-research-technology-park-artp/,Arkansas Research & Technology Park (ARTP)
Homeschool Makerspace - Events in Vilonia,https://allevents.in/vilonia/homeschool-makerspace/200027580701753,5 days ago — Find tickets & information for Homeschool Makerspace
Jason Huselton - UCA Makerspace at University of Central ...,https://theorg.com/org/university-of-central-arkansas/org-chart/jason-huselton,Jason Huselton is currently working as the UCA Makerspace at the University of Central Arkansas since January 2023
"The Generator | Pine Bluff, Arkansas",https://www.goforwardpinebluff.org/the-generator-pine-bluff,The Generator is an innovation hub powered by Go Forward Pine Bluff
Custom art easle prototype build at National Park College ...,https://www.tiktok.com/@rkingart/video/7352954813602352430,
Small Business Resources,https://www.arkansasedc.com/business-resources/small-business-entrepreneurship-development/small-business-resources,Entrepreneur Hubs and Makerspaces · Arkitchen · Arkansas Food Innovation Center · Arkansas Regional Innovation Hub · Arkansas Share Grounds · A-State Innovate
CNC Fabrication,https://nwamakers.com/product/cnc-fabrication/,"Joel was Co-founder and Executive Director of Arkansas's first Makerspace, The Arkansas Regional Innovation Hub"
2024 Summer Camps at The Innovation Hub: Scientists,https://northlittlerock.macaronikid.com/directory/6693f8a1acf23f202f321c6f/2024-summer-camps-at-the-innovation-hub-scientists-invent-experiment-observe-%288-to-10%29,"What if they could make and create inside the largest, most experienced makerspace in the state of Arkansas? Well now is your chance"
Center for Innovation,https://www.faylib.org/innovation,
Integrated Design Community Events,https://www.nwacc.edu/academicdivisions/trailstrades/integrateddesign/events/,NWACC's Integrated Design Lab (IDL) offers a physical makerspace that puts design into practice
The Conductor at the University of Central Arkansas,https://www.socialstudiesar.org/blog/ucaconductor,"Nov 10, 2020 — The Makerspace is a collaborative, interdisciplinary work space on the University of Central Arkansas campus"
Shoppes at Donaghey Hall,https://www.arkansasbusiness.com/tag/shoppes-at-donaghey-hall/,The University of Central Arkansas' makerspace will open at 10:30 a
The Conductor Launches New Slate of STEAM Programming,https://armoneyandpolitics.com/conductor-launches-new-slate-steam-programming/,"Aug 21, 2019 — The Conductor will be offering new programming both at the University of Central Arkansas' Makerspace and in an outbound format that can be "
UCA Launches Makerspace At The Shoppes At Donaghey,https://conwayscene.com/uca-launches-makerspace/,"Sep 5, 2017 — The University of Central Arkansas community welcomed the UCA Makerspace Powered by the Conductor at a launch event Tuesday morning"
Computer Science Events,https://www.astate.edu/college/ecs/computer-science/events/,"The STEAM recruitment event is a showcase event bringing together students from a number of area schools to display STEAM, STEM or Makerspace/Design products "
Errin Stanger to step down as director of Arkansas ...,https://winrock.org/errin-stanger-to-step-down-as-director-of-arkansas-regional-innovation-hub/,"Mar 6, 2024 — "
| Provo's Very Own Makerspace,http://www.provolt.org/,"Dec 11, 2019 — "
Pulaski County Awards $289000 to Innovation Hub ...,https://www.pulaskicounty.net/news/posts/pulaski-county-awards-289000-to-innovation-hub-expanding-access-to-steam-learning,"Jan 13, 2022 — Pulaski County awarded $289000 to the Arkansas Regional Innovation Hub at Winrock International to bring STEAM hands-on field trips to "
"Conductor, Arkansas Tech observe Global ...",https://talkbusiness.net/2017/11/conductor-arkansas-tech-observe-global-entrepreneurship-week/,"Nov 9, 2017 — "
Meet LISA Academy - About Us,https://www.lisaacademy.org/apps/pages/MeetLISA,"LISA Academy is a high performing K-12 public charter school system in Arkansas that focuses on science, technology, engineering, and math"
Bentonville library's $5M expansion includes art gallery ...,https://www.axios.com/local/nw-arkansas/2021/10/14/bentonville-librarys-149-million-expansion-includes-art-gallery-and-outdoor-space,"Oct 14, 2021 — "
Innovation Center,https://www.thenewschool.org/academics/steam-education/innovation-center,Makerspace
Chamber maker space now a reality,https://www.nwaonline.com/news/2020/sep/24/chamber-maker-space-now-reality/,"Sep 24, 2020 — This document may not be reprinted without the express written permission of Northwest Arkansas Newspapers LLC"
Rock It! Lab blasts off at ribbon cutting,https://cals.org/rock-it-lab/2021/12/22/rock-it-lab-blasts-off-at-ribbon-cutting/,"Dec 22, 2021 — In the 501 Makers Makerspace "
"Try a 3-D printer, a laser cutter and more at the Library ...",https://www.mysaline.com/scl-makerspace/,"May 29, 2024 — The Saline County Library hosts regular open hours for patrons to have creative time in the Makerspace"
The Generator Pine Bluff - About Us,https://thegeneratorpinebluff.org/about-us/,"The Generator houses a coworking space, a makerspace and a digital space "
Personal Space: Rachel Tanner,https://www.arkansasonline.com/news/2020/feb/29/personal-space-rachel-tanner-20200229/,"Feb 29, 2020 — Where I live: Renting in the Central High Neighborhood"
Community Improvement – Arkansas Economic Regions,https://arkansaseconomicregions.org/resource-guide/community-improvement/,
Other Makerspace type places in the area - DMS General,https://talk.dallasmakerspace.org/t/other-makerspace-type-places-in-the-area/27992,"Oct 20, 2017 — Not in the area, but I've toured through and met with the small makerspace in Fayetville Arkansas (got a bunch of pix) and the TXRX group in "
Fayetteville Free Library Makerspace Tour,https://www.youtube.com/watch?v=j4h5v-hdCYw,5
Services - Arkansas City Public Library,https://arkcity.scklslibrary.info/services/,The laminating machine must be operated by library staff
Public Use 3D Printers : r/LittleRock,https://www.reddit.com/r/LittleRock/comments/dj7pd6/public_use_3d_printers/,You could also try the UCA Makerspace in Conway
Igniting the Creative,https://aboutrvmag.com/2017/07/01/igniting-the-creative/,"Jul 1, 2017 — "
Maker Space – Page 9,https://freeweekly.com/category/features/maker-space/page/9/,Features Maker Space · Maker Space: The Art Of Beauty
Jones Stepping Away from Arkansas Regional Innovation ...,https://armoneyandpolitics.com/jones-stepping-away-from-arkansas-regional-innovation-hub/,"Apr 30, 2021 — He pointed to the establishment of the Hub on Wheels, a mobile makerspace program"
Innovation Hub Growing in Pine Bluff,https://www.arkansasbusiness.com/article/innovation-hub-growing-in-pine-bluff/,"Aug 26, 2019 — Franco hopes to host accelerator programs at the building, and she said its makerspace will have equipment needed to produce basic prototypes "
