"TinkerMill - The Longmont, Colorado Makerspace",https://tinkermill.org/,We provide a variety of resources for all types of maker activities
Pikes Peak Makerspace - Home,https://pikespeakmakerspace.org/,Welcome to Pikes Peak Makerspace
Clear Creek Makerspace | Wheat Ridge CO,https://clearcreekmakerspace.com/,Clear Creek Makerspace is a 7
Makerspaces,https://ppld.org/create/makerspaces,"In these spaces, you'll find equipment such as 3D printers, laser engraving & cutting machines, sewing machines, and assorted handicraft and art tools"
"Solid State Depot - The Boulder, Colorado Makerspace",https://www.ssdmakerspace.org/,"Mar 22, 2024 — A core mission of our makerspace is to equip our community with both the tools and knowledge required to build a better world"
Makerspace,https://arapahoelibraries.org/makerspace/,"Nov 6, 2024 — Castlewood Library Makerspace is a free community workspace that provides tools and technology to facilitate DIY projects, skill building, prototype "
Makerspace,https://wearelocalworks.org/makerspace/,"A collaborative space for hands-on learning and creation, in which people with common interests can gather to work on projects, develop new skills"
Makerspace Woodshop | Idea Forge,https://www.colorado.edu/ideaforge/facilities/makerspace,Location: MBE 131A
Studio 775 Makerspace,https://www.lafayetteco.gov/2097/Makerspace---Studio-775,"The Lafayette Library has a mini-makerspace, a collaborative, community-driven space where users can learn to use tech tools in creative ways"
"THE BEST 10 Makerspaces in DENVER, CO",https://www.yelp.com/search?cflt=makerspaces&find_loc=Denver%2C+CO,"Top 10 Best Makerspaces Near Denver, Colorado - With Real Reviews · 1"
Boulder Public Library Makerspaces,https://boulderlibrary.org/makerspaces/,All patrons who visit the makerspaces must adhere to the Makerspace Use Policy
Makerspace Interest Group,https://cal-webs.org/Makerspace,Makerspace Interest Group 
Makerspace,https://www.historycolorado.org/exhibit/makerspace,Makerspace - Our hands-on Makerspace welcomes all museum visitors at no extra charge
Art Spot Silverthorne Makerspace | Home Art Spot,https://www.artspotsilverthorne.org/,CONNECT WITH US 
inventHQ Makerspace,https://www.broomfield.org/2749/inventHQ-Makerspace,inventHQ is Broomfield Library's makerspace
HIVE MakerSpace,https://www.arapahoe.edu/academics-programs/resources/academic-experiences/hive-makerspace,Business and Community Partnerships · Colorado Health Careers Collaborative · Littleton Leadership Academy · Year to Career · Policies
Erie Maker Space at Schofield Farm – Empowering Creativity ...,https://eriemakerspace.org/,"The future home of Erie Makerspace will be on the grounds of Schofield Farm located at 2203 North 111th Street in Erie, Colorado"
MindCraft Makerspace Home,https://www.mindcraftmakerspace.com/,"Holiday Break Camps December 30th-31st & January 2nd, 3rd & 6th * Movie & Craft Nights on First Fridays * Holiday Break Camps December 30th-31st & January "
Make at East,https://ppld.org/create/make-east,Safety Equipment · Home · Makerspaces · Studios · Equipment · Programs · Contact Us · PPLD Home
Pikes Peak Makerspace - Equipment,https://pikespeakmakerspace.org/equipment,One of the critical elements of a makerspace is tool and equipment sharing
a new way of collaborating - Nancy Richardson Design Center,https://www.chhs.colostate.edu/rdc/,As CSU's only interdisciplinary makerspace focused on design thinking 
Labriola Innovation Hub - Colorado School of Mines,https://labriola.mines.edu/,The Labriola Innovation Hub (InnoHub) at Mines provides state-of-the-art makerspaces and shops
Pikes Peak Makerspace,https://www.meetup.com/pikespeakmakerspace/,Welcome to Pikes Peak Makerspace
Facilities | Idea Forge,https://www.colorado.edu/ideaforge/facilities,welding
Top 7 Kid-Friendly Makerspaces in Denver,https://www.coloradoparent.com/top-7-kid-friendly-makerspaces-in-denver/,"Oct 31, 2023 — Top 7 Kid-Friendly Makerspaces in Denver · 1"
Clear Creek Makerspace provides tools for inventors ...,https://www.cbsnews.com/colorado/news/clear-creek-makerspace-provides-tools-inventors-students-dreamers-denver-metro-area-wheat-ridge/,"Oct 28, 2024 — "
Mindcraft Makerspace,https://stanleymarketplace.com/businesses/mindcraft-makerspace/,Mindcraft Makerspace
"Tour of TinkerMill Makerspace in Longmont, Colorado",https://www.youtube.com/watch?v=jMcvGR5ooGo,
Pikes Peak Makerspace,https://www.facebook.com/ppmakerspace/,"Pikes Peak Makerspace, Colorado Springs, Colorado"
Loveland CreatorSpace,https://www.lovelandcreatorspace.com/,LCS is a maker space in Loveland Colorado
Klein Makerspace,https://kleinmakerspace.com/,"Klein Makerspace, Locally owned in La Junta, Otero County, Colorado, Makerspace that offers courses, fun projects, 3-D printing, CNC Machine and custom "
Colorado Maker Hub: Home,https://coloradomakerhub.org/,"For the curious, the creative"
Hub Directory of Shared Spaces | Colorado Maker ...,https://coloradomakerhub.org/hub-directory-of-shared-spaces/,Shared Spaces 
Makerspaces,https://makerspace.com/,"Welcome to Make:'s Makerspace Directory, a comprehensive guide to the growing community of makerspaces around the globe"
Makerspaces,https://www.librarieslearn.org/makerspaces,"If your library has or wants a to start a makerspace, we have information on maker programming, materials and equipment"
Pikes Peak Makerspace,https://www.peakradar.com/organization/pikes-peak-makerspace/,"Peak Radar is a comprehensive arts & entertainment website for Colorado Springs and the Pikes Peak region that covers everything from theater to sports, music "
Pikes Peak Makerspace,https://www.coloradogives.org/organization/Pikes-Peak-Makerspace,We are tapped into and support the Colorado Springs startup community
ideaLAB,https://www.denverlibrary.org/idealab,ideaLABs are makerspaces: free community spaces to make things
Erie Makerspace,https://www.facebook.com/theeriemakerspace/,"Erie Makerspace, Erie, Colorado"
"Makerspaces in Arvada, Colorado, CO",https://makerspacedir.com/location/arvada-co/,"Makerspace, Hackerspaces, Fablabs, Coworking spaces, and other creatives in Arvada, Colorado"
Fort Collins Creator Hub – 1304 Duff Dr #11 ...,https://www.fortcollinscreatorhub.org/,"Without volunteer & member involvement, the Makerspace would cease to exist"
Facilities,https://www.ssdmakerspace.org/?page_id=703,"The Boulder, Colorado Makerspace"
Arts and Crafts in Denver,https://steampunk-explorer.com/city-guides/denver/arts-and-crafts,"With more than 600 paying members, TinkerMill says it's the ""largest makerspace/hackerspace in Colorado and the surrounding Rocky Mountain region"
CAL Makerspace Interest Group,https://www.librarieslearn.org/website/cal-makerspace-interest-group,The Colorado Association of Libraries Makerspace Interest Group meets quarterly at different locations
Maker Space jobs in Colorado,https://www.indeed.com/q-maker-space-l-colorado-jobs.html,190 Maker Space jobs available in Colorado on Indeed
Facilities - Labriola Innovation Hub - Colorado School of Mines,https://labriola.mines.edu/labriola-facilities/,"The Labriola Innovation Hub facilities include state-of-the-art makerspaces and shops to create, prototype, test, and iterate"
Makerspace - Drop In - Library Events and Spaces,https://lafayettepubliclibrary.libcal.com/event/11528566,"Lafayette Public Library, Colorado · Library Events and Spaces · Calendar"
RLD Makerspace - Rampart Library District,https://rampart.colibraries.org/rld-makerspace/,RLD Makerspace
Makerspace Membership - Manitou Springs,https://www.manitouartcenter.org/join,Makerspace Memberships
"Maker Space | Canon City, CO",https://www.canoncity.org/566/Maker-Space,Maker Space
Makerspaces/workshops in the Denver area?,https://www.reddit.com/r/Denver/comments/yzg88x/makerspacesworkshops_in_the_denver_area/,West colfax library has amazing industrial sewing machines in their makerspace among other things 
Children's Hospital Colorado,https://www.pandacares.org/events/panda-celebrates-official-grand-opening-of-the-panda-cares-center-of-hope-makerspace-at-children-s-hospital-colorado,"Aug 8, 2022 — Panda Celebrates Official Grand Opening of the Panda Cares Center of Hope Makerspace at Children's Hospital Colorado "
"Makerspace - Drop In - Lafayette Public Library, Colorado",https://lafayettepubliclibrary.libcal.com/event/11527528,Makerspace drop in is open to all ages
"Maker Lab | Durango, Colorado",https://themakerlab.org/,"The Makerlab, in Durango, Colorado is a community-led makerspace"
Makerspace drop-in hours,https://csuspur.org/event/makerspace-drop-in-hours/2024-09-24/,"Sep 24, 2024 — As former Executive Director for the Colorado Commission of Indian Affairs (CCIA) for 12 years, Ernest maintained the communication between the "
Castlewood Library Makerspace,https://arapahoelibraries.org/locations/aquisition_branch_id/,Explore Colorado · Genealogy & Local History · Get a Card · Holds Lockers · Home 
Maker Space,https://www.bouldercountyarts.org/art-spaces/phoenix-asylum/maker-space,"The Phoenix Asylum is a Colorado Non-Profit Workshop Cooperative and Makerspace in Boulder, CO's lovely east-side warehouse district"
Makerspace Manager - Jobs,https://www.libraryjobline.org/jobs/13534/makerspace-manager,"Nov 8, 2023 — The Makerspace Manager is responsible for planning, implementing, promoting and evaluating makerspace programs for patrons of all ages"
Makerspaces in Denver for woodworking (Luthiery)?,https://www.reddit.com/r/Denver/comments/w6zjoa/makerspaces_in_denver_for_woodworking_luthiery/,"I live in Lakewood, wondering if anyone has recommendations for a nearby makerspace that is more focused on woodworking equipment and CNC"
The Lab Denver,https://thelabdenver.org/,Electronics Lab Screenprinting Wood and Metal shop 3D Printing Laser Cutting
Colorado Association of Libraries - Meeting/Event Information,https://cal-webs.org/meetinginfo.php?id=439,Join the CAL Makerspace Interest Group for our fourth Maker Workshop at Library 21C in Colorado Springs
New geoscience makerspace opens on campus | Colorado ...,https://www.minesnewsroom.com/news/new-geoscience-makerspace-opens-campus,"Jun 30, 2022 — A new geoscience makerspace has opened on the Mines campus, giving undergraduate and graduate students a place where they can experiment "
Northern Colorado Makerspace - HackerspaceWiki,https://wiki.hackerspaces.org/Northern_Colorado_Makerspace,This is a proposed Makerspace/Hackerspace for the Fort Collins/Loveland/Greeley area
Colorado Teens Use Makerspace To Create Accessible ...,https://www.slj.com/story/colorado-teens-use-makerspace-to-create-accessible-board-games,"Aug 6, 2019 — In an award-winning internship at the Boulder Public Library, underserved youth work in the makerspace to design and create projects that "
Shops,https://tinkermill.org/shops/,TinkerMill is the largest makerspace in Colorado and the surrounding Rocky Mountain region
Manitou Art Center - woodshop,https://www.manitouartcenter.org/Woodshop,Woodshop Tools & Equipment
MAKERSPACES | Pueblo City-County Library,https://www.pueblolibrary.org/Makerspaces,A makerspace is an open place with tools and supplies where anyone can go to work on a creative project of their own choosing
Tesla's Birthday Party! - Colorado Springs,https://www.peakradar.com/event/teslas-birthday-party/,"Jun 20, 2024 — Pikes Peak Makerspace is pleased to present the inaugural Tesla's Birthday Party"
Colorado - HackerspaceWiki,https://wiki.hackerspaces.org/colorado,"Aug 1, 2008 — Colorado is a state, district, or province that is located in USA"
The Studio - Bemis Public Library - City of Littleton,https://www.library.littletonco.gov/Services/Spaces/The-Studio,Please read the The Studio's policies here
Aurora Public Library,https://www.auroragov.org/things_to_do/aurora_public_library,What's Happening · Connect With Us · Contact Info · Useful Links · City of AuroraColorado
Clear Creek Makerspace helps support artists and ...,https://www.youtube.com/watch?v=jaDvavf0e-U,
GJ Makerspace,https://members.gjmakerspace.org/,Welcome to GJ Makerspace
DIY Enthusiast Creates Public Makerspace - colorado,https://www.cbsnews.com/colorado/news/diy-enthusiast-creates-public-makerspace/,"Jan 4, 2019 — A do-it-yourself enthusiast in Colorado saw the need to create a space for people to take on projects with the equipment and expertise they require"
Mines Makerspaces: A hub and spoke network to fuel ...,https://www.minesnewsroom.com/news/mines-makerspaces-hub-and-spoke-network-fuel-entrepreneurship-and-innovation,"Nov 18, 2016 — Colorado School of Mines is a public R1 research university focused on applied science and engineering, producing the talent, knowledge and "
Pikes Peak Makerspace Shop Tour,https://www.youtube.com/watch?v=hxXFj7VT90g,
Industry Report: Colorado's Makerspaces - CompanyWeek,https://companyweek.sustainment.com/article/industry-report-colorados-makerspaces/,"Sep 20, 2016 — Industry Report: Colorado's Makerspaces "
CEO of Inside Out Youth Services in Colorado Springs ...,https://gazette.com/news/local/ceo-of-inside-out-youth-services-in-colorado-springs-stepping-down-new-co-director-model/article_1725a1be-b1cf-11ef-b068-83cbb38a3686.html,"3 days ago — Next door to a former gay nightclub and dance hall, the new Inside Out at 516 W"
Colorado: Library 21C (Pikes Peak Library District) Posts ...,https://www.infodocket.com/2014/11/24/colorado-library-21c-pikes-peak-library-district-posts-makerspace-promo-videos/,"Nov 24, 2014 — The C3 makerspaces and Public Media Center at Library 21c offer a place to create with machines, tools, and your hands"
SDSMT.edu,https://www.sdsmt.edu/index.html,Volleyball (Home) - South Dakota Mines vs Colorado Mesa
"Lafayette Library turns 100, celebrates with donation ...",https://www.coloradohometownweekly.com/2024/12/03/lafayette-library-turns-100-celebrates-with-donation-campaign/,3 days ago — Library workers are partnering with the Colorado Gives Foundation nonprofit group to hold a fundraising campaign to continue to provide library 
"Events & Activities for Kids and Families, Broomfield-Erie ...",https://broomfield.macaronikid.com/,Macaroni KID provides local activity guides & news for parents & families
"15 Makerspaces, Meow Wolf, SparkFun AVC, and More at ...",https://makezine.com/article/maker-news/15-colorado-makerspaces-meow-wolf-sparkfun-avc-maker-faire-denver/,"Oct 10, 2017 — Colorado Maker Hub has produced the NoCo and Denver Mini Maker Faires since 2013, and this year, they qualified to produce the full-scale "
Library - City of Loveland | Home Library,https://www.lovelandpubliclibrary.org/,Makerspace Lab · Submit a 3D Print or Poster Order · Technology Classes & Events 
"Tour: TinkerMill Makerspace in Longmont, Colorado",https://www.fabbaloo.com/2020/08/tour-tinkermill-makerspace-in-longmont-colorado,"Aug 20, 2020 — Here, you'll find 2 photo printers with a color-corrected display screen"
zSpace: AR/VR Learning Experiences,https://zspace.com/,Come experience a live demo
"Broomfield's makerspace, inventHQ, recently held an ...",https://www.facebook.com/BroomfieldPublicLibrary/videos/broomfields-makerspace-inventhq-recently-held-an-inaugural-design-sprint-to-deve/745353585979966/,
Watch: Colorado officer uses kid's bike during pursuit,https://www.ourquadcities.com/news/national-news/watch-colorado-officer-uses-kids-bike-during-pursuit/,8 days ago — Watch: Colorado officer uses kid's bike during pursuit
Salmonella-tainted cucumbers cause at least 7 infections ...,https://www.timescall.com/2024/11/30/salmonella-cucumbers-infections-colorado-recall/,6 days ago — Salmonella-tainted cucumbers cause at least 7 infections in Colorado 
San Juan College: Home,https://www.sanjuancollege.edu/,Your journey to success starts at San Juan College
"Broomfield, CO - Splash",https://cobroomfieldweb.myvscloud.com/webtrac/web/splash.html,"Also, find inventHQ, Broomfield's makerspace"
Heard Museum | Celebrating Indigenous Creativity,https://heard.org/,"Explore 12 galleries of American Indian art, contemporary and historic, and a world-class museum shop and café"
Hunter's big game bolsters Heisman hopes as No. 23 ...,https://www.wiproud.com/sports/ap-hunters-big-game-bolsters-heisman-hopes-as-no-23-colorado-rolls-to-52-0-win-over-oklahoma-state/,"7 days ago — BOULDER, Colo"
A Walk Down Memory Lane,https://ngazette.com/a-walk-down-memory-lane/,2 days ago — All Colorado trees were cut ourselves
Coach Deion Sanders says No. 23 Colorado's best players ...,https://www.ourquadcities.com/sports/ap-coach-deion-sanders-says-no-23-colorados-best-players-will-play-in-bowl-game/,"7 days ago — BOULDER, Colo"
🔎🔟 Anythink Library Events to Add to Your Calendar - ...,https://thornton.macaronikid.com/articles/6751d9472cc4c93d72e3461c/-anythink-library-events-to-add-to-your-calendar_-december-2024,1 day ago — Discover the technical and creative possibilities in Anythink's newest Studio makerspace 
"Longmont-area events for Sunday, Dec. 1: Firehouse Art ...",https://www.timescall.com/2024/12/01/longmont-area-events-for-sunday-dec-1-firehouse-art-centers-holiday-market-and-art-sale/,5 days ago — TinkerMill Winter Market & Open House: 11 a
Innovate and Create: MakerLab - Where Creativity Knows No ...,https://www.youtube.com/watch?v=IfrRGWFt678,
