OURSPACE,https://www.ourspacehawaii.com/,Ourspace provides access to state-of-the-art machines that facilitate experimentation and tailored services
Maker Program,https://pace.shidler.hawaii.edu/maker/,"Nov 19, 2024 — Explore, experiment and bring your ideas to life in our Maker Spaces and Recording Studio at the Walter Dods, Jr"
"THE BEST 10 Makerspaces in HONOLULU, HI",https://www.yelp.com/search?cflt=makerspaces&find_loc=Honolulu%2C+HI,"Top 10 Best Makerspaces Near Honolulu, Hawaii - With Real Reviews · 1"
Oahu Makerspace,https://www.facebook.com/OahuMakerspace/,Oahu Makerspace
Can anyone recommend a maker space? : r/Oahu,https://www.reddit.com/r/Oahu/comments/1b9nxbc/can_anyone_recommend_a_maker_space/,"Re-Use Hawaii has a sister organization called HNL Tool Library / Re-Use Workshop it has a tool lending library, They offer a wide array of classes"
Oahu Makerspace - HackerspaceWiki,https://wiki.hackerspaces.org/Oahu_Makerspace,"Oahu Makerspace has a welding shop with MIG, TIG, arc, and oxy-acetylene gear as well as a plasma torch and a blacksmith setup"
The 'Ohana | Makerspace at Aloha Tower Marketplace,https://www.hpu.edu/about-us/the-ohana/article.php?nid=nc08242304,"Aug 24, 2023 — A 900 square foot space in the area formerly occupied by the Student Government Association at Aloha Tower Marketplace (ATM)"
Oahu Makerspace: Home,https://oahumakerspace.square.site/,Location & Hours
"Space for 3D printing, fabrication, sewing, more in new UH ...",https://www.hawaii.edu/news/2023/07/05/rise-makerspaces-lassonde-inspiration/,"Jul 5, 2023 — Students will have exclusive access to 3D printers, laser cutters, tools, sewing machines, project workspaces and more to bring their ideas to life"
Children's STEM Makerspace,https://www.librarieshawaii.org/event/liliha-stem-makerspace/2024-08-22/,"Aug 22, 2024 — Children and families are encouraged to imagine, create, share and build with STEM toys and activities in our Makerspace"
HPU Unveils Innovative Maker Space at Aloha Tower ...,https://www.hpu.edu/about-us/the-ohana/article.php?nid=cl04082401,"Apr 8, 2024 — "
"Oahu Makerspace - 2004 Kahai St, Honolulu, Hawaii",https://www.yelp.com/biz/oahu-makerspace-honolulu,"OAHU MAKERSPACE, 2004 Kahai St, Honolulu, HI 96819, 10 Photos, Mon - 4:00 pm - 9:00 pm, Tue - 4:00 pm - 9:00 pm, Wed - 4:00 pm - 9:00 pm, Thu - Closed, "
The Billodue Makerspace 🧶 | Andrew is a 2nd year from ...,https://www.instagram.com/seattleumakerspace/p/DCX47fmvFn3/,"41 likes, 3 comments - seattleumakerspace on November 14, 2024: ""Andrew is a 2nd year from Honolulu Hawaii studying electrical engineering"
Hawaii State Public Library System | Makerspace,https://www.librarieshawaii.org/tag/makerspace/,Hawaii State Public Library System
Downtown Stoughton Makerspace teaches students to ...,https://www.hawaiinewsnow.com/video/2024/03/31/downtown-stoughton-makerspace-teaches-students-produce-canoe-paddles/,
Ourspace Hawaii Community Makerspace - H2I Group Project ...,https://www.youtube.com/watch?v=QZfAFHJk3Jw,
Oahu Makerspace (@oahumakerspace) / ...,https://twitter.com/oahumakerspace?lang=en,
THE NEST MAKESPACE - Home,https://nestmakerspace.weebly.com/,The Nest Makerspace 
Conversation Piece: Oahu Makerspace,https://fluxhawaii.com/conversation-piece-oahu-makerspace/,"Aug 6, 2013 — Meet some of Hawaii's most talented wood artists"
mauimakers,https://mauimakers.com/,A MAKERSPACE ON MAUI
HICapacity ~ Honolulu Makerspace,http://hicapacity.org/,Hey Honolulu
What is a Makerspace? Is it a Hackerspace or ...,https://www.makerspaces.com/what-is-a-makerspace/,"Now that you have the birdseye view of a makerspace, lets dig a little deeper"
Maker Movement Aims to Remake Manufacturing,https://www.hawaiibusiness.com/maker-movement-aims-to-remake-manufacturing/,"May 6, 2014 — There are hundreds of them around the world and many in Hawaii, including Oahu Makerspace "
A sustainable Hawai'i bio-makerspace rooted in cultural & ...,https://experiment.com/projects/a-sustainable-hawai-i-bio-makerspace-rooted-in-cultural-amp-ancestral-knowledge,"If we can develop Hawaiian place based science kits, we will uplift Hawaiian frameworks for solving our unique environmental challenges"
Hickam Elementary dedicates new Media Center and ...,https://www.hawaiipublicschools.org/ConnectWithUs/MediaRoom/PressReleases/Pages/Hickam-Elementary-new-building.aspx,"Nov 27, 2019 — "
"Oahu Makerspace, 2004 Kahai St, Honolulu, HI 96819, US",https://www.mapquest.com/us/hawaii/oahu-makerspace-417993161,Also
"Maker Space Jobs, Employment in Hawaii",https://www.indeed.com/q-maker-space-l-hawaii-jobs.html,26 Maker Space jobs available in Hawaii on Indeed
Ross Mukai (@oahumakerspace),https://www.instagram.com/oahumakerspace/,
Kauai Makerspace,https://kauaimakerspace.org/,"Our goal at the Kauai Makerspace is to create a community workspace that fosters creative technological exploration, education, and invention"
Best coworking spaces in Honolulu,https://www.coworkbooking.com/north-america/united-states/hawaii/honolulu,Honolulu · XLR8HI - Hawaii's Entrepreneurship Center · Impact Hub Honolulu · Premier workspaces - Pauahi Tower At Bishop Square · Oahu Makerspace · Sultan Ventures
UH students set to move into new state-of-the-art facility ...,https://www.hawaiinewsnow.com/2023/07/05/uh-students-set-move-into-new-state-of-the-art-facility-inspired-by-utah-school/,"Jul 4, 2023 — HONOLULU ( "
Ourspace Hawaii Opening,https://www.flickr.com/photos/hawaii/52855716578,"Apr 29, 2023 — A community makerspace for small businesses, makers, and artists in Hawaii"
Libraries - MCCS Hawaii,https://hawaii.usmc-mccs.org/marine-family-support/base-library,Closed on federal holidays
VIP Project Space | Makerspaces - MakeSchools,http://make.xsead.cmu.edu/knowledgebase/spaces/spaces/vip-project-space,VIP Project Space
Makerspace Kits: Home,https://mccs.libguides.com/mcbhmakerspacekits,"Jan 10, 2023 — Kits designed to help patrons of all ages learn a new skill"
Coding instruction | RAI Hawaii LLC | Kailua,https://www.raihawaii.org/,"RAI Hawai'i · Our Makerspace program currently offers basic coding designed for children in grades pre-K to 5th grade, or children who are novices in coding in 1 "
Coworking Oahu Makerspace in Honolulu,https://www.coworkbooking.com/north-america/united-states/hawaii/honolulu/oahu-makerspace,Oahu Makerspace
Story – Makerspace - KauaiForward.com,https://kauaiforward.com/makerspace/,Kauai Makerspace: 3D Printing for Safer Schools We asked Rich O'Reilly to 
Entrepreneurs Sandbox,https://sandboxhawaii.org/,"Entrepreneurs Sandbox is Hawaii's front door to creativity, technology, innovation, and entrepreneurship "
Free creative lab for keiki opens in Kakaʻako | Hawai'i ...,https://www.hawaiipublicradio.org/local-news/2022-09-06/kakaako-hosts-new-makerspace-for-kids,"Sep 6, 2022 — Hirano reached out to Vivita — a company from Japan that creates makerspaces for children"
Doing school differently – Hawai'i Technology Academy,https://hi.myhta.org/differently/,
KĪPUKA – Nā Mea Hawaiʻi,https://www.nameahawaii.com/pages/kipuka,"KĪPUKA is a community makerspace focused on traditional Hawaiian craft, where practitioners can gather and learn together"
Programs -> Online Registration,https://www.hais.us/RelId/623068/ProgramID/45/ISvars/default/Program_Search.htm,
"PACE | In honor of our opening of the Makerspace, we ...",https://www.instagram.com/pacehawaii/reel/DAXEid_yxLd/,
"Kauai Makerspace, 6670 Puupilo Pl, Kapaa, HI 96746, US",https://www.mapquest.com/us/hawaii/kauai-makerspace-682097935,Kauai Makerspace
Maker Space,https://hawaii.usmc-mccs.org/modules/media/?do=download&id=cb1bceaf-39c1-4815-8a70-558820ce48ca&v=1,MAKERSPACE
Request 3D Printing | Makerspace,https://makerspace.rutgers.edu/request-3d-printing,"Blue Hawaii, Midnight Blaze, Neon City, Gilded Rose, Mistletoe Green, Gold, Gray, Green, Orange, Pink, Purple, Red, Silver, White, Yellow, Magenta, Dark Brown "
Education Cheat Sheet: What is a Makerspace?,https://www.honolulumagazine.com/education-cheat-sheet-what-is-a-makerspace-honolulu-hawaii/,"Feb 18, 2020 — "
MauiMakers | DyvikDesign.com,http://www.dyvikdesign.com/site/research/fablab/mauimakers,The Maui Makers · maui makers map
Oahu Makerspace - Ross,https://www.eventeny.com/company/?c=115007&srsltid=AfmBOopixTXTPIR5b1Qbov639z-b3vfyV6GBcDsXaM1kmzH9gxZ7s5kB,Oahu Makerspace
UH FabLab | Makerspaces - MakeSchools,http://make.xsead.cmu.edu/knowledgebase/spaces/spaces/uh-fablab,UH FabLab
Makerspace: Bookmaking - the Pollak Library Research Guides,https://libraryguides.fullerton.edu/makerspace/bookmaking,"Oct 16, 2024 — Makerspace: Bookmaking"
8 Maker Space Jobs in Hawaii,https://www.ziprecruiter.com/Jobs/Maker-Space/--in-Hawaii,8 Maker Space Jobs in Hawaii · Pizza Maker (Oven King) · Doughnut Maker · Doughnut Maker · Front Office Receptionist | Papakea Resort · Cash Office Responsible 
Academies Overview,https://www.magmarobotics.org/academies-overview,Makerspace
Could Hawaii Libraries Be Makerspaces? - HawaiiTech.com,https://www.hawaiitech.com/policy/library-makerspaces/,"Jan 8, 2015 — What if Hawaii state libraries had the opportunity and some funding to add makerspaces to their offerings? That was one of the ideas floated "
High School West Makerspace Podcast | Smithtown Central ...,https://www.facebook.com/SmithtownSchools/videos/high-school-west-makerspace-podcast/1055209086064761/,
Corinne Okada Takara,https://x.com/CorinneTakara/status/1645467126046793728,"Apr 10, 2023 — I'm raising money to build a Community Lab/Makerspace in Hawaii"
"Walter Dods, Jr. RISE Center: Honolulu, HI Student ...",https://www.risemanoa.com/,"RISE Center residents— will have access to its co-working spaces, meeting rooms, makerspaces, and entrepreneurship programs dedicated to nurturing creativity "
KĪPUKA by Nā Mea Hawaiʻi,https://www.wardvillage.com/shopping/services/kipuka-by-na-mea-hawaii/,Within Nā Mea Hawaiʻi is a makerspace for people to learn and explore a variety of cultural traditions and language
Events - Makerspace at Johns Hopkins,https://makerspace.jhu.edu/events/,"Hawaii Students Association, Health Policy and Management, Health Promotion and Well-Being, Healthcare Organizational Leadership Student Network, Heart and "
A Librarian's Guide to Makerspaces: 16 Resources,https://www.oedb.org/ilibrarian/a-librarians-guide-to-makerspaces/,Hawaii · Idaho · Illinois · Indiana · Iowa · Kansas · Kentucky · Louisiana · Maine · Maryland 
AC grad uses MakerSpace to build 3D maps for climate ...,https://algonquintimes.com/ac-grad-uses-makerspace-to-build-3d-maps-for-climate-activism/,"Oct 2, 2024 — Yussuf Mohamud made his first 3D topographical map after the August 2023 wildfires in Hawaii in the hope of raising awareness about the "
DESIGNING HIGH IMPACT CURRICULAR PRACTICES ...,https://artshumanitieshawaii.org/wp-content/uploads/2018/07/Han-So-Young-2018-STEM-HUIC.pdf,
HiCapacity - Discover Makerspaces,https://www.discovermakerspaces.com/hawaii/honolulu/makerspace/hicapacity,Makerspace
Waipahu | Oʻahu – Hawai'i Technology Academy,https://hi.myhta.org/campuses/waipahu/,hello
What is the EZIE Indigenous MakerPlace program?,https://ezie.jhuapl.edu/outreach/MakerPlace/,A Makerplace is a makerspace that represents place-based learning 
Hawaii and the one year anniversary of the Lahaina Fire,https://compass.broomfield.org/event/past-perspectives-17307,"inventHQ Makerspace, In the Community"
Other Makerspaces,http://wiki.makersmiths.org/display/MAK/Other+Makerspaces?src=contextnavpagetreemode,"Fraser Valley Makerspace, Langley, BC"
About CSTA Hawaii,https://hawaii.csteachers.org/page/about-us,"Phaedra is the founder and CEO of RAI Hawai'i, an Out of School STEM Robot Coding Makerspace for grades K-5"
University of Hawaii - West Oahu Creative Media Facility,https://www.kiewit.com/projects/university-of-hawaii-west-oahu-creative-media-facility/,
"Tech View: Ourspace takes artists, makers to the next level",https://www.staradvertiser.com/2023/04/04/hawaii-news/tech-view/tech-ourspace-takes-artists-makers-to-the-next-level/,"Apr 4, 2023 — Hawaii General Election Results · U"
SSMC 2025 Conference,https://www.myssmc.org/conference,"Student Shop Managers Consortium 2025 CONFERENCE JULY 15-17, 2025"
Hawaii DOE | Learning Centers,https://www.hawaiipublicschools.org/TeachingAndLearning/SpecializedPrograms/LearningCenters/Pages/home.aspx,Hickam Elementary dedicates new Media Center and Makerspace facilities to boost STEM achievement 
EAGER:MAKER: University of Hawaii MakerSTEM,https://www.nsf.gov/awardsearch/showAward?AWD_ID=1723817,"Sep 19, 2023 — "
EE Makerspace,https://exploreecology.org/ee-makerspace/,"A creative hub located in downtown Santa Barbara above the Art From Scrap Creative Reuse Store, the EE Makerspace is brimming with materials, ideas, tools, and "
New University of Hawai'i RISE center has space for 3D ...,https://kauainownews.com/2023/07/07/new-university-of-hawaii-rise-center-has-space-for-3d-printing-fabrication-more/,"Jul 7, 2023 — The University of Hawaiʻi at Mānoa's Residences for Innovative Student Entrepreneurs (RISE) center, opening August 2023, will have makerspaces"
Spotlight,https://www.ahuimanu.k12.hi.us/m/spotlight_persons/persons.jsp?categoryREC_ID=7085&y=2020&m=8&d=1,Justin's Makerspace Project - E14
Primary School Wishes,https://www.lejardinacademy.org/support-lja/wishing-tree/primary,
PMDP - Papahānaumokuākea Marine Debris Project,https://www.pmdphawaii.org/projects-1,"This collaborative project, in partnership with NOAA, the State of Hawaii "
PACE 💡🚀 | Need a place to create a prototype for your ...,https://www.instagram.com/pacehawaii/reel/DCaNK77ThBk/,
Setting up a K-5 makerspace - advice?,https://groups.google.com/g/k-12-fablabs/c/AdEgGNTZx_E,"If you ever get out to Hawaii, please come visit"
3D printing and laser cutters are coming to UH's new ...,https://www.hawaiipublicradio.org/local-news/2023-07-06/3d-printing-and-laser-cutters-coming-to-university-of-hawaii,"Jul 6, 2023 — Rendering of RISE makerspace"
MakerLab – Judy Lemus Science,https://judylemus.com/makerlab/,HIMB MakerLab extends the makerspace concept and DIY culture to science 
"Makerspace Bulletin Board Set, 33 Pieces",https://www.michaels.com/product/makerspace-bulletin-board-set-33-pieces-286300505112018947,
"Aloha from Maui, Hey y'all from Florida, and Ciao from Italia",https://forums.techsoup.org/t/aloha-from-maui-hey-yall-from-florida-and-ciao-from-italia/7607,"Jan 4, 2022 — I'm Davie Brightbill, a founder of Making Awesome, a nonprofit makerspace and education center located in Tallahassee Florida "
Fall 2024 Makerspace Academy,https://www.magmarobotics.org/fall-2024-makerspace-academy,
Hawaii - HackerspaceWiki,https://wiki.hackerspaces.org/Hawaii,"Apr 1, 2011 — Hawaii is a state, district, or province that is located in USA"
Brake Pad Recomendation - Automotive,https://talk.dallasmakerspace.org/t/brake-pad-recomendation/104444,"Nov 30, 2023 — "
Icky Love Art Loft & Gallery,https://www.ickylove.com/,INTRODUCING MAKER SPACE WEDNESDAYS
Makerspace Hosting Ladies' Night on Tuesday,https://www.hawaiibulletin.com/p/ladies-in-tech,"Aug 22, 2015 — HiCapacity, one of Hawaii's first makerspaces, is hosting its first social mixer for women with ""Ladies in Tech Night"
Our First Makerspace = Fueling Student-Led Design,https://medium.com/hope-street-group/our-first-makerspace-fueling-student-led-design-f8b2444cef22,
"Jens Dyvik | Concept, Interaction & Product Design",http://www.dyvikdesign.com/site/,"Makerspace Hawaii, or the Maui Makers, is an interesting DIY community in development"
IRRS: Base Resources: Base Library,https://mccs.libguides.com/c.php?g=1389658,"Sep 26, 2024 — IRRS: Base Resources: Base Library"
Corinne Okada Takara's Post,https://www.linkedin.com/posts/corinneokada_a-sustainable-hawaii-bio-makerspace-rooted-activity-7115776915738677248-hk5e?trk=public_profile_like_view,I'm very grateful that my experiment project to develop accessible Hawai'i place-based STEAM kits (wiht R&D in my Nest Makerspace) was fully 
Maker Academy,https://www.imagineworks.org/maker-academy,Mobile Maker Space Project
Hawaii Tech Guide,https://guide.hawaiitech.com/,"Mar 3, 2024 — A gathering place for software/ tech people on Maui to share ideas & network"
Projects – Judy Lemus Science,https://judylemus.com/projects/,HIMB MakerLab is a makerspace type learning environment designed to 
Air Plant Nina | AIR PLANTARIUM: A= Artists I=In R ...,https://www.instagram.com/airplantnina/reel/C-EGkVPyri4/,
"All-Access: Makers Market, Christmas in Hawai'i, and Water",https://www.southsoundmag.com/arts-entertainment/all-access-christmas-in-hawaii-water/article_480c3d02-767f-11ed-b8ae-4b1a101a3960.html,"Dec 8, 2022 — "
