Indiana Makerspaces,https://indianamakers.org/indiana-makerspaces/,No information is available for this page
Makerspace - HUB & SPOKE,https://hubandspoke.works/makerspace/,"Located in the heart of Fishers, Indiana, adjacent to the Nickel Plate Trail"
1st Maker Space: Design Your Makerspace Today,https://1stmakerspace.com/?srsltid=AfmBOopu0H7dIkoIidZ3lSUYAd4okrYTOc0pHhpxEu8NOgqRc-Okwik8,"1st Maker Space is the leading resource for schools and communities looking to design, build and sustain a new makerspace"
Wells Library Makerspace | Indiana University Libraries,https://libraries.indiana.edu/makerspace,"The Wells Library Makerspace is a creative space for sharing ideas, tools, and information, located in room 106 in the Learning Commons"
Machyne Makerspace: Home,https://machynemakerspace.com/,Machyne is a well-equipped 21st century makerspace located in the 16 Tech Innovation District in downtown Indianapolis
The Makerspace - Ruth Lilly Medical Library,https://library.mednet.iu.edu/library-services/makerspace/index.html,Ruth Lilly Medical Library's Makerspace is an emerging technology laboratory and creative space that serves the IU School of Medicine students and faculty
TekVenture Makerspace,https://www.tekventure.org/,TekVenture Makerspace in Fort Wayne Indiana is a full-featured and affordable workspace
SHAK Makerspace - Home,https://shakmakerspace.com/,SHAK Makerspace is a 501(c)3 non-profit organization
Makerspace,https://www.laportelibrary.org/makerspace,The Exchange Makerspace is a place to make your ideas come alive
About - Luddy Hall & Facilities - Makerspaces,https://luddy.indiana.edu/about/facilities/makerspaces.html,"This open, collaborative makerspace in Myles Brand Hall E120 can also be used by Luddy's partners at Indiana University and in the community"
MakerStudio at the Hussey-Mayfield Library,https://hmmpl.org/discover/makerstudio/,"This space offers use of creative resources such as a 3D printer, iMac with video and sound editing software, sewing and embroidery machines, vinyl cutter and "
Makerspace,https://jefflibrary.org/makerspace/,Indiana Gateway
MatchBOX Makerspace,https://www.mbxmaker.space/,We're a 24/7 shared office space in downtown Lafayette
MakerSpace,https://www.garypubliclibrary.org/makerspace/,"The Gary Public Library (GPL) is one of seven independent library systems in Lake County, Indiana "
Production Area/MakerSpace: WERC - IU South Bend Libraries,https://library.iusb.edu/werc/services.html,Twitter · Facebook · Instagram · YouTube · Indiana University
Ignite Studio at Hamilton East Public Library | Maker Space ...,https://ignite.hamiltoneastpl.org/,Art studio and makerspace at HEPL
"Maker Playground | Fishers Parks & Recreation, IN",https://www.playfishers.com/490/Maker-Playground,Located at Fishers Parks HQ
Boys & Girls Clubs Makerspaces,https://1stmakerspace.com/boys-and-girls-clubs-makerspaces-stem-labs?srsltid=AfmBOopgPwRQoe17DcYBQbyc4JiziU9GYT8j8ZK9oq3x-j0_5d5uXvxH,"The Launching Center at the Boys and Girls Club in Bedford, Indiana, is the largest educationally-focused makerspace in Indiana"
Makerspaces in Indiana,https://www.pharostribune.com/article_3e8d6936-950f-11e9-b1c5-075b29824d97.html,"Jun 22, 2019 — Makerspaces in Indiana "
Makerspaces : r/indianapolis,https://www.reddit.com/r/indianapolis/comments/10we769/makerspaces/,Makerspaces
Makerspaces in Indy : r/indianapolis,https://www.reddit.com/r/indianapolis/comments/11a38pc/makerspaces_in_indy/,Makerspaces in Indy · Machyne looks promising but seems very expensive compared to the one in our current city* · Ruckus only has a facebook 
What is TekVenture? Discover the potential of Indiana's ...,https://www.inputfortwayne.com/features/tekventure-makerspace.aspx,"Jan 16, 2019 — Instead, it's largely financed by northeast Indiana "
Machyne | Downtown Indianapolis,https://downtownindy.org/go/machyne-1,Machyne at 16 Tech is a fully-equipped makerspace designed to help build your dreams into reality
Reservation Form: The Makerspace - Ruth Lilly Medical Library,https://library.mednet.iu.edu/library-services/makerspace/reservation-form.html,Make a reservation to visit the RLML Makerspace
Maker Space Kit - Indiana State Library - IN.gov,https://continuinged.isl.in.gov/kits-and-resources/maker-space-kits/,Menu 
Purdue's Manufacturing and Materials Research ...,https://www.purdue.edu/newsroom/2024/Q2/purdues-manufacturing-and-materials-research-laboratories-announces-new-indianapolis-presence,"Apr 22, 2024 — "
A guide to makerspaces in Indy - INDYtoday,https://indytoday.6amcity.com/guide-to-makerspaces-in-indy,"Nov 4, 2021 — Machyne, 1220 Waterway Blvd"
Castlemakers | Greencastle Indiana's Makerspace!,https://castlemakers.org/,"Oct 15, 2024 — The holes are built by people in the community & Castlemakers members – it's open for anyone to build and show off their creation in this annual "
"Makerspaces in Indianapolis, IL",https://makerspacedir.com/location/indianapolis/,"Makerspace, Hackerspaces, Fablabs, Coworking spaces, and other creatives in Indianapolis, IL"
Makerspace | Makerfactoryindy | United States,https://www.makerfactoryindy.com/,Maker Factory is a creative metal design and fabrication company in Indianapolis that promotes makerspace values and opportunities
Bloominglabs - Bloomington,https://www.bloominglabs.org/Main_Page,"Oct 11, 2024 — Bloominglabs is Indiana's first hackerspace (also known as a makerspace)"
Maker13,https://www.maker13.com/,"Discover Maker13, a premier makerspace, where creativity meets innovation"
Maker Space,https://www.harrisonlifelonglearning.com/makerspace-2/,laser printer 
"TOP 10 BEST Makerspaces in Carmel, IN - Updated 2024",https://www.yelp.com/search?find_desc=Makerspaces&find_loc=Carmel%2C+IN,"Top 10 Best Makerspaces Near Carmel, Indiana · 1"
Indiana K12 Makers Space - Welcome,http://indianamakerspace.weebly.com/,"The ""Making Possibilities for Students of Northeast Indiana Initiative"" allows the Northeast Indiana "
"Maker Space | Artjack Creative Studio | Fishers, Indiana",https://www.artjackcreative.com/,"ArtJack Creative Studio offers many types of inspirational classes, workshops, parties, and events for both children and adults"
About Machyne,https://machynemakerspace.com/about/,
NCPL Makerspace Lab,https://www.ncplibraries.org/ncpl-makerspace-lab/,"For general inquiries, please send an email to info@ncplibraries"
Equipment Catalog - Space Booking & Appointment Services,https://iub.libcal.com/reserve/equipment/makerspace,Libraries Indiana 
The Makerspace,http://www.apls.lib.in.us/library-spaces/makerspace/18,Evergreen Indiana Catalog & Login · Overdrive Books · INSPIRE
Luddy Makerspaces (@makerspaceiu),https://www.instagram.com/makerspaceiu/,Places where you can design and create learn and collaborate have access to fabrication tools
MakerSpace - Evansville - Tech-on-Tap,https://tech-on-tap.com/makerspace,Indiana has been among the top five states for growth of manufacturing jobs over the past five years
Makerspace,https://hcpl.lib.in.us/get-connected/branches/lanesville/makerspace/,"Our Epilog Laser is equipped to produce engraving and cutting projects on various materials, including wood, acrylic, textiles, paper, glass, and more"
"| 1st Maker Space, LLC",https://indychamber.com/member-directory/1st-maker-space-llc/,"A makerspace is a place where students can gather to create, invent, and learn"
Madjax Maker Force | Muncie Indiana,https://www.madjax.org/,"Madjax in Muncie, Indiana is the home of Muncie's Maker Force—a collaboration of makers, artists, entrepreneurs, and businesses building community and "
About The Studio,https://www.greenwoodlibrary.us/thestudio,The Studio Makerspace · Digital Library · Programs · Books & Services · Catalog Search · About Us · How Do I? Reserve a Room · Contact Us
The Sibley Center Makerspace,https://www.sibleymachine.com/,The Sibley Center
MAKE!,https://stemteachindiana.org/make/,"May 17, 2022 — STEM Teach Indiana and 1st Maker Space partnered to deliver a hands-on conference all about creating and using makerspaces in K-8 classrooms"
"Machyne Makerspace @ 16 Tech | Indianapolis, IN",https://www.visitindy.com/listing/machyne-makerspace-%40-16-tech/431394/,Imagine yourself at Machyne
"RUCKUS MAKERSPACE - Indianapolis, IN - Yelp",https://www.yelp.com/biz/ruckus-makerspace-indianapolis,"RUCKUS MAKERSPACE - CLOSED, 1125 E Brookside Ave, Door G-10, Indianapolis, IN 46202, 10 Photos, Mon - 9:00 am - 5:00 pm, Tue - 9:00 am - 5:00 pm, "
S3 - Shared Studio & Maker Space,https://browncounty.com/do-list/s3-shared-studio-maker-space/,About
Tag: makerspace,https://southernindianabusinessreport.com/tag/makerspace/,Tag: makerspace · Uplands Maker Mobile can bring makerspaces right to your town · Free grant writing workshops for Crawford County residents · Lawrence County 
Indiana Makers,https://www.facebook.com/indianamakers/about,Indiana Makers
The MILL | Makerspaces - MakeSchools,http://make.xsead.cmu.edu/knowledgebase/spaces/spaces/the-mill,"Upon completion, the MILL will support teaching and learning with new digital fabrication technologies, framing Indiana University's School of Education as a "
Making a Mini Makerspace - 1 LEU - Indiana State Library,https://continuinged.isl.in.gov/making-a-mini-makerspace-1-leu/,"Jul 15, 2019 — Under the staircase, an old study room, an accessible storage closet … anywhere can become a mini makerspace"
Makerspace,https://wwpl.lib.in.us/services/makerspace/,The Makerspace is named in honor of nine-year-old 
"BloomingLabs | Monroe County Public Library, Indiana",https://mcpl.info/commorg/bloominglabs,"Jul 15, 2024 — Bloominglabs is Indiana's first hackerspace (also known as a makerspace)"
About - Indiana K12 Makers Space,http://indianamakerspace.weebly.com/about.html,Makerspaces in schools are an offshoot of the popular Makerspace movement taking place across the country
Arts & Crafts Programs,https://www.indypl.org/programs-events/art-crafts-and-hobbies,West Indianapolis Branch
Maker Playground,https://homeartisans.com/member/maker-playground/,"The Fishers Maker Playground is a 15,000-square-foot, state-of-the-art, public makerspace at the Fishers Parks Headquarters (located in west Fishers, "
MakerSpace,https://jdcpl.us/makerspace/,MakerSpace
Makerspace,https://ics-charter.org/makerspace/,
STEAMSHOP - IUP,https://www.iup.edu/steamshop/index.html,
1st Maker Space (@1stMakerSpace) / ...,https://twitter.com/1stmakerspace?lang=en,
Ignite Art Studio and Makerspace in Fishers - a free art library,https://indyschild.com/ignite-art-studio-fishers/,"Maker in Residence: A local central Indiana artist is available to offer support, by reservation"
Maker / Tech Space Locations - Michiana Fast Forward,https://www.michianafastforward.com/maker--tech-space-locations.html,"Makerspace: Goshen, INdiana "
About — TekVenture Makerspace,https://www.tekventure.org/about,"From hands-on workshops to collaborative projects, TekVenture Makerspace in Fort Wayne, Indiana offers a nurturing environment for makers of all backgrounds to "
"Meet + Contact Us | Fishers Parks & Recreation, IN",http://playfishers.com/505/Meet-Contact-Us,Nick Snyder
Time Capsule Makerspace,https://indianahumanities.org/event/time-capsule-makerspace/,Make your own time capsule with Fulton County Public Library's Makerspace Coordinator Erica Coffing and Teen Services Assistant Kelsey Foreman
1st Maker Space,https://www.linkedin.com/company/1st-maker-space,1st Maker Space
Be Creative at IGNITE STUDIO Makerspace and Art Studio,https://indywithkids.com/locations/ignite-studio-hamilton-east-public-library/,This dedicated makerspace 
"Makerspace Jobs, Employment in Indiana",https://www.indeed.com/q-makerspace-l-indiana-jobs.html,7 Makerspace jobs available in Indiana on Indeed
SHAK Makerspace | Kokomo IN,https://www.facebook.com/SHAKMakerspace/,"SHAK Makerspace, Kokomo, Indiana"
Studio Maker in Residence,https://www.greenwoodlibrary.us/makerinresidence,"She serves on the Indiana University Library Faculty as the Director, Librarian of the IUPUI Herron Art Library, 1996-present"
Projects | Grant County Community STEM Makerspace,https://www.patronicity.com/project/upland_community_stem_makerspace,
Columbus Propeller,https://members.columbuspropeller.com/,Upcoming events · Music Makerspace · Paper Ornament Workshop · Stained Glass Workshop - Level 1 & 2 · Santa at the Prop · Craft Club: Meet Up
Making Makers Mainstream Across Every Subject & Grade,https://courses.keepindianalearning.org/browse/instruction/courses/kinl-making-makers-mainstream,
About - SHAK Makerspace,https://shakmakerspace.wildapricot.org/About,SHAK Makerspace is a 501(c)3 non-profit organization
Summer Quests in our New Makerspace,https://siymca.org/2024/06/23/summer-quests-in-our-new-makerspace/,"Jun 23, 2024 — "
About — MatchBOX Makerspace,https://www.mbxmaker.space/about,"What we make, makes us"
Member Spotlight: 1st Maker Space,https://indianaiot.com/member-spotlight-1st-maker-space/,"As the “making experts” at the Indiana IoT Lab, 1st Maker Space assists members building products for various uses such as demonstrations, proofs of concept "
Makesmith Workshop Now Open,https://www.connerprairie.org/makerspace-exhibit-makesmith-workshop-to-open-jan-11-at-conner-prairie/,"Jan 8, 2018 — Makerspace exhibit Makesmith Workshop to open Jan"
Purdue University launches 'In Our STEM Era' makerspace ...,https://wishtv.com/lifestylelive/purdue-university-launches-in-our-stem-era-makerspace-to-inspire-young-girls-in-stem/,"Nov 1, 2024 — As Purdue continues to expand its presence in Indianapolis with the recent launch of its new urban campus, events like this represent a "
15 Indiana Libraries - Makerspace ideas,https://www.pinterest.com/instatelibrary/indiana-libraries-makerspace/,"Sep 9, 2015 - Innovative ideas and spaces in Indiana libraries"
Maker Space Coming to Harrison County,https://swidc.org/maker-space-coming-to-harrison-county/,"Mar 8, 2023 — Our Ten Indiana Counties"
SURVEY OF ASSESSMENT IN MAKERSPACES,https://makered.org/wp-content/uploads/2018/02/MakerEdOPP_RB17_Survey-of-Assessments-in-Makerspaces.pdf,by K Peppler · Cited by 25 — This research is conducted by Dr
"New makerspace, recreation area at Southeastern Indiana ...",https://www.facebook.com/812now/videos/new-makerspace-recreation-area-at-southeastern-indiana-ymca/1415074322501665/,
MakerSpace,https://marionpubliclibrary.org/makerspace/,3D Printing
SHAK Makerspace – Kokomo Indiana Visitors Bureau,https://visitkokomo.org/event-location/shak-makerspace/,No Events on The List at This Time
#MAKERSPACE AFICIONADO & ADVOCATE - the journey,http://www.paulshircliff.org/the-journey.html,"Dec 11, 2022 — I have taken the position of Maker Education Specialist at Indiana University School of Education (Bloomington)"
TinkRWorks Media Alert: Maximize Your Makerspace,https://edcircuit.com/tinkrworks-media-alert-maximize-your-makerspace-unlocking-creativity-with-hands-on-steam-learning/,"Nov 13, 2024 — She spent over 20 years teaching upper elementary students at Hamilton Southeastern Schools in Indiana"
"The Maker Mobile, a Mobile Makerspace",https://blog.samtec.com/post/the-maker-mobile-a-mobile-makerspace/,"May 31, 2018 — "
Fostering Innovation,https://www.columbusareachamber.com/fostering-innovation/,Community Makerspace
Make it! Tips on Starting or Expanding your Library's ...,https://www.youtube.com/watch?v=h8fFbJfnLN8,
IUP Part of Tri-County Entrepreneurial Makerspace Project,https://www.iup.edu/news-events/news/2023/05/iup-part-of-tri-county-entrepreneurial-makerspace-project.html,"May 5, 2023 — "
FEAR,https://milwaukeemakerspace.org/2012/12/fear/,"Dec 17, 2012 — I've updated Robert Indiana's iconic sculpture “LOVE” for our times"
"Makerspace, Design Center Coming to Fishers",https://www.insideindianabusiness.com/articles/makerspace-design-center-coming-to-fishers,"Nov 15, 2018 — In an interview with Inside INdiana Business, Decker said the space will attract members from the plumbing, lighting, home building, realtor and "
"Ruckus Makerspace, 1417 Commerce Ave, Indianapolis ...",https://www.mapquest.com/us/indiana/ruckus-makerspace-480268416,Ruckus Makerspace 
