Local Makerspaces,https://www.maker-works.com/local-makerspaces,"Check out the following makerspaces in our part of Michigan: Maker Works, Maker Works Ann Arbor, AHA / All Hands Active, The Secret Lab at the Ann Arbor "
Makerspace,https://www.fhgov.com/makerspace,The Hawk Makerspace empowers makers of all ages and abilities by providing access to a quality technical space
Makerspace Facilities - Wilson Student Team Project Center,https://teamprojects.engin.umich.edu/makerspace-facilities/,1150 Student Team Space - Home and workspace for Robotic student teams
Hollander Makerspace - MSU Libraries,https://lib.msu.edu/makerspace,"Hollander Makerspace is an alternative learning environment and gathering space that encourages cross-discipline collaboration, experimentation and learning"
Other Michigan Makerspaces,https://grandrivermakerspace.org/pages/other-michigan-makerspaces,Our Mission
"Maker Space | Sterling Heights, MI - Official Website",https://www.sterlingheights.gov/2264/Maker-Space,"The Maker Space has 3D printers, a 3D scanner, 3 Cricut Machines, a Silhouette Cameo 4 Pro, a sewing machine, a seven-needle embroidery machine, a sublimation "
Maker Works,https://www.maker-works.com/,Maker Works is here to help you bring your ideas to life
The MakerSpace Home - Wilson Student Team Project Center,https://teamprojects.engin.umich.edu/makerspace-home/,"The Robotics Makerspace includes 4500 sq ft of design, fabrication, assembly, and testing resources in the Ford Motor Company Robotics Building"
Alley Makerspace,https://makerspace.mtu.edu/,We exist to create an environment where everyone in the Michigan Tech community is encouraged and supported to make by providing a welcoming space
"Makerspace | Royal Oak, MI",https://www.romi.gov/1587/Makerspace,"DIAL is our Digital and Audio Lab, where you can transform your old slides, negatives, 8mm film, cassette tapes, VHS tapes or DVDs into a digital format"
MAKERSPACE,https://www.monroeccc.edu/aset/makerspace,
Eureka Lab,https://rhpl.org/eureka-lab/,RHPL's Eureka Lab is a makerspace for everyone
Brightmoor Makerspace – Building Creative Confidence,https://brightmoormakerspace.org/,We make makers
Grand River Makerspace,https://grandrivermakerspace.org/,"Share your feedback and help us shape the vision for a new, permanent Makerspace in GR"
Makerspace,https://www.mclib.org/teens/makerspace/,"Check out the library's new Makerspace for kids and teens, now open in the Youth Services area"
Hollander Makerspace | Makestations - MSU Libraries,https://lib.msu.edu/makerspace/makestations,About
"Build, Create and Collaborate at These Metro Detroit ...",https://www.seenthemagazine.com/culture/build-create-and-collaborate-at-these-metro-detroit-makerspaces/article_75788bdc-984f-11ed-9ad3-df2403ae7bb7.html,"Jan 19, 2023 — Tags · Michigan Makerspaces · Makerspaces In Metro Detroit · Metro Detroit Makerspaces · Brightmoor Makerspace · The Comwall Workshop · Eureka Lab "
"Makerspaces in Ann Arbor, Michigan, MI",https://makerspacedir.com/location/ann-arbor-mi/,"Makerspace, Hackerspaces, Fablabs, Coworking spaces, and other creatives in Ann Arbor, MI"
More than a maker space: How Ann Arbor's Maker Works is ...,https://www.secondwavemedia.com/concentrate/features/makerworks0635.aspx,"Apr 27, 2022 — "
i3Detroit - i3Detroit,https://www.i3detroit.org/,"Located near the heart of Ferndale, we're close to many local events and an amazing community"
"THE BEST 10 Makerspaces in DETROIT, MI",https://www.yelp.com/search?cflt=makerspaces&find_loc=Detroit%2C+MI,"Best Makerspaces in Detroit, MI - i3Detroit, Maker Works, All Hands Active, Techshop, Well Done Goods, Makers 'N Shakers, The Creative Maker Space, "
iCube Makerspace,https://novilibrary.org/services/icube-makerspace/,iCube Makerspace
Lansing Makers Network,https://www.lansingmakersnetwork.org/,The Adaptathon is a collaboration with the Michigan Adaptive Technology program
Maker Space Resources,https://www.mmll.org/a/maker-space-resources,Maker Space Resources · WE HAVE 4 NEW MAKER KITS TO BORROW FOR PROGRAMMING
Projects | Brightmoor Maker Space,https://www.patronicity.com/project/brightmoor_maker_space,"Jun 3, 2015 — The Project"
About Make It UP! Makerspace,https://www.keweenawcape.com/about-make-it-up-makerspace.html,Connect with CAPE
Local makerspaces - Michigan Makers,https://michiganmakers.weebly.com/local-makerspaces.html,Michigan Makers · Local Makerspaces · All Hands Active (also a hackerspace) · Maker Works · Mt
"Make IT, NDL's Makerspace",https://northvillelibrary.org/?page_id=41455,MICHIGAN ACTIVITY PASS · ZOO TICKETS
Makerspace Curriculum Resources | 6 - 8,https://mel.org/curriculum-resources/makerspace/68,Makerspace Curriculum Resources
"Makerspace - Houghton, Michigan",https://pldl.org/makerspace/,Makerspace
Makerspace | Orion Library,https://www.orionlibrary.org/makerspace,The Makerspace is open daily and closes 30 minutes before the library closes
"Makerspaces in Detroit, MI",https://makerspacedir.com/location/detroit/,"Makerspace, Hackerspaces, Fablabs, Coworking spaces, and other creatives in Detroit, MI"
Makerspaces: Beyond Tools and Products,http://www.imls.gov/blog/2015/06/makerspaces-beyond-tools-and-products,"Students at Michigan Makers' site at Scarlett Middle School (Ann Arbor, MI) hack fleece pajama pants into scarves"
Makerspace,https://www.petoskeylibrary.org/en/visit-us/makerspace.aspx,"Petoskey, MI 49770"
Instructional Studios | Central Michigan University,https://www.cmich.edu/offices-departments/curriculum-instructional-support/services-at-a-glance/maker-spaces,CIS staff can also help during our regular business hours
Facilities • Library Maker Space,https://cityofmidlandmi.gov/Facilities/Facility/Details/Maker-Space-48,View all facilities Library Maker Space Subfacility of Grace A
"History department and local makerspace ""forge"" innovative ...",https://news.umflint.edu/2018/12/18/history-department-and-local-makerspace-forge-innovative-partnership/,"Dec 18, 2018 — University of Michigan-Flint students will be able to check out 48-hour passes from the Frances Willson Thompson Library to a local makerspace starting in "
"THE BEST 10 Makerspaces in TROY, MI - Updated 2024",https://www.yelp.com/search?cflt=makerspaces&find_loc=Troy%2C+MI,"Top 10 Best Makerspaces Near Troy, Michigan - With Real Reviews · 1"
News Flash • New Makerspace Program at the Library!,https://www.scsmi.net/CivicAlerts.aspx?AID=945,"Apr 10, 2024 — Funding for these programs is provided in part by the Institute of Museum and Library Services through the Library of Michigan"
"Idea Lab - Birmingham, Michigan",https://www.baldwinlib.org/idealab/,Makerspace · Michigan Activity Pass · Mission · Movies · Music · Naming Rights · New catalog coming soon · NY Times · NYT Crossword · Online Book Sales · Online 
Machine Shop - Physics and Astronomy,https://www.emich.edu/physics-astronomy/about/facilities/machine.php,Our large modern Machine Shop
Maker Space Saturdays,https://sloanlongway.org/makerspacesaturdays/,Maker Space Saturdays
All Hands Active,https://allhandsactive.org/,Ann Arbor's all-volunteer non-profit community makerspace
Jackson Makerspace,https://www.facebook.com/jacksonmakerspace/,"Jackson Makerspace, Jackson, Michigan"
Kzoo Makers: Kalamazoo Makerspace,https://www.kzoomakers.org/,Kalamazoo Makerspace
Open Workshops Makerspace,https://www.open-workshops.com/,"Opdyke Rd, Auburn HIlls, MI 48326, just north of University Dr"
Makerspace,https://www.laportelibrary.org/makerspace,"Michigan City, IN 46360"
Makerspace,https://dexter.lib.mi.us/events/makerspace-38/,"Aug 19, 2024 — Michigan Legal Help · Novelist · Services · Adult Services · Children's Services · Teen Services"
Michigan Makers United - MAPS Makerspace,https://united.mapsmakerspace.org/,This group was started by Marquette Area Public Schools teacher Becky LaBrecque
About us,https://factorytwo.org/about,"Factory Two is a community makerspace located in the heart of downtown Flint, Michigan"
Maker spaces at UMich : r/uofm,https://www.reddit.com/r/uofm/comments/jq8p3p/maker_spaces_at_umich/,
Makerspace,https://alpenalibrary.org/venue/makerspace/,Sewing Club
Kzoo Makers,https://www.kalamazooarts.org/venue/kzoo-makers/,"Kzoo Makers is a 9,000 sq ft makerspace located in downtown Kalamazoo, MI"
HYPE Makerspace,https://www.urbanlibraries.org/resources/makerspaces-in-libraries/hype-makerspace,"The Detroit Public Library HYPE Makerspace engages with young adults aged 13-18 in Detroit, MI"
Buddy's Makerspace,https://www.chelibrary.org/about/buddy_s_makerspace.php,"Inviting all inventors, crafters, artists, scientists, engineers, and hackers to explore digital and traditional fabrication tools and equipment at your public "
Our Makerspace - Grand Rapids,https://treetopscollective.org/pages/our-makerspace?srsltid=AfmBOoqyQQyOokzmCvAU3d3i57XirCipGxNPTUCTQGFFcZ1GKwvtYWaX,
MAKIN' AT BACON,https://www.baconlibrary.org/makinatbacon,Find out what's happening in the makerspace
The Alley - Makerspace at MTU (@makerspacemtu),https://www.instagram.com/makerspacemtu/,Hours: Monday - Thursday 3-9pm
Grand River Makerspace,https://www.facebook.com/grmakerspace/,"Grand River Makerspace, Grand Rapids, Michigan"
Library makerspaces help communities tap into joy of ...,https://www.michiganpublic.org/families-community/2017-01-02/library-makerspaces-help-communities-tap-into-joy-of-creativity,"Jan 2, 2017 — "
"Dream it, Do it: The Hawk Makerspace Launches New ...",https://www.fhgov.com/government-business/news-information/latest-news/dream-it-do-it-the-hawk-makerspace-launches-new-classes-workshops-to-help-community-unleash-creativity/,The City of Farmington Hills has the largest dedicated municipal Cultural Arts Division in the State of Michigan
Makerspaces On Campus – The Lode,https://mtulode.com/6855/news/makerspaces-on-campus/,"Sep 19, 2023 — On Michigan Tech's campus there are several makerspaces available for students to use for free"
Monarch Makerspace Workshops Delivery Burton MI,https://www.bentleyflorist.com/monarch-makerspace-workshops/cat6710015,Send Monarch Makerspace Workshops today
Factory Two,https://factorytwo.org/,"Okay, Got it"
Opportunities in the Planetary Makerspace @ MSU,https://www.sethajacobson.com/opportunities,Will you hire me as a graduate student? Maybe
Dream Lab,https://grossepointelibrary.org/dream-lab,"10 Kercheval Ave Grosse Pointe Farms, MI 48236"
Troy Public Library Makerspace,https://troypl.org/services/adults/kits/makerspace.php,Makerspace
Makerspace,https://dexter.lib.mi.us/events/makerspace-13/,
PLDL Makerspace is Open - Houghton,https://pldl.org/pldl-makerspace-is-open/,PLDL Makerspace is Open 
Maker Space - Hart Middle School,https://hart.rochester.k12.mi.us/academics/media-center/maker-space,Follow Hart MakerSpace on Twitter
Creation Station,https://www.portagelibrary.info/creation-station/,Michigan Activity Pass · Friends of PDL
"Novi, Mi opened the iCube Makerspace at its public library",https://govlaunch.com/projects/novi-mi-opened-the-icube-makerspace-to-enhance-resident-innovation-at-its-public-library,"The City of Novi Michigan has added the iCube Makerspace to its library, designed for creativity and exploration"
Fab Lab,https://www.lakemichigancollege.edu/community/fab-lab,The Fab Lab at Lake Michigan College is an open-access digital fabrication studio and collaborative workshop
AMP Lab @ WMU | Western Michigan ...,https://wmich.edu/grandrapids/amp-lab,"The AMP Lab @ WMU is a makerspace in its truest form, providing a space to bring ideas to life"
"University Liggett School, MI — The Making of a Makerspace",https://www.demcointeriors.com/project/university-liggett-school-makerspace/,The Making of a Makerspace
Makerspace - Enrichment - Home,https://northportps.org/enrichment/makerspace/,Makerspace
Calendar • Intro to Makerspace,https://www.scsmi.net/Calendar.aspx?EID=10322,"Apr 4, 2024 — Funding for these programs is provided in part by the Institute of Museum and Library Services through the Library of Michigan"
Makerspace,https://www.otsego.lib.mi.us/reserve-room/makerspace,"Gaylord, MI 49735 (989) 732-5841"
Makerspace Policy,http://www.adrian.lib.mi.us/DocumentCenter/View/1379/Makerspace-Policy,"Adrian, Michigan"
Center for Excellence in STEM Education,https://www.cmich.edu/academics/colleges/college-education-human-services/centers/center-for-excellence-in-stem-education,STEM center and makerspace
1st Maker Space: Design Your Makerspace Today,https://1stmakerspace.com/?srsltid=AfmBOoppfyCF6_7caStEk8yCVp8wytR4mmLegTJLsMs7M7s7yD24VMS5,Over 250+ K-12 schools and community centers across the United States have invested in a full makerspace with 1st Maker Space
Job Opportunity: Library Makerspace Coordinator at ...,https://jobs.mitalent.org/job-seeker/job-details/JobCode/263336992,"Apply to work as a Library Makerspace Coordinator at Oakland University in Rochester, Michigan 48309 - Job Code: 263336992"
Jackson Makerspace - HackerspaceWiki,https://wiki.hackerspaces.org/Jackson_Makerspace,Jackson Makerspace
Beyond the Makerspace: Making and Relational Rhetorics,https://www.fulcrum.org/concern/monographs/3197xn981,by A Shivers-McNair · 2021 · Cited by 15 — Beyond the Makerspace contributes not only to our understanding of making and makerspaces 
U Michigan-Flint Taps Local Makerspace for Learning History,https://campustechnology.com/articles/2019/01/17/u-michigan-flint-crafts-makerspace-partnership-for-student-learning.aspx,"Jan 17, 2019 — A Michigan institution is taking advantage of proximity to a local makerspace for student learning"
Innovation Lab,https://www.makerspace.ece.mtu.edu/,"Plexus Innovation Lab is an Electronics Makerspace located on the 6th floor of EERC, room 621"
Southfield's Stevenson Elementary has one-of-a-kind ...,https://unitedwaysem.org/press/southfields-stevenson-elementary-has-one-of-a-kind-stem-classroom/,
Explore Make it UP!,https://www.keweenawcape.com/explore-make-it-up.html,Click on any of the photos below to get a better look at what our Make it UP
Makerspace Mondays,https://www.mysdl.org/event/makerspace-mondays-2,A different activity will be highlighted each week
Michigan Robotics,https://twitter.com/UMRobotics/status/1824438391842189664,"HIRING: Robotics Makerspace Supervisor $68k - $72k, Ann Arbor, MI Instruct and mentor in the electronics lab, digital fab shop and machine "
"Maker's Space - Novi, MI",https://www.sewingexpo.com/Events/Novi-MI/Features-Events/Makers-Space,Maker's Space · Sit down and get hands-on in the Maker's Space inside the Exhibit Hall
Category: Events,https://brightmoormakerspace.org/category/events/,
Calendar • Monday Makerspace,https://waterfordmi.gov/Calendar.aspx?EID=7178,Monday Makerspace
Calendar • Maker Space Open Lab,https://www.sterlingheights.gov/calendar.aspx?EID=7228,"Date: September 8, 2021 Time: 5:30 PM - 8:30 PM Location: Maker Space Address: 40255 Dodge Park Road Sterling Heights, MI 48313"
Rochester Makerspace,https://rocmakers.org/,"The Rochester Makerspace provides members with 24/7 access to tools, space, resources, and a community of like-minded makers"
Spring 2019 : NMC-Incubated Innovation,https://www.nmc.edu/news/media/nexus/2019-spring/nmc-incubated-innovation.html,Hybrid Robotics is shaping up to be the second viable company to emerge from NMC's Maker Space
Events - Macomb Makers,https://macombmakers.macombserver.net/events-news/,"In March of this year, we had the pleasure of welcoming students from Jeannette Junior High School, located in Sterling Heights MI"
