MSU Makerspace,https://www.montana.edu/makerspace/,"The Bill Wurst Makerspace, or Makerspace, provides the MSU community a centrally located, universally available, welcoming space where they can build, test, "
Bozeman Makerspace,https://bozemanmakers.org/,"Our Makerspace is a workshop combined with a meeting space where people of similar interests or skills can converge to create, modify, learn, talk and build"
"The Making Place | Makerspace | Flathead Valley, Montana",https://www.themakingplacemt.com/,A new non-profit working to create a makerspace and community art studio in the Flathead Valley
MakerSpace,https://www.umt.edu/launchpad/makerspace.php,"Nov 26, 2024 — The makerspace is a creative hub with tools like sewing machines, Cricut, and Glowforge, ideal for crafting, prototyping, and bringing ideas "
Equipment - MSU Makerspace,https://www.montana.edu/makerspace/equipment/equipment.html,There is a wide assortment equipment available for use in the Makerspace
MakerSpace,https://www.missoulapubliclibrary.org/home/spaces/makerspace/,"Where creativity and curiosity merge into a space that uses innovative tools and technologies for educational, recreational, and business pursuits"
The Largest Makerspace in Montana: Where the Community ...,http://scrapinbillings.com/,"Our goal at SCRaP is to be that place- that place where artistic abilities can be explored and encouraged, to keep art accessible and affordable for all, the "
FVCC Makerspace – Flathead Valley Community College,https://www.fvcc.edu/venue/fvcc-makerspace,Open Lab Time 
Reservations - MSU Makerspace | Montana State University,https://wetlands.msuextension.org/makerspace/new-site/new_reservation.html,"The Makerspace is available to registered student organizations as a meeting, building, or instructional space"
Bozeman Makerspace,https://bozone.com/venue/bozeman-makerspace/,"Our makerspace is a community workshop combined with a meeting space where people of similar interests or skills can converge to create, modify, learn, talk and "
Billings MT MakerSpace,https://www.facebook.com/groups/BillingsMTMakerSpace/,"A space for the Makers in Billings Montana to gather and begin building a community to share ideas, skills and insights"
Makerspaces: Where People Create,https://www.montanaseniornews.com/makerspaces/,"Oct 19, 2021 — A place in which people with shared interests, especially in computing or technology, can gather to work on projects while sharing ideas, equipment, and "
Innovation Factory - Resources,https://www.umt.edu/innovation-factory/resources.php,"The Worklab is a makerspace, and houses the equipment below with a goal to provide access to anyone who wants to learn safe and economic use of advanced "
Admin Login - MSU Makerspace - Montana State University,https://wetlands.msuextension.org/makerspace/new-site/admin.html,Bill Wurst Makerspace
Maker's Space: Annie Bailey Art,https://simplylocalbillings.com/makers-space-annie-bailey-art,
Tools – Bozeman Makerspace,https://bozemanmakers.org/tools/,Tools at the Makerspace Woodworking - Power Band sawTable saw (2)Miter 
Getting Involved - Montana State Library,https://msl.mt.gov/libraries/statewide_projects/LSTA_pilots/gettinginvolved,Montana Makers
Makerspace? : r/missoula,https://www.reddit.com/r/missoula/comments/era8m9/makerspace/,Makerspace? Anywhere in town have public access to lathes 
MSU Makerspace (@msumakerspace),https://www.instagram.com/msumakerspace/,"112 Followers, 20 Following, 13 Posts - MSU Makerspace (@msumakerspace) on Instagram: ""The Official Instagram of the Montana State University Makerspace"""
Makerspace Kits,https://dillonpubliclibrary.org/makerspace-kits/,Dillon Public Library is a small library in the southwest corner of Montana
'Hands on': MSU students test engineering creativity in ...,https://www.bozemandailychronicle.com/news/montana_state_university/hands-on-msu-students-test-engineering-creativity-in-makerspace/article_30e242c6-dbe0-11ee-9119-830228c917d5.html,"Mar 6, 2024 — The workspace is Montana State University's Bill Wurst Makerspace, a lab with a variety of tools for any student to use for class projects — or "
FVCC Hosts Makerspace Workshops,https://www.fvcc.edu/news/fvcc-hosts-makerspace-workshops,"Jun 9, 2024 — Instructor for all workshops, Katie Eberhardy, is an AmeriCorps member sponsored through Montana Campus Compact serving with Flathead Valley "
MSL Makerspace Equipment incl,https://docs.msl.mt.gov/slrd/statewide_projects/pilots/makerpolicy.pdf,MSL Makerspace Equipment includes but is not limited to the following items: • Getting Started with Arduino Kit v3
"Makerspace Walk-In Hours 11/30/2024 Missoula, Montana ...",https://www.missoulaevents.net/11/30/2024/makerspace-walk-in-hours/,"7 days ago — Use the Makerspace's 3D printers, laser engraver, sewing machines, and other crafting supplies during this regularly scheduled walk-in time"
A rural Montana district goes all in on makerspaces,https://hechingerreport.org/a-rural-montana-district-goes-all-in-on-makerspaces/,"Oct 11, 2018 — Walking through Havre Public Schools, a visitor would likely take note of the makerspaces"
University of Montana,https://makerspacedir.com/listing/university-of-montana/,University of Montana
"Calendar • Planning a ""MakerSpace"" - Butte-Silver Bow",https://www.co.silverbow.mt.us/Calendar.aspx?EID=3225,Montana Tech/B-SB Coordinating Committee
"Bozeman Makerspace, 10 Innovation Ln, Unit D, ...",https://www.mapquest.com/us/montana/bozeman-makerspace-661532437,Bozeman Makerspace
MakerSpace: Introduction to Laser Cutters 11/09/2024 ...,https://www.missoulaevents.com/11/09/2024/makerspace-introduction-to-laser-cutters/,"Sep 11, 2024 — Participants will learn the basics of how laser cutters work, and how to use the one in the Makerspace specifically"
Makerspace,https://www.clintweb.net/domain/469,Montana Vista Elementary School
Daily Inter Lake Events - Makerspace Open Lab Time,https://dailyinterlake.com/events/?_evDiscoveryPath=/event/2582993-makerspace-open-lab-time,This Week in the Flathead Event Calendar Montana Life Best of Flathead Crossword Sudoku Local TV Listings Winslow Nichols Leadership Award Flavor · Outdoors
Bozeman Makerspace,https://www.facebook.com/bozemanmakerspace/,"Bozeman Makerspace, Bozeman, Montana"
"Bozeman Makerspace, 1018 E Griffin Dr, ...",https://www.mapquest.com/us/montana/bozeman-makerspace-446579888,"With offices from Alaska to South Carolina headquartered in Bozeman, Montana, we continue leading the industry through our comprehensive reach and marketing "
MSU engineer students' collaboration on display at Makerspace,https://www.youtube.com/watch?v=rsw9g-De7iE,
Library Policies & FAQs,https://www.umwestern.edu/section/library-policies/,
Missoula Public Library: Home,https://missoulapubliclibrary.org/,MakerSpace · Tony Veazey Montana Room · Demonstration Kitchen · About · Hours & Locations · Missoula's New Library · Strategic Plan · Policies · Give & 
Blog Posts Archives - Page 14 of 16,https://mtcompact.org/resource-type/blog-posts/page/14/,"ERIK SWANSON, VISTA WITH THE UNIVERSITY OF MONTANA AND MISSOULA PUBLIC LIBRARY MAKERSPACE, CHECKS-IN"
MOP Shop Makerspace | United Way of the Lewis & Clark ...,https://www.volunteerhelena.org/agency/detail/?agency_id=53584,"The MOP Shop is a shared workspace in Helena Montana that provides the maker the means (specialty tools, shop space, creative community) to make"
Bozeman MakerSpace,https://www.discovermakerspaces.com/montana/bozeman/makerspace/bozeman-makerspace,Member Bozeman MakerSpace in Bozeman MT
Meeting Kids Where They Are: Welcoming Neurodiversity ...,https://issuu.com/montanaparent/docs/mtp_may_2024/s/47299989,He had arrived in our makerspace at the Montana Science Center excited to try 3D printing
The Making Place is taking strides to create a community ...,https://www.kpax.com/community/salute-to-service/the-making-place-is-taking-strides-to-create-a-community-makers-space,"Oct 12, 2024 — and I heard a lot of people talking about wanting to create a makerspace or something like it"
MSU Bozeman Montana,https://msuinnovationcampus.com/about/,"MSU Innovation Campus is a 42-acre development of Maker Spaces in fast-growing Bozeman, Montana, being managed and developed by Charter Realty and "
Montana Vista Elementary / Homepage,https://www.clintweb.net/Domain/14,Montana Vista Elementary School
Maker's Space: Jerrid Gray,https://simplylocalbillings.com/makers-space-jerrid-gray,Montana Makers
MakerSpace: Open Hours/Sewing Drop In 11/06/2024 ...,https://www.missoulaevents.com/11/06/2024/makerspace-open-hours-sewing-drop-in/,"Jun 11, 2024 — Bring your damaged clothing to the MakerSpace and learn how to mend them during these mending and sewing-focused walk-in hours"
MakerSpace: Build your Creativity Muscles 10/18/2024 ...,https://www.missoulaevents.net/10/18/2024/makerspace-build-your-creativity-muscles/,"Oct 18, 2024 — "
Missoula Makerspace - HackerspaceWiki,https://wiki.hackerspaces.org/Missoula_Makerspace,Missoula Makerspace
makerspace-specialist | Job Details tab | Career Pages,https://www.governmentjobs.com/careers/missoulacounty/jobs/3547284/makerspace-specialist?keywords=library&pagetype=jobOpportunitiesJobs,Makerspace Specialist 
Moving Towards a Diverse University Maker Culture,https://assets.pubpub.org/ikze2own/41583760335815.pdf,by AC Rutherford — At Montana State University we seek to expand the reach of the MSU Makerspace to students from all corners of campus
Other Makerspaces,http://wiki.makersmiths.org/display/MAK/Other+Makerspaces?src=contextnavpagetreemode,"Missoula Public Library - Makerspace, Missoula, Montana"
Topic: Outreach,https://makered.org/blog/topic/outreach/,"Starting a makerspace can be daunting, whether it's finding a facility and equipment, engaging community members, accessing funding, or dealing with "
Missoula Makers Collective,https://www.mslamakers.com/,"Why shopping local · Visit our store to Shop local makers · Check out our classes, markets, maker meetings, and more"
CMI2's Mobile Immediate Need Engineering Resource ...,https://cmi2.org/2024/08/12/cmi2s-mobile-immediate-need-engineering-resource-installed-with-the-montana-army-national-guard/,"Aug 12, 2024 — The MINER facilities are field-constructed makerspace "
MTCC Summer Associate FVCC Library Makerspace,https://my.americorps.gov/mp/listing/viewListing.do?fromSearch=true&id=111487,Montana Campus Compact (MTCC) serves as the intermediary for this project
Missoula Public Library - MSR Design Portfolio,https://msrdesign.com/case-study/missoula-public-library/,
Re-making the library makerspace : critical theories ...,https://search.lib.utexas.edu/permalink/01UTAU_INST/be14ds/alma991058185889606011,
Fix-It Clinic (At Missoula Public Library - Makerspace),https://www.homeresource.org/event/fix-it-clinic-at-missoula-public-library-makerspace/,"Aug 19, 2023 — Fix-It Clinic (At Missoula Public Library – Makerspace)"
Griffin Matthew - Montana State University-Bozeman,https://www.linkedin.com/in/griffin-matthew-82b30b74,MSU Makerspace Lab Director at Montana State University-Bozeman · Experience: Montana State University-Bozeman · Education: Montana State University-Bozeman 
Instructional design jobs - Code4Lib Job Board,https://jobs.code4lib.org/tags/Instructional%20design,"Montana State University Library, in Bozeman, MT, seeks student "
Bozeman Makerspace - Profile,https://www.givegab.com/nonprofits/bozeman-makerspace-9fe20ea9-eeaf-46f7-808f-23fa8700e6b4,Bozeman Makerspace
2024 Makerspace Camp Registration,https://www.fulton-school.org/apps/form/form.CHEDS.u2oLjvE.1dp_?_=1706206708503,
A Librarian's Guide to Makerspaces: 16 Resources,https://www.oedb.org/ilibrarian/a-librarians-guide-to-makerspaces/,Montana · Nebraska · Nevada · New Hampshire · New Jersey · New Mexico · New York · North 
Library makerspaces and media labs | Let's Make,https://www.letsmakeguide.com/?page_id=172,"Missoula, Montana (US)"
Take a tour of the 2019 Tesla Model 3 with Community ...,https://www.instagram.com/montanaseniornews/p/CQjExjQlwyM/,#makerspace #makerspaces #create #createeveryday #createeverydamnday #montana #50plusandfabulous #50plus
Bozeman Makerspace - HackerspaceWiki,https://wiki.hackerspaces.org/Bozeman_Makerspace,Bozeman Makerspace
Link Library - Clint Independent School District,https://tx02216513.schoolwires.net/site/default.aspx?PageType=14&DomainID=2865&PageID=4972&ModuleInstanceID=7501&ViewID=9d7780dc-000e-458b-ba39-cfc84059b040&IsMoreExpandedView=True,Montana Vista Elementary School
"Innovators in Wyoming, Montana team up to build PPE","https://www.powelltribune.com/stories/innovators-in-wyoming-montana-team-up-to-build-ppe,24893","Apr 7, 2020 — Phorge Makerspace in Sheridan runs a chat server on an app called Discord where several dozen volunteers — most of them at Makerspaces in "
"CO+LAB | Billings Public Library, MT",https://billingslibrary.org/535/CoLab,"The CO+LAB at the Billings Public Library is an innovative makerspace designed to spark creativity, learning, and collaboration for all ages"
MSU LIFE Scholars | Come hang out with us tomorrow in ...,https://www.instagram.com/life_scholars/p/DCU9_5EytSN/,
Montana Science Center - Science Camps,https://mtparent.com/montana-science-center-science-camps,
Makerspace shoot with - handmademt,https://www.tiktok.com/@imagesbyadriannallc/video/7381539147133013294,Makerspace shoot original sound - Adrianna Reid 
Montana Fair Fun - Mix 97.1,https://billingsmix.com/montana-fair-fun/,"Aug 9, 2017 — The Magic City Makerspace will have a sampling of all the fun creative things you can do in a shared space with shared tools and equipment"
Makerspaces: Where People Create,https://www.idahoseniorindependent.com/makerspaces/,"And In Montana, Flathead tribal elders joined the University of Montana and SciNation to create Kwul 'I'tkin Maker Truck"
Abigail Truex - Makerspace Lab Director - Montana State ...,https://www.linkedin.com/in/abigail-truex-7a916a228,Makerspace Lab Director at Montana State University · Experience: Montana State University-Bozeman · Education: Middlebury College · Location: Bozeman · 162 
FEATURED WORK Franklin Makerspace | dskarchitects,https://www.dskarch.com/santamonica,The Makerspace Building at Franklin Elementary School is the first 
Riverview Elementary receives grant for Makerspace program,https://www.montanarightnow.com/great-falls/riverview-elementary-receives-grant-for-makerspace-program/article_133a24b6-5e48-11e9-a73f-a75c407887e6.html,"Apr 13, 2019 — Tap into Non-Stop News from Montana Right Now"
Event List,https://mammen.librarycalendar.com/events/list,Join the Makerspace as we learn the basics of building a book
MakerSpace at Mt. SAC,https://www.mtsac.edu/makerspace/,"The Mountie MakerSpace was a place where students, staff, and faculty gather to share resources and knowledge, work on projects, develop skills, and grow"
"Multi-Million Dollar Library, Community Space Opens In ...",https://www.mtpr.org/montana-news/2019-06-05/multi-million-dollar-library-community-space-opens-in-kalispell,"Jun 5, 2019 — There are community areas, a makerspace, whiteboards painted directly "
MAKER SPACES IN ILLINOIS - IATP Makers,https://iatpmakers.org/maker-spaces/,"Mar 20, 2024 — "
Montana State Backcountry Squatters | Come check this! We ...,https://www.instagram.com/backcountrysquatters_msu/reel/C4rl0lDNGn6/,
Montana Ethical Hackers - Discover Makerspaces,https://www.discovermakerspaces.com/montana/helena/makerspace/montana-ethical-hackers,Montana Ethical Hackers
"Blunderbuss - Hipcamp in Bozeman, Montana",https://www.hipcamp.com/en-US/land/montana-blunderbuss-mxvhl178,"Blunderbuss is a long-term hostel, campground, maker space, and studio in Bozeman, Montana"
Listening to Makers: Exploring Engineering Students ...,https://www.researchgate.net/publication/344795840_Listening_to_Makers_Exploring_Engineering_Students'_Recommendations_for_Creating_a_Better_Makerspace_Experience,
Seed Saving 101 featuring Montana Survival Seeds,https://northvalley.librarycalendar.com/event/seed-saving-101-featuring-montana-survival-seeds-5228,"Dig into seeds like never before with Barnes, Owner/Founder of Montana Survival Seed "
Spaces that aim to boost kids' creativity,https://www.cnn.com/2017/09/18/health/kids-makerspaces/index.html,"Sep 18, 2017 — As community makerspaces begin to take root in Ontario's elementary schools, students are behaving better"
Students use cool tools to solve local problems in summer ...,https://news.wisc.edu/students-use-cool-tools-to-solve-local-problems-in-a-summer-makerspace-course/,"Jul 18, 2018 — Undergraduates Montana Hodur, standing, and Rachel Johnson dry-fit "
WHS Library - eBooks,https://sites.google.com/whitefishschools.org/whslibrary/reading/ebooks,"Games, AV, & Makerspace · Student Projects · About · WHS Library · Home "
Adjustable Height Steel Utility Table - Supreme HPL 72x30,https://www.hertzfurniture.com/makerspace-robotics-steam-furniture--adjustable-height-steel-utility-table---supreme-hpl--16711--mo.html?srsltid=AfmBOorer76PAMVJ2HgDTQSpCJtvdXsI_suNmQoS40AErkflaSq5IvXp,
A MakerSpace & Maker Corps at The Great Falls Public ...,https://makered.org/blog/a-makerspace-maker-corps-at-the-great-falls-public-library/,"Feb 25, 2013 — This will be the first service of this kind to be offered publicly in Great Falls, Montana"
Makerspaces expanding STEM opportunities in rural schools,https://www.k12dive.com/news/makerspaces-expanding-stem-opportunities-in-rural-schools/507698/,"Oct 20, 2017 — In many cases, these efforts have also served to benefit the surrounding community, such as when students at Montana's Corvallis High School "
Spectacular Makerspace Takes Off,https://www.seeleylake.com/story/2016/11/10/opinion/spectacular-makerspace-takes-off/1538.html,"Nov 10, 2016 — SEELEY LAKE - Makerspace is a time for Seeley Lake Elementary (SLE) kids to unleash their creativity"
Belgrade Community Library plans for new location,https://www.montanarightnow.com/bozeman/belgrade-community-library-plans-for-new-location/article_8faa6480-c92f-11eb-b219-ebc73789179b.html,"Jun 9, 2021 — "
Most Interesting Makerspaces in America,https://makezine.com/article/maker-news/most-interesting-makerspaces-in-america/,"Jul 29, 2014 — Bozeman, Montana – A small but growing space in a building that used to house livestock auctions"
Lincoln-McKinley building Makerspace with Masonic grant,https://www.havredailynews.com/story/2018/04/30/local/lincoln-mckinley-building-makerspace-with-masonic-grant/518750.html,"Apr 30, 2018 — Alan Frohberg from the charitable arm of the Montana Masonic Foundation in Great Falls, along with Mason members Chris Smith and Dave Sageser, "
Need something engraved or cut let us know! | By Helena ...,https://www.facebook.com/HelenaMakerSpace/videos/need-something-engraved-or-cut-let-us-know/3803914959683083/,
(PDF) Library and Student Innovation Center: Makerspace!,https://www.researchgate.net/publication/344817611_Library_and_Student_Innovation_Center_Makerspace,
Heavy Duty Steel Utility Table - Supreme HPL Top 60x36,https://www.hertzfurniture.com/makerspace-robotics-steam-furniture--heavy-duty-steel-utility-table---supreme-hpl-top--16744--mo.html?srsltid=AfmBOopg3u_UjCz9gz1erwnzfPPY6P-rrf-_IP0SfC2gXSkWDnXKtOD7,
