An Oklahoma City makerspace: Co-Laboratory Oklahoma,http://colab-ok.com/,"The Co-Lab is, above all else, a community center"
Library MakerSpace | OU Libraries,https://libraries.ou.edu/locations/library-makerspace,"The Library MakerSpace is a flexible experimentation and innovation space that provides access to the latest tools used in research, instruction and "
Maker Services,https://pioneerlibrarysystem.org/services/maker-services,"Our Mobile Maker Lab is a full-service STEAM experience on wheels that makes the rounds to libraries, community events, and spaces across central Oklahoma"
The Makerspace (Belle Isle),https://www.metrolibrary.org/reserve-room/makerspace-belle-isle,Library Branch
Fab Lab Tulsa: Home,https://fablabtulsa.org/,Join Now Become a member in our Makerspace
Prototek OKC - Oklahoma City Makerspace Community,https://www.facebook.com/prototekokc/,Prototek OKC is a new makerspace community located in Oklahoma City
"Making, learning, sharing - Makerspaces in the metro",https://www.metrofamilymagazine.com/makerspaces-in-the-metro/,"A makerspace is a collaborative, modern workshop"
Living Oklahoma visits the Maker Space at Central Library,https://www.youtube.com/watch?v=NtztZOwpO0s,
Makerspace,https://www.oklahomahof.com/museum/exhibit/makerspace,"Makerspace features a variety of STEAM-based learning activities, custom murals created by local artist Kris Kanly, and an Oklahoma-themed scavenger hunt"
MLS Studios (Makerspace),https://www.metrolibrary.org/discover/technology/mls-studios,"Nov 30, 2019 — MLS (Making, Learning, Sharing) Studios support educational, professional and personal growth through access to materials, programs, "
Renee Neuwald Trust Maker Space,https://www.tulsalibrary.org/programs-and-services/renee-neuwald-trust-maker-space,"Located within the downtown Central Library, the Renee F"
Anyone know if a maker space / tool coop in OKC?,https://www.reddit.com/r/okc/comments/wxikwa/anyone_know_if_a_maker_space_tool_coop_in_okc/,OU's Innovation Hub's fabrication lab is open to the public at no charge
"Top 10 Best Makerspaces in OKLAHOMA CITY, OK",https://www.yelp.com/search?cflt=makerspaces&find_loc=Oklahoma+City%2C+OK,"Best Makerspaces in Oklahoma City, OK - Innovation Studio, JRK Studios, By Bethany Kids, Bethany's Craft Corner"
Maker Space - City Central,https://www.citycentralpc.com/maker-space.html,Welcome to the Maker Space
Home - OSUIT Library Makerspace,https://library.osuit.edu/makerspace,"Aug 14, 2024 — Oklahoma State University Institute of Technology is a recognized leader in applied technology education and is known for world-class teaching "
Prototek OKC MakerSpace - Maker Faire Tulsa,https://tulsa.makerfaire.com/maker/entry/134/,Prototek OKC is a MakerSpace located in Midtown Oklahoma City
Prototek OKC | Oklahoma City Machine Shop and ...,https://prototekokc.wordpress.com/,Prototek is a Makerspace community in Oklahoma city founded in 2013 by James Newman and Matt W
Maker Spaces - Christopher C. Gibbs College of Architecture,https://architecture.ou.edu/maker-spaces/,More Maker Space information can be found below
Prototek - OKC Makerspace - Maker Faire Tulsa,https://tulsa.makerfaire.com/maker/entry/74/,Prototek - an Oklahoma City makerspace community that provides the tools and atmosphere for creativity
About: Innovation Studio - Edmond - Chambers Library - UCO,https://library.uco.edu/about/is,"In 2018, after the removal of the reference collection, the space was transformed into a makerspace "
Take a tour of Tulsa City-County Library's Maker Space!,https://ktul.com/living-oklahoma/segments/take-a-tour-of-tulsa-city-county-librarys-maker-space,"Nov 5, 2024 — Joie stopped by the Maker Space to "
MakerSpace | Freedom Elementary,https://www.lawtonps.org/o/freedom/page/makerspace,Freedom MakerSpace
Department of Education launches Kelble Makerspace,https://utulsa.edu/news/department-of-education-launches-kelble-makerspace/,"Nov 7, 2023 — Yet well-prepared teachers who can make this happen are in critically short supply in Oklahoma and much of the rest of the country"
The School of Engineering Makerspace,https://blogs.uco.edu/cms/2023/10/26/the-school-of-engineering-makerspace/,"Oct 26, 2023 — "
Laser Printing - OSUIT Library Makerspace,https://library.osuit.edu/makerspace/laser-printing,"Aug 14, 2024 — Oklahoma State University Institute of Technology is a recognized leader in applied technology education and is known for world-class teaching "
Pre-Conference: Build It: A Makerspace!,https://www.oklibs.org/event/ola23makerspace,Join two seasoned pros who've created a makerspace from scratch
Prototek OKC - Oklahoma City Makerspace Community,https://www.instagram.com/explore/locations/337835565/prototek-okc---oklahoma-city-makerspace-community/,Prototek OKC - Oklahoma City Makerspace Community
Open Makerspace - Enid Public Library,https://enid.okpls.org/open-makerspace/,"Oct 18, 2017 — This project was made possible in part by the Institute of Museum and Library Services and the Oklahoma Department of Libraries"
'Makerspace' at UCO enhances engineering training ...,https://journalrecord.com/2023/04/13/makerspace-at-uco-enhances-engineering-training-student-opportunities/,"Apr 13, 2023 — A newly renovated “Makerspace” introduced recently by the School of Engineering at the University of Central Oklahoma reflects the state's "
LG-252323-OLS-22,http://www.imls.gov/grants/awarded/lg-252323-ols-22,"The University of Oklahoma will research the current state of programming, design, and accessibility of makerspace programs for youth with disabilities and "
Engineering school marks grand opening of new ...,https://edmondlifeandleisure.com/engineering-school-marks-grand-opening-of-new-makerspace-p23658-86.htm,"Apr 18, 2023 — The University of Central Oklahoma School of Engineering celebrated the official grand opening of its newly renovated makerspace on "
Makerspace Summer Camp,https://www.lawtonps.org/article/771090,"Jun 23, 2022 — Oklahoma Abuse and Neglect Hotline: 1-800-522-3511"
One Makerspace Does Not Fit All,https://www.oklibs.org/page/OLA2017Day03MakerSpa/One-Makerspace-Does-Not-Fit-All.htm,Leanne Cheek is the Teen Selector/Coordinator for the Pioneer Library System
"OKC ""makerspace"" is a dream for crafters",https://okcfox.com/archive/okc-makerspace-is-a-dream-for-crafters,"Nov 17, 2014 — The Oklahoma City makerspace is called Prototek"
Job Number - Library Makerspace (Fall) (241932) - Sign In,https://ou.taleo.net/careersection/stu/jobdetail.ftl?job=241932&tz=GMT-07%3A00&tzname=America%2FLos_Angeles,"Jul 24, 2024 — Required Education: Must be currently enrolled in the Fall Term as a student at the University of Oklahoma"
MakerSpace OKC,https://makerspaceokc.com/,Sign up to be the first to get updates
Prototek OKC - Oklahoma City Makerspace Community,https://www.facebook.com/story.php/?story_fbid=1357665721067089&id=126387010861639,Todd Puckett https://www
Prototek OKC (@PrototekOKC) / X,https://twitter.com/prototekokc?lang=en,"Oklahoma City Machine Shop and Makerspace Community–401 NW 10th St, Oklahoma City http://t"
A Librarian's Guide to Makerspaces: 16 Resources,https://www.oedb.org/ilibrarian/a-librarians-guide-to-makerspaces/,Oklahoma · Oregon · Pennsylvania · Rhode Island · South 
Belle Isle Library: Wood Burning Makerspace Kit,https://famplified.com/a/ok/okc/belle-isle-library-wood-burning-makerspace-kit/,The best kid-friendly fun in Oklahoma City every week
Discover » Technology / Makerspaces,https://www.kickstarter.com/discover/categories/technology/makerspaces?ref=category,"Oklahoma, US, Pryor, OK, Oklahoma City, OK, Tulsa, OK, Norman, OK, Edmond, OK, Stillwater, OK, Claremore, OK"
Tom W.'s Post,https://www.linkedin.com/posts/tomwavering_innovation-entrepreneurship-oklahoma-activity-7206068565865562113-1Hx3,#Innovation #Entrepreneurship #Oklahoma #Makerspace #Startups #ProductDevelopment
Learning Network,https://www.makerusa.org/learning-network,"MAXT Makerspace (Peterborough, NH)"
Makerspaces in ECE: A Planning Guide for Administrators ...,https://www.earlychildhoodwebinars.com/webinar/14534/,The cost is $15 paid to University of Oklahoma online when you apply
Home - Oklahoma State University,https://onecommunity.okstate.edu/,
Tulsa City-County Library Maker Space,https://www.youtube.com/watch?v=aVxIZrZl31o,
"School of Engineering, Makerspace Manager-ENGIN",https://careers.insidehighered.com/job/3046850/school-of-engineering-makerspace-manager-engin/,"School of Engineering, Makerspace Manager-ENGIN job in Main Campus - Edmond, OK, 73034 with University of Central Oklahoma"
Special Programs | Mustang Public Library,https://www.cityofmustang.org/o/library/page/special-programs,
1 Makerspace Coordinator Jobs in Oklahoma,https://www.ziprecruiter.com/Jobs/Makerspace-Coordinator/--in-Oklahoma,Browse 1 OKLAHOMA MAKERSPACE COORDINATOR jobs from companies (hiring now) with openings
"School of Engineering, Makerspace Manager-ENGIN",https://jobs.chronicle.com/job/37575660/school-of-engineering-makerspace-manager-engin/,"Dec 13, 2023 — School of Engineering, Makerspace Manager-ENGIN job in Edmond, Oklahoma, United States with University of Central Oklahoma"
Other Makerspaces,http://wiki.makersmiths.org/display/MAK/Other+Makerspaces?src=contextnavpagetreemode,Synhak Inc
Elevate: Maker space at Clinton High School,https://www.youtube.com/watch?v=xdq7vY3s0zE,
Making,https://www.imls.gov/our-work/priority-areas/making,
Prototek OKC,https://makerspacedir.com/listing/prototek-okc/,"401 NW 10th St, Oklahoma City, OK 73103"
Making For All – Making is for Everyone: Learning within ...,https://makingforall.oucreate.com/,
View Event :: MakerSpace! Kids - Fort Sill MWR,https://sill.armymwr.com/calendar/event/60353,"Jan 2, 2024 — MakerSpace"
Makerspaces,https://makerspace.com/,"Welcome to Make:'s Makerspace Directory, a comprehensive guide to the growing community of makerspaces around the globe"
Visiting Hackers from OHM Space,https://dallasmakerspace.org/2011/02/visiting-hackers-from-ohm-space/,"A contingent of hackers from OHM Space, a new hacker collective in Oklahoma City, recently visited Dallas Makerspace"
Guernsey Leads Renovation Converting Warehouse to…,https://guernsey.us/news/guernsey-leads-renovation-converting-warehouse-to-makerspace-at-uco-overcoming-sound-challenge,"Guernsey is the lead design firm, MEP, and Civil Designer of Record for the new Makerspace at the University of Central Oklahoma's Edmond, OK, campus"
"Create Space | Lawton, OK",https://www.lawtonok.gov/departments/library/services/create-space,"It is a maker's space, a business resource center, and an educational space"
FAQ : Membership : What We Do,https://fablabtulsa.org/what-we-do/members/resources.html,Quick turn-arounds for one-off parts or revisions can happen at a Makerspace 
Training | Oklahoma State University,https://ceat.okstate.edu/labs/endeavor/training.html,The Subtractive Maker Space Training is hands-on in lab training
FTCC Makerspace Lab opens in library,https://www.faytechcc.edu/blog/ftcc-makerspace-lab-opens-in-library/,"Apr 4, 2022 — FTCC Makerspace Lab opens in library"
"Maker Space Jobs, Employment in Norman, OK","https://www.indeed.com/q-maker-space-l-norman,-ok-jobs.html",Embassy Suites by Hilton OKC Will Rogers World
Makerspaces,https://www.finewoodworking.com/2024/03/25/maker-spaces?srsltid=AfmBOoqJ0yANeCRqQw7wHEtjB9WfqMdaJVx7cid4i6GRc5lA8s3_QOPC,"Mar 25, 2024 — Athens Maker Space 751 W"
State Rep. Daniel Pae | Honored to participate in the ...,https://www.instagram.com/repdanielpae/p/DB2E70MhB_Z/,
The Big Book of Makerspace Projects,https://www.demco.com/the-big-book-of-makerspace-projects,
EE Makerspace,https://exploreecology.org/ee-makerspace/,We're proud to introduce you to the new EE Makerspace
Facilities,https://www.youtube.com/playlist?list=PLA5mlQrAoNh5_B7sB1DZZT747_44Ic0Kj,Get creative at MakerSpace
New $6.6 Million Almonte Library Opens in Oklahoma City,https://www.velocityokc.com/blog/inside-okc/new-6.6-million-almonte-library-opens-in-oklahoma-city/,"May 16, 2024 — The library features a maker's space with 3D printers, a podcast studio, a drive-up book drop and shaded outdoor spaces for story time and "
Our Library has 3D Printers (and more!),https://www.robohara.com/?p=14120,"Feb 23, 2023 — "
Innovation Hub - Sooner Magazine - OU Foundation,http://soonermag.oufoundation.org/stories/innovation-hub,Creators describe the center as a “maker space 
Nye Library - Fort Sill MWR,https://sill.armymwr.com/programs/nye-library,MakerSpace
Eliot’s Makerspace is super thrilled to welcome an Augmented ...,https://www.facebook.com/eliotelementaryfoundation/videos/eliots-makerspace-is-super-thrilled-to-welcome-an-augmented-reality-sandbox-it-i/2752105584841920/,
Standley Systems donates state-of-the-art 3D printer ...,https://usao.edu/news/standley-systems-donates-state-art-3d-printer-nash-library-makerspace.html,"Jan 9, 2019 — "
New Owatonna makerspace welcoming artists ...,https://www.southernminn.com/owatonna_peoples_press/news/new-owatonna-makerspace-welcoming-artists-entrepreneurs-to-collaborate/article_9c68e1fa-a36b-11ef-8508-032b5ba7bde0.html,"Oklahoma, Oregon, Pennsylvania, Rhode Island, South Carolina, South Dakota, Tennessee, Texas, Utah, Vermont, Virginia, Washington, Washington D"
About Brooke,https://teachoutsidethebox.com/about/,"My name is Brooke Brown, and I'm so happy you stopped by"
The Project: Random Collage Moments Made from ...,https://issuu.com/metrolibrary/docs/scrap_zine_digital_,"Apr 18, 2024 — A zine made at the Library Adventure Day zine makerspace on April 13, 2024"
Tech Fab Lab,https://www.occc.edu/bit/techfablab/,Tech Fab is a collaborative learning space that facilitates learning through the use of manufacturing and fabrication technologies using computer-aided design/ 
Prototek,https://www.edmondoutlook.com/prototek/,"The concept of a “makerspace,” isn't a new one"
Memberships,https://www.sciencemuseumok.org/membership,8 guest passes
Contribute – Co-Laboratory Oklahoma,http://colab-ok.com/contribute/,Any cash contributions WILL absolutely go toward providing the best makerspace OKC has to offer
Choctaw Nation of Oklahoma Emerging Aviation Technology ...,https://projects.constructconnect.com/details/6090499-choctaw-nation-of-oklahoma-emerging-aviation-technology-center-eatc-makerspace-hangar-infrastructure-improvements&find_loc=OK-74701,Description of the Construction: Makerspace Hangar (Yellow Area) - This building is partially funded with United States Department Agriculture (USDA) and 
MakerSpace - Ponca City,https://yourponcacity.com/events/makerspace/2313/,Oklahoma History · Ponca City Info
Red Dirt Hackers - CyberSecurity Research and Vir ...,https://www.meetup.com/reddirthackers/,Prototek is a Makerspace community in Oklahoma city founded in 2013 by James Newman and Matt W
Scaling Maker Spaces Across the Web,https://www.cni.org/topics/spaces/scaling-maker-spaces-across-the-web-weaving-maker-space-communities-together-to-support-distributed-networked-collaboration-in-knowledge-creation,"Mar 17, 2016 — "
McMahon Foundation grant supports FISTA STEM lab and ...,https://www.kswo.com/2022/07/20/mcmahon-foundation-grant-supports-fista-stem-lab-engineering-maker-space/,"Jul 19, 2022 — McMahon Foundation "
"Asmbly Makerspace - 9701 Dessau Rd, Austin, Texas 78754",https://www.yelp.com/biz/asmbly-makerspace-no-title,"ASMBLY MAKERSPACE, 9701 Dessau Rd, Ste 304 "
Shopping Cart,https://accounts.dallasmakerspace.org/accounts/cart.php?a=view,"Oklahoma, Oregon, Pennsylvania, Rhode Island, South Carolina, South Dakota, Tennessee, Texas, Utah, Vermont, Virginia, Washington, West Virginia, Wisconsin "
Construction Science Students Build Greenhouse for OKC ...,https://gibbs.oucreate.com/construction-science/construction-science-students-build-greenhouse-for-okc-stem-program/,"Sep 28, 2022 — "
"Library Life, Episode 1 | teacher, school, middle school ...",https://www.facebook.com/BrownBrothersBooks/videos/library-life-episode-1/2206934456034581/,
Schedule a Maker Appointment,https://pioneerlibrarysystem.org/services/schedule-a-maker-appointment,"Busy schedule? Book time with Maker Lab equipment today to ""make"" at a time that works for you"
School district to complete district-wide makerspace initiative ...,https://www.youtube.com/watch?v=xbyx9fG1-2E,
Oklahoma - HackerspaceWiki,https://wiki.hackerspaces.org/Oklahoma,"Nov 14, 2009 — Oklahoma is a state, district, or province that is located in USA"
Did you know that our Bethany and Belle Isle libraries have ...,https://www.facebook.com/metrolibrary/videos/did-you-know-that-our-bethany-and-belle-isle-libraries-have-makerspaces-our-mls-/515855613547321/,
USDA Invests $1.4 Million in Rural Business ...,https://www.rd.usda.gov/newsroom/news-release/usda-invests-14-million-rural-business-development-grants-rural-oklahoma,"Sep 23, 2021 — Choctaw Nation of Oklahoma will use $499,999 to construct and develop a “multi-purpose makerspace type building” which is for the emerging "
"STEM centers, maker space coming to Oklahoma City ...",https://www.oklahoman.com/story/news/columns/2019/08/06/stem-centers-maker-space-coming-to-oklahoma-city-schools/60442226007/,"Aug 6, 2019 — Oklahoma nonprofit Engage Learning will run the maker space as a center for applied STEM learning, Executive Director Bart Keeton said"
New Facility at Oklahoma State Advances Engineering ...,https://campustechnology.com/articles/2018/10/02/new-facility-at-oklahoma-state-advances-engineering-learning.aspx?s=ct_in_051018,"Oct 2, 2018 — "
