"NextFab: Makerspace Philadelphia, PA | Community Workshop",https://nextfab.com/,"NextFab is a network of membership-based makerspaces that provide access to tools, technology, education, events, and services for professional makers"
"make717, Inc. - Home",https://make717.org/,"The make717 Innovation Center is Lancaster, PA's first makerspace"
The Dr. Welch Workshop: A Makerspace at Penn College,https://www.pct.edu/academics/makerspace,"A makerspace is a workshop where you can collaborate with classmates or work independently to test theories, explore ideas, and gain real-world skills to "
HackPGH – Pittsburgh's Original Makerspace,https://www.hackpgh.org/,"HackPGH is a 100% volunteer-run community makerspace and registered 501(c)(3) charitable organization based in Pittsburgh, Pennsylvania"
Protohaven – Pittsburgh's Premier Makerspace,https://www.protohaven.org/,Pittsburgh's Premier Makerspace
Abington MakerSpace,https://www.abington.psu.edu/makerspace,Abington MakerSpace is a campus community focused maker and collaborative workspace located on the Penn State Abington campus located in the Rydal Building
"Makerspaces in Philadelphia, Pennsylvania, PA",https://makerspacedir.com/location/philadelphia-pa/,"Makerspace, Hackerspaces, Fablabs, Coworking spaces, and other creatives in Philadelphia, PA"
Welcome To Our Makerspace,https://www.cranberrytownship.org/2742/Makerspace,"Similar to makerspaces in our schools, our space features a laser engraver, 3-D printers, computer-controlled cutting machines, an embroidery sewing machine, "
Makerspace - Chester County Library,https://chescolibraries.org/using-the-library/makerspace/,Our MakerSpace staff and volunteers can help you learn to use our cutting plotters
The Milton MakerSpace Academy | TIME,https://www.visitmiltonpa.org/makerspace,"The MakerSpace is a place where people of all ages and backgrounds can gather to work on projects while sharing ideas, equipment, and knowledge"
Makerspace,https://www.muhlenberg.edu/academics/ine/makerspace/,Makerspace
Makerspace - OriginLabs - Penn State,https://originlabs.psu.edu/makerspace/,"Are you a Penn State, University Park student? With the support of the Student Initiated Fees and the University Park Fee Board, the Makerspace Membership is "
Makerspaces,https://www.bucknell.edu/academics/beyond-classroom/makerspaces,"We supply the tools and expertise to empower novice and experienced makers in three dedicated, on-campus makerspaces: the 7th Street Studio & MakerSpace, "
Makerspace District Logo MAKER Workshops,https://westmoreland.edu/makerspace/,The Makerspace District is located at the Westmoreland County Community College Advanced Technology Center and hosts entrepreneurs that are focused on 
"STEAM | Pittsburgh, PA | Matt's Maker Space",https://www.mattsmakerspace.org/,"Matt's Maker Spaces is committed to helping kids explore science, technology, engineering, arts & math (STEAM) through experiential and hands-on learning in "
People and Places at Penn: Makerspaces,https://penntoday.upenn.edu/news/people-and-places-penn-makerspaces,"Apr 24, 2023 — Education Commons, the Precision Machining Laboratory, and Tangen Hall all offer space for students to get their hands dirty"
Albert M. Greenfield Makerspace,https://www.pleasetouchmuseum.org/learn/exhibits/all/albert-m-greenfield-makerspace/,The Albert M
Makerspaces,https://www.lccc.edu/student-experience/makerspaces/,"A makerspace is an interactive, open space that fosters innovation "
Makerspace in South Central PA area? Looking for ...,https://www.reddit.com/r/Pennsylvania/comments/17p40sg/makerspace_in_south_central_pa_area_looking_for/,"We're about to open one in Marysville, we're signing the paperwork next week"
Albright Memorial Library Makerspace,https://lclshome.org/splmakerspace/,Makerspace
"Makerspaces In Pittsburgh, Pennsylvania, PA",https://makerspacedir.com/location/pittsburgh-pa/,"Makerspace, Hackerspaces, Fablabs, Coworking spaces, and other creatives in Pittsburgh, PA"
North Philadelphia Makerspace Location,https://nextfab.com/location/north-philadelphia/,"Our NextFab North Philadelphia makerspace, located at 1800 N"
Mr. and Mrs. Milton K. Morgan III Makerspace,https://www.ship.edu/academics/business/dillercenter/makerspace/,Milton K
MatSci Makers - MSE Lab - University of Pennsylvania,https://mselab.seas.upenn.edu/makerspace,A student-led initiative created to promote a hands-on materials science education
Utility Works MakerSpace,https://visitdelcopa.com/things-to-do/arts-theatre/utility-works-makerspace/,Unleash creativity at Utility Works Makerspace
Dr. Welch Workshop: About the Makerspace at Penn College,https://pct.libguides.com/Makerspace,"Oct 31, 2024 — In Fall 2018, the Dr"
5 Kid- and Teen-Friendly Makerspaces in Philadelphia,https://blog.friendscentral.org/makerspaces-in-philadelphia,"Sep 23, 2019 — Below we list some great kid-friendly makerspaces in the Philadelphia area that you can consider for your child"
Center for Manufacturing and Technology,https://www.gannon.edu/academic-offerings/engineering-and-business/institute-for-health-and-cyber-knowledge/center-for-manufacturing-and-technology/,"This premier workspace for manufacturing innovation and hands-on learning encompasses Gannon's new, versatile MakerSpace"
Curriculum Materials Center: Makerspace - McNairy Library,https://library.millersville.edu/CMC/makerspace,"Oct 1, 2024 — Millersville University is an Affirmative Action/ Equal Opportunity Institution"
Creative Makerspaces: Bringing Together Community in ...,https://pawilds.com/creative-makerspaces-community/,"Mar 26, 2018 — The Pajama Factory, one of the largest creative makerspaces in the PA Wilds, is an 8-building complex in Williamsport dubbed"
Pennsylvania Colleges Build Makerspaces for Tech ...,https://www.govtech.com/education/higher-ed/pennsylvania-colleges-build-makerspaces-for-tech-innovation,"Jul 18, 2023 — Makerspaces at the Community College of Allegheny County, Westmoreland County Community College, Penn State New Kensington and Indiana "
Making space for innovation | Pennsylvania ...,https://www.pct.edu/impact-report/making-space-for-innovation,The Dr
State Library of Pennsylvania Makerspace STEMlab Adult ...,https://pa-gov.libguides.com/c.php?g=1292694,"Jun 17, 2024 — This free, virtual series on various Science topics is appropriate for an adult audience and will be held once a month during 2023 from 12 Noon to 1 pm"
Regional Innovation Accelerators,https://arminstitute.org/makerspaces/,
ARM Institute Announces Funding for Four Makerspaces,https://arminstitute.org/news/funding-makerspaces/,"May 5, 2023 — The Makerspaces are led by the Community College of Allegheny County (CCAC), Indiana University of Pennsylvania (IUP), Penn State New Kensington "
Milton Makerspace: Arts & Design | TIME,https://www.visitmiltonpa.org/product-page/milton-makerspace-arts-design,Milton Makerspace: Arts & Design
Maker Monday: Southern Tioga Makerspaces - PA DCED,https://dced.pa.gov/paproudblog/maker-monday-southern-tioga-county-makerspaces/,"Aug 20, 2018 — Blossburg Elementary School and Liberty Elementary School, both part of the Southern Tioga School District, transformed portions of their respective libraries "
"THE BEST 10 Makerspaces in PHILADELPHIA, PA",https://www.yelp.com/search?cflt=makerspaces&find_loc=Philadelphia%2C+PA,NextFab is a great community workspace
"Makerspace Jobs, Employment in Pennsylvania",https://www.indeed.com/q-makerspace-l-pennsylvania-jobs.html,8 Makerspace jobs available in Pennsylvania on Indeed
Partnership with make717 makerspace opening new ...,https://pcad.edu/pcad_news/partnership-with-make717-makerspace-opening-new-equipment-technology-and-techniques-for-pcad-ingenuity/,"Oct 17, 2019 — PCA&D is a 4-year, private art college in Lancaster, PA that offers BFA degree programs in digital media, fine art, graphic design, "
Make Lehigh Valley :: Let's Make Things,http://makelehighvalley.com/blog/,Make Lehigh Valley is a nonprofit community makerspace in Allentown PA
Foundry Makerspace,https://www.foundrymakerspace.com/,"In the fall of 2014, the first Maker Fellow was invited to Camp Curtin Academy in Harrisburg, PA"
IUP Part of Tri-County Entrepreneurial Makerspace Project,https://www.iup.edu/news-events/news/2023/05/iup-part-of-tri-county-entrepreneurial-makerspace-project.html,"May 5, 2023 — Headquartered in Pittsburgh, PA, the ARM Institute is the nation's leading robotics and AI Manufacturing Innovation Institute"
NextFab | South Philadelphia Makerspace Membership,https://nextfab.com/makerspace-south-philadelphia-membership/,Ultimate · $200 Credits for $100 for Classes & Equipment · Access to Classes · Access to all Locations & Departments · Access to Freelancing Opportunities · One 
Hive76,https://www.hive76.org/,We're a Philly makerspace dedicated to teaching creative skills and fostering innovation
Central PA Tool Library & Makerspace,http://cca.lvchamber.org/central-pa-tool-library-makerspace___5550945_memberprofile2.aspx?dbid2=palv,Member Directory · patoollibrary
"TOP 10 BEST Makerspaces near Yardley, PA 19067",https://m.yelp.com/search?find_desc=makerspaces&find_loc=Yardley%2C+PA+19067,"Top 10 Best Makerspaces in Yardley, PA - November 2024 - Yelp - NextFab, REC Philly, Craftsman Ave, Happy DIY, Hack Manhattan, Philly Makerhouse, "
Makerspaces - Swartz Center for Entrepreneurship,https://www.cmu.edu/swartz-center-for-entrepreneurship/education-and-resources/makerspaces/index.html,
Milton MakerSpace,https://www.facebook.com/MiltonMakerSpace/,Milton PA Beer Fest is stoked to have KINSEY & Runaway Stroller as our featured LIVE music performances this year
MakerSpace,https://www.swarthmore.edu/makerspace,ITS Blog
Makerspace,https://ptlibrary.org/resources/makerspace/,
Makerspace,https://oakmontlibrary.org/departments/visit-our-makerspace/,Makerspace
MakerSpace & Creativity - Lancaster Mennonite,https://www.lancastermennonite.org/fine-arts/visual-arts/makerspace/,MakerSpace at Lancaster Mennonite provides students a place to walk through 
"Pa Makerspace, 400 Franklin Ave, Phoenixville, PA 19460, ...",https://www.mapquest.com/us/pennsylvania/pa-makerspace-465901684,"Get more information for Pa Makerspace in Phoenixville, PA"
Maker Space,https://lancastersciencefactory.org/makerspace/,
Makerspace,https://www.brynmawr.edu/inside/offices-services/library-information-technology-services/about/spaces/makerspace,"Jul 16, 2024 — Contact Us"
Utility Works MakerSpace,https://visitdelcopa.com/accommodations/classroom/utility-works-makerspace/,"Unleash your creativity at Utility Works Makerspace in Delaware County, PA"
Made in Johnstown Makerspace,https://www.madeinjohnstown.org/,Johnstown's 24/7 Access Makerspace
Makerspace,https://pottstownregionalpubliclibrary.org/makerspace/,MakerSpace
7th Street Studio & MakerSpace,https://getinvolved.bucknell.edu/organization/7thstreetstudiomakerspace,7th Street Studio & MakerSpace
Berks LaunchBox,https://goggleworks.org/whileyouarehere/berks-launchbox/,
MakerSpace | Utility Works | Generating Creativity,https://utility.works/makerspace/,The mission of our MakerSpace is to strengthen the Delaware County area's entrepreneurial ecosystem by inspiring a growth mindset and assisting early-stage 
Maker Arts Space | VCAM,https://www.haverford.edu/vcam/maker-arts-space,Austin Huber '19 and Nicky Rhodes '19 are taking advantage of the burgeoning makerspace 
Central PA Tool Library & Makerspace,https://cca.lvchamber.org/central-pa-tool-library-makerspace-_c_1_83_5550945_memberprofile2.aspx,Member Directory
Welcome & Hours - STEAMworks - Rohrbach Library,https://library.kutztown.edu/steamworks,"Sep 25, 2024 — Welcome to STEAMworks, the Rohrbach Library's makerspace"
Maker Space | Visit Johnstown,https://www.visitjohnstownpa.com/play/arts/maker-space,Maker Space
The Improved Milton Experience creates new Makerspace ...,https://www.northcentralpa.com/education/the-improved-milton-experience-creates-new-makerspace-to-teach-steam-skills/article_18d6cc56-fd63-11ea-8b29-8fade4f993d4.html,"Sep 27, 2020 — Milton, Pa"
"make717, Inc. - About Us",https://make717.org/About-Us,make717 is what is commonly referred to as a makerspace or a hackerspace
MakerSpace: Home,https://makerspace.gannon.edu/,Makerspace Header
Central Pa Tool Libr: Home,https://www.patoollibrary.com/,The Central PA Tool Library and Makerspace is a non-profit tool lending organization dedicated to providing affordable access to tools
Makerspace,https://library.temple.edu/spaces/makerspace,Makerspace
"Discover Makerspace Events & Activities in Lansdowne, PA",https://www.eventbrite.com/d/pa--lansdowne/makerspace/,"Makerspace events in Lansdowne, PA"
Matt's Maker Space Labs at Point Park,https://www.pointpark.edu/academics/schools/education/matts-maker-space-lab,"Point Park's maker space classrooms are vibrant workshops designed to facilitate hands-on, collaborative learning experiences"
Makerspace,https://www.tredyffrinlibraries.org/using-the-libraries/explore/makerspace/,Tredyffrin Public Library
Makerspace | Spaces,https://www.dickinson.edu/info/20392/academic_technology/2215/spaces/12,Makerspace
Makerspace,https://www.bucks.edu/coned/makerspace/,Makerspace is open to those who are properly trained or have taken a class
"Makerspace Studio Assistant, Part-time",https://service-pctedu.icims.com/jobs/1819/makerspace-studio-assistant%2C-part-time/job,"Williamsport is now hiring a Makerspace Studio Assistant, Part-time in Williamsport, Pennsylvania"
Make Lehigh Valley (makerspace),https://www.meetup.com/makelehighvalley/,We still want you to visit
PA Makerspace Black Logo Women's Scoop Neck,https://pamakerspace.threadless.com/designs/pa-makerspace-black-logo/womens/scoop-neck,Buy PA Makerspace Black Logo from PA Makerspace's Artist Shop available now on a Women's Scoop Neck
Utility Works | Generating Creativity | Affordable workspace ...,https://utility.works/,"If you are an artist and are looking for affordable studio space, we'd love to meet you"
Keystone Kidspace,https://www.keystonekidspace.org/,"York, PA 17401"
Hometown Makerspace’s 3D printers busy making ...,https://www.facebook.com/mplibrary15666/videos/hometown-makerspaces-3d-printers-busy-making-acceccories-for-the-decoration/2537583756479882/,
STEM Maker Pass,https://lancasterlibraries.org/stem-maker-pass/,"Take a tour and learn about make717 Innovation Center, a dedicated makerspace"
Art Class Kids Makerspace,https://www.nemacolin.com/experiences/kids-makerspace/,Kids Makerspace
Idea Lab,https://erielibrary.org/resources/idealab/,The Idea Lab is an adult maker space that offers free access to equipment and classes 
Makerspace Special Education Initiative,https://www.thewatsoninstitute.org/makerspace-special-education-initiative/,"Sep 12, 2023 — Skip to content"
Penn College | Nursing students stop by the Makerspace to ...,https://www.instagram.com/penncollege/p/CxyIjrzrrRW/,"158 likes, 0 comments - penncollege on September 29, 2023: ""Nursing students stop by the Makerspace to create custom shirts for their global "
"Matt's Maker Space @ MLPL | Mt Lebanon Public Library, PA",https://mtlebanonlibrary.org/487/Matts-Maker-Space-MLPL,"These programs explored the components of STEAM (Science, Technology, Engineering, Art, & Math) for children in grades K-8"
Makerspace for a Relocated STEM Library,https://palrap.org/ojs/palrap/article/view/295,by P McMonigle · 2024 — Authors
State Library of PA STEMlab,https://www.urbanlibraries.org/resources/makerspaces-in-libraries/state-library-of-pa-stemlab,"To learn more, visit the State Library of PA Makerspace web page"
Cranberry Township Facilities • Makerspace,https://www.cranberrytownship.org/Facilities/Facility/Details/Makerspace-75?mobile=ON,Makerspace
Pennsylvania College of Technology's Post,https://www.linkedin.com/posts/pennsylvania-college-of-technology_makerspace-partners-with-innovative-learning-activity-7203455659026071552--fCO,The Dr
Makerspace Mondays,https://ccmellorlibrary.org/childrens-programs/makerspace-mondays/,Makerspace Mondays
Export Makerspace,https://www.facebook.com/ExportMakers/,"Export Makerspace, Delmont, PA"
4 Pa. Colleges Get Makerspaces to Serve Manufacturers,https://www.govtech.com/education/higher-ed/4-pa-colleges-get-makerspaces-to-serve-manufacturers,"May 10, 2023 — Penn State, Westmoreland Community College, Indiana University of Pennsylvania and Community College of Allegheny County will receive $1"
"Makerspace Exploration - Sewickley, PA 2025",https://www.activekids.com/sewickley-pa/skills/camp/makerspace-exploration-2025,"technologies in the Makerspace, including 3D printers, the Laser Engraver/Cutter, Hummingbird robots, and Virtual Reality headsets "
Meet PCS West's New Art & Makerspace Teacher!,https://www.providentcharterschool.org/meet-austin-almendarez/,"Aug 1, 2024 — "
What We Do,https://keystonemakers.org/whatwedo.html,Keystone Makers operates a makerspace in Marysville Pennsylvania
