Rhode Island Maker Mill,https://rimakermill.com/,"Rhode Island Maker Mill is a makerspace supporting the arts, engineering, and science in the Rhode Island and southern Massachusetts area"
Makerspace,https://clpvd.org/learn/spotlight/makerspace/,"Our makerspace programs are designed to connect people to technology, training, and engaging arts experiences in support of their creative practice"
"Community Makerspace in Providence, Rhode Island",https://as220.org/community-studios,"The AS220 Community Studios is a community makerspace located in Providence, Rhode Island offering affordable public access to education, tools, and space "
MakerSpace – Library Innovation Labs,https://web.uri.edu/innovate/makerspaceuri/,Minimal Viable Product Creation
"THE BEST 10 Makerspaces in PROVIDENCE, RI",https://www.yelp.com/search?cflt=makerspaces&find_loc=Providence%2C+RI,"Top 10 Best Makerspaces Near Providence, Rhode Island - With Real Reviews · 1"
MakerspaceURI – University Libraries,https://web.uri.edu/library/services/spaces/makerspaceuri/,"MakerspaceURI provides access to fabrication equipment/software, 2d/3d design, virtual reality, and many other tools and technologies that facilitate hands-on "
Makerspace | Westerly Library & Wilcox Park,https://www.westerlylibrary.org/makerspace,"Makerspaces are community spaces where people can explore all aspects of crafts and making, using tools that range from the cutting edge of technology to "
ABOUT US – The Steel Yard,https://www.thesteelyard.org/about/,"The Steel Yard is a non-profit industrial art center and shared studio located in Providence, RI"
Makerspace Open Studio for Adults,https://clpvd.org/series/makerspace-open-studio-for-adults-10/,Makerspace Open Studio for Adults
"Makerspaces in Providence, RI",https://makerspacedir.com/location/providence/,"Makerspaces, Hackerspaces, Fablabs, Coworking spaces, and other creatives in Providence, RI"
PVD Young Makers | Make. Learn. Do. | Rhode Island,https://pvdyoungmakers.com/,"The City of Providence is teaming up with Providence Public Library, the Providence Community Libraries, FabNewport, the Rhode Island Museum of Science and "
Ocean State Maker Mill – Rhode Island's home for Makers.,https://www.oceanstatemakermill.org/,"Ocean State Maker Mill is a membership-run organization with the mission of helping encourage the usage of arts, engineering, and science to help make ideas "
Biodesign Makerspace - Rhode Island School of Design,https://biomaker.risd.edu/,Biodesign Makerspace Merging studio and lab for innovation in the 
Maker Space | clarkmemorial - Clark Memorial Library,https://www.clarklib.org/maker-space,"Clark Memorial Library · Richmond, Rhode Island's Public Library Since 1880 7 Pinehurst Drive Phone: (401)364-6100"
Rhode Island Maker Mill,https://www.facebook.com/RhodeIslandMakerMill/,"Rhode Island Maker Mill, Pawtucket, Rhode Island"
Workshop,https://www.provlib.org/education/workshop/,"During Open Studio hours, the public is welcome to drop in to utilize the MakerSpace and learn how to use the tools and equipment through hands-on "
"THE BEST 10 Makerspaces in NEWPORT, RI",https://m.yelp.com/search?cflt=makerspaces&find_loc=Newport,"Best Makerspaces in Newport, RI - Brown Design Workshop, M"
Anyone visit a makerspace in RI? : r/RhodeIsland,https://www.reddit.com/r/RhodeIsland/comments/1gtlrx6/anyone_visit_a_makerspace_in_ri/,"Kind of a long shot, but has anyone gone to a makerspace in RI? Looking online I see AS220, Brown and one in Pawtucket"
makerspaces? : r/RhodeIsland,https://www.reddit.com/r/RhodeIsland/comments/1cqe89z/makerspaces/,"are there any maker spaces out there for woodworking? i'm aware of Browns creative workshop, and The Wurks, but wasn't sure if there's any "
Rhode Island Maker Mill,https://makerspacedir.com/listing/rhode-island-maker-mill/,Rhode Island Maker Mill
Protected: Makerspace Tools,https://www.provlib.org/education/workshop/makerspace/makerspace-tools/,Click for Makerspace @ The Workshop menu
Maker Space jobs in Rhode Island,https://www.indeed.com/q-maker-space-l-rhode-island-jobs.html,24 Maker Space jobs available in Rhode Island on Indeed
"Providence Maker Faire - September 7, 2024 - Home Page",https://providence.makerfaire.com/,"Maker Faire Providence features hands-on making, hacking, crafting, garage technology, arts and creativity for sale, robots, and more"
Makerspace and Contact - Little Compton Makers Inc Type,https://www.littlecomptonmakers.org/makerspace-and-contact.html,"PO Box 932 Little Compton, Rhode Island 02837 ​"
Makerspace Studio,https://barringtonlibrary.org/makerspace-studio,Makerspace Studio
Makers RI,https://www.makersri.com/,Makers is Pop-Up Art & Enrichment Classes for Rhode Island kids
Maker Lab - Newport Public Library,https://newportlibraryri.org/library-services/maker-lab/,"Maker Labs, also referred to as makerspaces, hackerspaces and hackspaces are "
Book Club in a Bag,https://www.barringtonlibrary.org/book-club-bag-0,Makerspace Studio · Media Conversion · Tech Help Desk · Computer Lab · Free Indoor 
Makerspace Walk in | Macaroni KID Southern Rhode Island,https://washingtonri.macaronikid.com/events/6684aa13c396db65ee3942bd/makerspace-walk-in,"Jul 31, 2024 — From the library: The Makerspace will be open to drop ins on Tuesdays & Wednesdays from 10:00am-2:00pm in July"
Rhode Island Maker Mill (@rimakermill),https://www.instagram.com/rimakermill/,"RIMM is a makerspace community promoting & supporting STEAM for RI and southeast Mass, Pawt, RI meets Wed & Fri 730pm"
Rhode Island - HackerspaceWiki,https://wiki.hackerspaces.org/Rhode_Island,"Aug 4, 2008 — Hackerspaces/Makerspace in Rhode Island are[edit] "
Space Rental — Creative Reuse Center of RI,https://creativereusecenterri.org/events,Birthday parties · Book Readings: Layla's Happiness with Mariahadessa Ekere Tallie and Something Great Maker Space Story time with Local Author Jeanette Bradley 
FabNewport: Home Page,https://fabnewport.org/,First Tee Rhode Island · 4th Annual First Tee Outing · 3rd Annual NE Golf Tour 
Biodesign Makerspace - Rhode Island School of Design,https://biomaker.risd.edu/makerspace/index.html,We envisioned
rhode island,https://makezine.com/tag/rhode-island/,"As part of Design Week RI, five Rhode Island Makerspaces are opening their doors to celebrate the first Statewide Makerspace Open House"
Self-Guided Tour of the Robert L. Carothers Library & ...,https://uri.libguides.com/c.php?g=42382&p=9540627,"Oct 1, 2023 — "
EP Makerspace: Home,http://epmaker.space/,Take a look at what we offer and book a time that works for you
Maker Studio Mobile,https://providencechildrensmuseum.org/divi_overlay/maker-studio-mobile/,Providence Rhode Island 02903
Rhode Island Maker Mill,https://www.facebook.com/RhodeIslandMakerMill/?locale=hi_IN,"Rhode Island Maker Mill, Pawtucket, Rhode Island"
Brown Design Workshop,https://www.browndesignworkshop.org/,The Brown Design Workshop is a student-run makerspace which aims to make the 
Rhode Island Maker Mill,https://twitter.com/rimakermill,Rhode Island Maker Mill is a #makerspace
Makerspace Open Studios,https://pvdeye.org/event/makerspace-open-studios/,Want to use our makerspace equipment to make your next masterpiece? Come in during our open hours
makerspaceURI,https://www.instagram.com/makerspaceuri/,Photo by makerspaceURI in University of Rhode Island Libraries
Library Innovation Labs,https://web.uri.edu/innovate/,MakerSpace
Library Events - LibCal - Barrington Public Library,https://barringtonlibrary.libcal.com/calendar/library-events?&t=d&cal%5B%5D=15535&audience%5B%5D=4693,Knitters of all levels are invited to join us in the Makerspace on 
Ocean State Maker Mill - Providence Maker Faire,https://providence.makerfaire.com/maker/entry/136/,We always cook up something fun and special for Providence Maker Faire and this year is no different
Design-Innovate-Build aka DIB Lab,https://www.wheelerschool.org/experience/in-the-city/design-innovate-build-lab/,N-12 Coed Day School in Providence RI
RISD Biodesign Makerspace - Kusske Design Initiative,https://kdi.umn.edu/resources/risd-biodesign-makerspace,RISD Biodesign Makerspace
Makerspace Open Studio,https://pvdeye.org/event/makerspace-open-studio/,5 days ago — We have makerspace equipment that might be useful
C-Lab,https://www.cranstonlibrary.org/c-lab/,"By submitting this form, you are consenting to receive marketing emails from: Cranston Public Library, 140 Sockanosset Cross Road, Cranston, RI, 02920, US, http "
Providence Community Libraries,https://turnto10.com/studio10/providence-community-libraries,"Oct 25, 2022 — The Providence Community Library is back, and they're here to talk about their “Maker Spaces” for kids and adults"
"Makerspaces in Rhode Island? (Providence, Pawtucket",https://www.city-data.com/forum/rhode-island/2501414-makerspaces-rhode-island-providence-pawtucket-2015-a.html,"Dec 22, 2015 — Does anyone here have any experience with the various makerspaces in Rhode Island? I came across this story that there was some sort of "
Kristen Haines - Youth Makerspace Coach,https://www.linkedin.com/in/kristen-haines-90163683,
Marc Parlange,https://twitter.com/MarcParlange/status/1806090211698368618,launches Maker Space Summer Camps in the Innovation Lab - the entrepreneurial generation growing innovation in Rhode Island
Brian Jepson Author Profile,https://makezine.com/author/jepstone/,"As part of Design Week RI, five Rhode Island Makerspaces are opening their doors to celebrate the first Statewide Makerspace"
Tech Lab,https://www.warwicklibrary.org/tech-lab,"600 Sandy Lane Warwick, RI 02889"
Young Women's STEAM Camp @ MakerspaceURI,https://www.eventbrite.com/e/young-womens-steam-camp-makerspaceuri-registration-863167736937,By University of Rhode Island Conference Services
Library Locator,https://oslri.org/library-locator/,Community Garden
12 Maker Space Jobs in Rhode Island,https://www.ziprecruiter.com/Jobs/Maker-Space/--in-Rhode-Island,12 Maker Space Jobs in Rhode Island · Part Time Merchandiser · Part Time Merchandiser · Part Time Merchandiser · Part Time Merchandiser · Part Time Merchandiser
Maury Loontjens Memorial Library in Narragansett – Discover ...,https://narlib.org/,"The Maury Loontjens Memorial Library offers programs for all ages, meeting rooms, audio books, e-book loans and computer access in Narragansett, RI "
FabNewport,https://www.artsnowri.com/organization/fabnewport/,
Transforming the Smithfield Elementary Schools,https://dbvw.com/news/k-12-schools-design-transforming-the-smithfield-elementary-schools/,New makerspaces and learning labs promote flexible project-based learning and teamwork
Providence Public Library,https://www.designlabarch.com/providence-public-library-empire-st,"Providence, Rhode Island"
RI - Building Skills for the Future at Libraries,https://www.ala.org/sites/default/files/pla/content/initiatives/librarieslead/success/Rhode-Island.pdf,“We see our makerspaces as growing hubs of entrepreneurship and we are working on ways to further develop that concept in our libraries
"maker space jobs in providence, ri","https://www.indeed.com/q-maker-space-l-providence,-ri-jobs.html","26 Maker Space jobs available in Providence, RI on Indeed"
MakerSpace kids program set for Tuesday at ESPL,https://www.valleybreeze.com/townnews/museums/makerspace-kids-program-set-for-tuesday-at-espl/article_91924530-1c68-11ef-b2d9-a3d44c15fe97.html,"May 30, 2024 — Save"
Piloting a BioDesign Maker Space and Curriculum for K-12 ...,https://www.nsf.gov/awardsearch/showAward?AWD_ID=1723559&HistoricalAwards=false,"Jun 29, 2020 — Researchers from the Rhode Island School of Design will create a BioDesign Maker Space, providing an immersive environment for K-12 students "
RI State Rep. David Morales 🌹 | From fun storytimes for our ...,https://www.instagram.com/davidmoralesri/reel/DDIneCRPetw/,
About Us,https://www.the-sew-op.com/pages/about-us?srsltid=AfmBOoqgQZ1LvXMTGuYxjKbfVEAKDBbldU76t3hdkD4DbiT1u8rV2LUp,Welcome to the-sew-op
Business Innovation Program benefits from new maker space,https://news.providence.edu/business-innovation-program-benefits-from-new-maker-space/,"May 29, 2020 — And, this is what Providence College students are doing in a new Design Thinking Lab and Collaboration Space in the Service Building — within "
maker's space - Activities in New England for Young Kids,https://kidfriendlynewengland.com/familyfriendly/makers-space/,Tag: maker's space
Compact Shelving Makes Room for Library Makerspace,https://www.spacesaver.com/case-study/compact-shelving-library-makerspace,"Newport, Rhode Island"
Makerspace Open Studio for Adults - Providence,https://allevents.in/providence/makerspace-open-studio-for-adults/200026900011803,"Aug 6, 2024 — Find tickets & information for Makerspace Open Studio for Adults"
Video: A look inside the Brown Design Workshop,https://www.brown.edu/news/2023-07-13/brown-design-workshop,"Jul 13, 2023 — "
Makerspace Open Studio for Adults,https://www.eventbrite.com/e/makerspace-open-studio-for-adults-tickets-1090258726199?aff=ebdssbpointsofinterest,"Eventbrite - Community Libraries of Providence presents Makerspace Open Studio for Adults - Wednesday, December 11, 2024 at Community Libraries of "
2019 Library Of Rhode Island Grant Awards - OLIS - RI.gov,https://olis.ri.gov/programs-and-support/grants-funding/lsta-sub-grants/2019-library-rhode-island-grant-awards,"Aug 31, 2021 — A mobile makerspace will be equipped with technology and STEM learning tools to set up outdoor makerspaces and/or deliver program kits for use "
Queer Friendly Things to Do & Places to Go,https://queerri.com/queer-friendly-things-to-do-places-to-go/,"The Steel Yard is a non-profit industrial art center and shared studio located in Providence, RI"
DSTechnobrarian - MakerEdRI,https://sites.google.com/view/dstechnobrarian/makeredri,"On this site, you will find information related to Maker Education in Rhode Island and also general maker information"
Woodworker Maker's Space For Rent | Industrial Equipment.,https://47rathbone.com/building-3-studio-3,"45 Rathbone St, Providence RI"
The value of a makerspace: cultural (re-)production and the ...,https://www.tandfonline.com/doi/full/10.1080/17549175.2024.2319028,"by J Debowski · 2024 · Cited by 1 — The study canvassed makerspaces within the New England states of Connecticut, Maine, Massachusetts, New Hampshire, Rhode Island and Vermont, together with New "
Makerspace Archives,https://edscoop.com/tag/makerspace/,Makerspace 
Rhode Island - Our Library Site - Weebly,http://mrseastmanlibrary.weebly.com/rhode-island.html,All About Rhode Island
"Computer Help, Access and Wifi",https://www.westerlylibrary.org/computer-help-access-and-wifi,
Ocean State Maker Mill - Discover Makerspaces,https://www.discovermakerspaces.com/rhode-island/pawtucket/makerspace/ocean-state-maker-mill,"Connect with Ocean State Maker Mill, Makerspace in Pawtucket, Rhode Island"
The Best Coworking Spaces In Rhode Island - DropDesk,https://drop-desk.com/best-coworking-spaces/rhode-island,The Wurks is a collaborative artist's makerspace located in Providence's historic mill district
Makerspace Open Studio for Adults - Providence,https://allevents.in/providence/makerspace-open-studio-for-adults/200026735465253,"Jul 2, 2024 — Find tickets & information for Makerspace Open Studio for Adults"
About FabNewport,https://fabnewport.org/about-fabx/,But let's hear what Professor Virginia Killian Lund at the University of Rhode Island 
Maker Space Gallery - NAIS Annual Conference 2015,https://naisac15.wordpress.com/interactive-maker-space/maker-space-gallery/,"Jewish Community Day School of Rhode Island: Providence, RI"
Westerly - Studio Rhode,https://olis-ri.libguides.com/studiorhodetoolkit/westerly,"Aug 2, 2019 — Rhode Island Office of Library and Information Services · LibGuides "
STEM Labs vs. STEAM Labs vs. MakerSpaces vs Design ...,https://jcdsri.com/specialty/design/stem-labs-vs-steam-labs-vs-makerspaces-vs-design-labs-whats-the-difference/,"Mar 12, 2015 — This initiative was led by our partners and neighbors at the Rhode Island School of Design (RISD)"
The Rhode Island Tempestry Project: Contribute to ... - LibCal,https://barringtonlibrary.libcal.com/event/12727268?hs=a,"Knitters of all levels are invited to join us in the Makerspace on Tuesday, October 1 from 5-6 pm and help us create two knitted panels documenting the "
Winter wonderland in #MakerspaceURI today! ❄️ #cnc ...,https://www.facebook.com/makerspaceURI/videos/winter-wonderland-in-makerspaceuri-today-%EF%B8%8F-cnc-makerspace-uri-rhody-universityof/2119401648193458/,
Sketchbooks. Makerspaces. Student Startups. Inside ...,https://www.the74million.org/article/sketchbooks-makerspaces-student-startups-inside-americas-largest-personalized-learning-experiment-how-one-rhode-island-lighthouse-laboratory-is-reimagining-school/,"May 1, 2018 — Inside America's Largest Personalized Learning Experiment, How One Rhode Island 'Lighthouse Laboratory' Is Reimagining School"
Resilient Creativity: Rhode Island Museum of Science and Art,https://ncse.ngo/resilient-creativity-rhode-island-museum-science-and-art,"May 18, 2020 — A makerspace activity,"
RISD Nature Lab BioDesign MakerSpace - Kylie King,http://www.kylieking.net/risd-nature-lab-biodesign-makerspace,"Kylie King – Department of Interior Architecture, Adaptive Reuse '18"
The MADE Experience | Design Engineering,https://design.engineering.brown.edu/made-experience,"The Brown Design Workshop is a 10,000 square-foot, student-run maker space available to the Brown and RISD community"
Rhode Island School of Design Co-Works — Site Specific,https://www.pinterest.com/pin/rhode-island-school-of-design-coworks-site-specific--34128909666557255/,Murray Hall Makerspace & Lab Up-Fit
Providence Public Library | Do you like puzzles? PPL staff ...,https://www.instagram.com/providencepubliclibrary/reel/C4LGs_vLcmc/,
East Smithfield Public Library opens its new maker space,https://www.valleybreeze.com/news/east-smithfield-public-library-opens-its-new-maker-space/article_76a58064-06eb-11ed-b664-1f5fc401bf38.html,"Jul 21, 2022 — Children make buttons and bookmarks during the grand opening at the East Smithfield Public Library Makerspace on Monday"
