Tennessee Makerspaces Archive,https://tnartscommission.org/tennessee-makerspaces/,"Tennessee Makerspaces: Artistic Discipline, Auto Repair, Bicycle Repair, Blacksmithing, CAD / CAM, Co-Working / Meeting Space, Community Kitchen, Computer "
The MakerSpace : Welcome! - Walker Library - MTSU,https://library.mtsu.edu/technology/makerspace,"Aug 22, 2024 — The MakerSpace, located on the 2nd floor of the James E"
Make Nashville,https://makenashville.org/,Make Nashville is a makerspace
Medbery Makerspace - The Studio,https://www.lib.utk.edu/studio/makerspace/,"The Medbery Makerspace in 209 Hodges Library welcomes all students, faculty and staff in the UTK community to create, draft, dream, and make with us"
The Inventor Center,https://theinventorcenter.com/,Learn
i2 Makerspace,https://www.adventuresci.org/exhibit/innovation-incubator/,"The i2 Makerspace is Adventure Science Center's permanent, high-tech makerspace where visitors can dream up an idea and watch it come to life"
Tennessee Makerspaces - Make Nashville,https://tnartscommission.org/tennessee-makerspaces/make-nashville-2/,We enable Makers to Make
Makerspace 212 - Libraries at East Tennessee State University,https://libraries.etsu.edu/innovation/makerspace,"Sep 19, 2024 — Makerspace 212 is our hub for maker technologies"
The Forge,https://www.theforgenashville.org/,"The Forge is a 501c3 non-profit, community-based makerspce that allows members to come together, and share skills and tools to pursue creative projects"
iMakerSpace,https://www.tntech.edu/engineering/research/imakerspace/index.php,"The iMakerSpace serves as a focal point on campus to provide training, service, partnership, research and evaluation in Innovation and Entrepreneurship (I&E) to "
"Makerspace — Jackson, TN's Regional Innovation Hub - theCO",https://www.attheco.com/makerspace,We've got tools that will make finishing your project effortless
MakerSpace: Home,https://tnstate.libguides.com/makerspace,"Sep 22, 2024 — THE PURPOSE"
Makerspace - Hours,https://www.lib.utk.edu/hours/spaces/makerspace/,Makerspace area in Pendergrass Library
Jackson-Madison County Library - MakerSpace,https://jmclibrary.org/makerspace,"Jackson-Madison County Library in Jackson, Tennessee "
MakerSpace - Website-services,https://tnstate.libguides.com/website/services/makerspace,MakerSpace
Making and Design | The Wond'ry,https://www.vanderbilt.edu/the-wondry/making-and-design/,Makerspace Background
iMakerSpace Services,https://www.tntech.edu/engineering/research/imakerspace/services.php,"Who can use the iMakerSpace equipment? ANY Tennessee Tech student, faculty, or staff member is welcome and encouraged to utilize the iMakerSpace and it's "
home [Chattlab],https://wiki.chattlab.org/,"Feb 17, 2023 — Chatt*Lab Makerspace is a vibrant community hub for makers and innovators in Chattanooga, Tennessee"
Morristown Makers – An East Tennessee Makerspace,http://morristownmakers.com/,"May 13, 2024 — Morristown Makers is located near Panther Creek Road on Andrew Johnson Hwy (11E) in Morristown"
"Makerspaces in Nashville, TN",https://makerspacedir.com/location/nashville/,"Makerspace, Hackerspaces, Fablabs, Coworking spaces, and other creatives in Nashville, TN"
Hatch It! Lab - Chattanooga,https://www.utc.edu/gary-w-rollins-college-of-business/student-resources/center-for-innovation-and-entrepreneurship/hatch-it-lab,"The Hatch It Lab, hosted inside the Center for Innovation and Entrepreneurship, is a makerspace with equipment to help students create and develop their "
Makerspace 212: Laser Engraving - Sherrod Library,https://libraries.etsu.edu/innovation/makerspace/laser,"Sep 19, 2024 — Makerspace 212"
CBI Maker Space,https://www.facebook.com/cbimakers/,"CBI Maker Space, Crossville, Tennessee"
The MakerSpace : Equipment - Walker Library - MTSU,https://library.mtsu.edu/makerspace/equipment,"Aug 22, 2024 — See software in the library"
Creating a Makerspace in Northwest Tennessee,https://everywhere.tennessee.edu/creating-a-makerspace-in-northwest-tennessee/,Creating a Makerspace in Northwest Tennessee
Chattlab Makerspace,https://www.meetup.com/chattlab-makerspace-meetup/,"Chattlab Makerspace · Chattanooga, TN, USA · 1,401 members · Public group"
The Tennessee State University MakerSpace,https://www.facebook.com/groups/tennesseestateuniversitymakerspace/,"The Tennessee State University MakerSpace is excited to open this new space where faculty, staff, and students can come together to imagine, tinker, and"
4th Floor - Chattanooga Public Library,https://chattlibrary.org/4th-floor/,4th Floor Makerspace
"Maker's Space - Nashville, TN",https://www.sewingexpo.com/Events/Nashville-TN/Features-Events/Makers-Space,Maker's Space 
"Top 10 Best Makerspaces in NASHVILLE, TN",https://www.yelp.com/search?cflt=makerspaces&find_loc=Nashville%2C+TN,"Best Makerspaces near me in Nashville, TN - Fort Houston, Make Nashville, Braingineers Lab, Space Maker Portable Buildings, Indoor Outdoor Custom Cedars, "
TL v62n4: David Ratledge,https://www.tnla.org/page/515/TL-v62n4-David-Ratledge.htm,Makerspaces
Makerspaces Providers in Tennessee,https://www.globalspec.com/local/6383/C_US/TN,Makerspaces Providers in Tennessee
Midsouth Makers – Memphis Area Makerspace,https://www.midsouthmakers.org/,"Memphis area makerspace featuring diverse interests of technology, science, art, and crafting"
Makerspaces,https://makerspace.com/,"Welcome to Make:'s Makerspace Directory, a comprehensive guide to the growing community of makerspaces around the globe "
"Nashville Maker Space, 2416 Music Valley Dr ...",https://www.mapquest.com/us/tennessee/nashville-maker-space-463582303,"Get more information for Nashville Maker Space in Nashville, TN"
Tennessee - HackerspaceWiki,https://wiki.hackerspaces.org/Tennessee,"Dec 1, 2008 — Hackerspaces/Makerspace in Tennessee are[edit]"
Library Technology Specialist - MakerSpace,https://jobs.code4lib.org/jobs/62611-library-technology-specialist-makerspace,"Oct 8, 2024 — Library Technology Specialist - MakerSpace"
"Kingsport's Makerspace, The Inventor Center, Continues to ...",https://syncspace.org/kingsports-makerspace-the-inventor-center-continues-to-grow/,
Friday Night Open House at the Makerspace!,https://www.eventbrite.com/e/friday-night-open-house-at-the-makerspace-tickets-165415485169,Eventbrite - Make Nashville presents Friday Night Open House at the Makerspace
The Maker City,https://themakercity.org/,Looking to help Helene damaged areas this season? Check out the work being done through the East Tennessee Foundation
What is a Makerspace?,https://www.tn.gov/content/dam/tn/education/ccte/ISM_Reimagine_Space_Creating_a_Makerspace.pdf,
Knox Makers – community / workshop,https://knoxmakers.org/,"Knoxville, TN 37920 parking is around back in the fenced-in area"
Mechanical Makerspace | The Wond'ry,https://www.vanderbilt.edu/the-wondry/mechanical-makerspace/,Mechanical Makerspace
Maker Space jobs in Tennessee,https://www.indeed.com/q-maker-space-l-tennessee-jobs.html,118 Maker Space jobs available in Tennessee on Indeed
Makerspace - Maryville High School,https://mhs.maryville-schools.org/library/library/makerspace,Makerspace - Maryville High School
"Imagine Foundry | Imagine, Design, Create",https://imaginefoundry.org/,"If so, then our workshops are for you"
Greene County Makers |,https://greenecountymakers.com/,A maker space is a physical location where people can gather to work on 
Maker Exchange,https://www.makerexchangeknox.com/,Knoxville TN 37902
Space Availability - Makerspace Equipment and Trainings,https://mtsu.libcal.com/reserve/makerspace_training,Makerspace Equipment Training
3rd Floor Creative Space (Makerspace),https://www.sevierlibrary.org/3rd-floor-creative-space/,
Make Nashville - GivingMatters,https://givingmatters.civicore.com/index.php?section=organizations.mission&action=main&fwID=779,We execute our mission through the operation of Nashville's first and only volunteer-run all-ages Makerspace 
Plan Your Visit | Knoxville Makerspace,https://knoxvillemakerspace.com/visit.html,Come experience the variety of fun educational activities for all ages
Rose Hill School Library Makerspace / Welcome,https://www.jmcss.org/domain/808,Rose HillSchool · Digital Book Collection--Free Books Online · Library Catalogue · Tennessee READS · Jackson Madison County Library · Jackson State Library
Open Makerspace,https://www.martinpubliclibrary.org/calendar/2024/11/4/open-makerspace-ya8ys-pscga-b52d7-kgjnt,"Nov 4, 2024 — The Makerspace will be open for patrons to utilize "
Franklin Makerspace,https://www.franklinmakerspace.org/,"Simply put, a MakerSpace is a place where you can make things"
Makers' Corner,https://www.visitclarksvilletn.com/listing/makers-corner/1000/,"215 Foster Street, Clarksville, TN 37040"
"Chattlab Makerspace, 100 Cherokee Blvd, Chattanooga ...",https://www.mapquest.com/us/tennessee/chattlab-makerspace-381090440,"Chatt Lab Makerspace is a vibrant community hub for makers and innovators in Chattanooga, Tennessee"
Maker Spaces to Visit in Knoxville,https://www.visitknoxville.com/blog/post/the-maker-city-maker-spaces-to-visit/,"Jun 24, 2021 — Now you're also offering a maker space"
Library Technology Specialist - MakerSpace in ...,https://jobs.educause.edu/jobs/20682718/library-technology-specialist-makerspace,"Exciting opportunity in Murfreesboro, TN for Middle Tennessee State University as a Library Technology Specialist - MakerSpace"
$46k-$85k Makerspace Librarian Jobs in Tennessee,https://www.ziprecruiter.com/Jobs/Makerspace-Librarian/--in-Tennessee,Browse 1 TENNESSEE MAKERSPACE LIBRARIAN jobs from companies (hiring now) with openings
Digital Fabrication @ Vanderbilt,https://www.digitalfabricationlab.com/,"Digital Fabrication students visit Oak Ridge Manufacturing Demonstration Facility in Knoxville, TN"
Makerspace: Biomimicry,https://www.nashville.gov/departments/parks/events/makerspace-biomimicry-1,Makerspace: Biomimicry
What Is a Makerspace? A Guide for Teachers - XQ Institute,https://xqsuperschool.org/teaching-learning/what-is-a-makerspace-a-guide-for-teachers/,Check out the XQ Learner Goals (includes printable posters)
MABE MakerLab | Makerspaces - MakeSchools,http://make.xsead.cmu.edu/knowledgebase/spaces/spaces/mabe-makerlab,← Back to Makerspaces
Tennessee Tech University,https://makerspacedir.com/listing/tennessee-tech-university/,"Write a review · 1 William L Jones Dr, Cookeville, TN 38505"
Knoxville Program Profile,https://www.makerusa.org/knoxville-profile,"May 10, 2024 — The event is hosted by the Tennessee College of Applied Technology Knoxville"
MakerSpace,https://mtsunews.com/tag/makerspace/,Katie Enzor has been named the new director of development initiatives for Middle Tennessee State University's James E
Other Makerspaces,http://wiki.makersmiths.org/display/MAK/Other+Makerspaces?src=contextnavpagetreemode,Tennessee
Makerspace,https://www.tellicoplainspubliclibrary.org/makerspace.html,makerspace
1st Maker Space: Design Your Makerspace Today,https://1stmakerspace.com/?srsltid=AfmBOorKzxROwVSdv10AfMNV0ebOvD8dQljdnM35C8kapn8lm5lMMA-g,Over 250+ K-12 schools and community centers across the United States have invested in a full makerspace with 1st Maker Space
MakerSpace Session,https://memphis.librarycalendar.com/event/copy-makerspace-session-8834,Location Details
Library Technology Specialist - MakerSpace,https://www.tealhq.com/job/library-technology-specialist-maker-space_1e47e139-ff9f-46ae-88f2-da79c6220cbd,The Library Technology Specialist - MakerSpace at Middle Tennessee State University is responsible for providing technical support and training for the 
makerspace jobs - Code4Lib Job Board,https://jobs.code4lib.org/tags/makerspace,Library Technology Specialist - MakerSpace
"STEM Lab Coordinator, Makerspace - Vanderbilt University",https://www.talentify.io/job/stem-lab-coordinator-makerspace-nashville-tennessee-vanderbilt-university-10005351,"STEM Lab Coordinator, Makerspace"
Braingineers Lab: STEM Afterschool Workshops Maker ...,https://www.braingineerslab.com/,"Braingineers Lab STEAM/STEM After school workshops for Elementary, Middle School, and Homeschool"
Maker Space in Nashville TN,https://www.instructables.com/Maker-Space-in-Nashville-TN/,Maker Space in Nashville TN: Hey everyone
Dec 17: Tour the Cumberland Business Incubator & Maker ...,https://www.roanestate.edu/?13937-News-Dec-17-Tour-the-Cumberland-Business-Incubator-and-Maker-Space,"Nov 26, 2024 — College faculty, staff, students, and members of the community are invited to explore the CBI and its Maker Space "
Green Hills Teen Center Upcoming Events,https://www.ymcamidtn.org/locations/green-hills/youth-and-teens/events,MAKERSPACE: Monday-Wednesday 3:00 
Space Availability - MakerSpace Green Screen Room (201D),https://mtsu.libcal.com/space/43626,MakerSpace Green Screen Room (201D) (Makerspace Equipment 
"Makerspaces: No Access, No Impact | Jeremy Mitchell",https://palaciomagazine.com/makerspaces-no-access-no-impact-jeremy-mitchell/,
"ChattLab Makerspace - Chattanooga, TN",https://www.yelp.com/biz/chattlab-makerspace-chattanooga,"1 review and 6 photos of CHATTLAB MAKERSPACE ""This is a non profit workplace where a membership gives you access to all kinds of tools to work with wood, "
A school makerspace inspires STEM invention everywhere,https://districtadministration.com/makerspace-inspires-stem-invention/,"Apr 24, 2019 — This 'makerspace” in Tennessee's Putnam County Schools relies more on green thumbs than tech knowhow"
MidsouthMakers - Memphis area makerspace,https://www.meetup.com/midsouthmakers/,
Makerspace Hackerspace opens in Clarksville,https://www.reddit.com/r/Clarksville/comments/1dqugo/makerspace_hackerspace_opens_in_clarksville/,15K subscribers in the Clarksville community
What is a Makerspace? Is it a Hackerspace or ...,https://www.makerspaces.com/what-is-a-makerspace/,"A makerspace is a collaborative work space inside a school, library or public/private facility for making, learning, exploring and sharing"
Makerspaces Are Transforming My School. Here's How,https://edtechmagazine.com/k12/article/2020/02/makerspaces-are-transforming-my-school-heres-how,"Feb 20, 2020 — Allowing students to explore STEM careers is a key part of one Tennessee school's work to boost achievement"
Girls Inc. opens new Makerspace in Morristown to host ...,https://www.wvlt.tv/2023/06/28/we-can-create-whatever-we-want-girls-only-club-breaking-boundaries-east-tenn-girls/,"Jun 27, 2023 — Parents can still sign "
"Students handcraft gifts, taking a break from the stress of ...",https://www.utdailybeacon.com/students-handcraft-gifts-taking-a-break-from-the-stress-of-finals/article_06651686-b263-11ef-9a98-eb3eceb27ec3.html,"19 hours ago — Isabella Vrba, a junior studying psychology, has worked with Makerspace since last semester"
UTK Libraries | Buttons & Bracelets Open House! 🤩 Drop in ...,https://www.instagram.com/utklibraries/p/CzHhCsAAPN3/,
Ismail Fidan's Post,https://www.linkedin.com/posts/fidan_tennessee-techs-maker-space-provides-a-number-activity-7006750666471723008-Y46y,"Tennessee Tech's Maker Space provides a number of services to students, faculty, staff, and the community"
"The ChattLab Makerspace in Chattanooga, TN - NOOGAtoday",https://noogatoday.6amcity.com/chattlab-makerspace-chattanooga-tn,"Aug 23, 2021 — Welcome to the ChattLab"
iLab (The Ideation Laboratory) | Makerspaces - MakeSchools,http://make.xsead.cmu.edu/knowledgebase/spaces/spaces/ilab-the-ideation-laboratory,"This facility provides students, faculty and the East Tennessee community with tools for rapid prototyping of ideas into first prototype products for plastic, "
Mini Maker Space - Chattanooga Public Library,https://chattlibrary.org/event/mini-maker-space/2024-01-06/,"Jan 6, 2024 — "
Opening Makerspace TN,https://www.youtube.com/watch?v=bWuhHjvBFtI,
MTSU uses 3D printers to help health care workers guard ...,https://mtsunews.com/library-3d-printer-headbands/,"Mar 26, 2020 — Walker Library Makerspace, makes face shield headbands that will be shipped to the Tennessee "
Public Library - Clarksville,https://mcgtn.org/publiclibrary/about/history,"The Tennessee Electronic Library also came into being, bringing even more "
Library and Makerspace - Oak Ridge High School,https://www.ortn.edu/highschool/academics/library/,"Aug 11, 2022 — "
MTSU Walker Library hosts Makerspace Open House for ...,https://mtsusidelines.com/2017/09/29/mtsu-walker-library-hosts-makerspace-open-house-for-technology-enthusiasts/,"Sep 29, 2017 — Featured Photo by Myles Valrie Story by Jacob Burgess The 2024 edition of the 100 Miles of Hate rivalry"
A Librarian's Guide to Makerspaces: 16 Resources,https://www.oedb.org/ilibrarian/a-librarians-guide-to-makerspaces/,Tennessee · Texas · Utah · Vermont · Virginia · Washington · Washington DC · West Virginia 
